industry,issue_share,listed_value,listing_date,market_cap,name,sector,subsector,supersector,symbol
Technology,148003518.0,148003518.0,18/01/2008 00:00:00,1798238977200.0,Saigon Telecommunication And Technologies Corporation,Software & Computer Services,Internet,Technology,SGT
Basic Materials,33446675.0,33446675.0,30/11/2016 00:00:00,133452233250.0,Son Ha Sai Gon Joint Stock Company,Industrial Metals & Mining,Steel,Basic Resources,SHA
Banks,2667369799.0,2667369799.0,20/04/2009 00:00:00,31742280553500.0,Saigon-Hanoi Commercial Joint Stock Bank,Banks,Banks,Banks,SHB
Industrials,4309550.0,4309550.0,13/10/2017 00:00:00,36631175000.0,Sai Gon Maritime Joint Stock Company,Industrial Transportation,Marine Transportation,Industrial Goods & Services,SHC
Consumer Goods,9585511.0,9585511.0,25/01/2019 00:00:00,83393945700.0,Son Ha Development of Renewable Energy Joint Stock Company,Household Goods & Home Construction,Durable Household Products,Personal & Household Goods,SHE
Industrials,27000000.0,27000000.0,10/04/2015 00:00:00,56457000000.0,SongHong Joint Stock Corporation,Construction & Materials,Heavy Construction,Construction & Materials,SHG
Basic Materials,162176449.0,162176449.0,30/12/2009 00:00:00,2427863835000.0,Sonha International Corporation,Industrial Metals & Mining,Steel,Basic Resources,SHI
Basic Materials,129607147.0,129607147.0,16/12/2009 00:00:00,997975031900.0,Hanoi Investment General Corporation,Mining,Coal,Basic Resources,SHN
Utilities,101206352.0,101206352.0,10/09/2010 00:00:00,2636425469600.0,Southern Hydropower Joint Stock Company,Electricity,Conventional Electricity,Utilities,SHP
Financials,813156748.0,813156748.0,25/06/2009 00:00:00,7155779382400.0,Sai Gon - Ha Noi Securities Joint Stock Company,Financial Services,Investment Services,Financial Services,SHS
Consumer Services,1720000.0,1720000.0,11/10/2016 00:00:00,4988000000.0,Sai gon Train Joint Stock Company,Travel & Leisure,Travel & Tourism,Travel & Leisure,SHX
Industrials,23999270.0,23999270.0,27/12/2006 00:00:00,443986384000.0,ANI Joint Stock Company,Construction & Materials,Heavy Construction,Construction & Materials,SIC
Financials,100000000.0,100000000.0,09/01/2017 00:00:00,794600000000.0,Saigon Co.op Investment Development Joint Stock Company,Real Estate Investment & Services,Real Estate Holding & Development,Real Estate,SID
Industrials,10000000.0,10000000.0,10/10/2019 00:00:00,68000000000.0,Song Da Investment and Trading Joint Stock Company ,Construction & Materials,Heavy Construction,Construction & Materials,SIG
Utilities,64522104.0,64522104.0,12/09/2012 00:00:00,874274509200.0,Saigon Water Infrastructure Corporation,"Gas, Water & Multi-utilities",Water,Utilities,SII
Financials,90904146.0,90904146.0,06/06/2019 00:00:00,6112576585332.0,Saigon VRG Investment Corporation,Real Estate Investment & Services,Real Estate Holding & Development,Real Estate,SIP
Basic Materials,3012374.0,3012374.0,23/05/2017 00:00:00,106939277000.0,SIVICO Joint Stock Company,Chemicals,Specialty Chemicals,Chemicals,SIV
Consumer Goods,23485154.0,23485154.0,29/12/2006 00:00:00,302945457600.0,Hung Hau Agricultural Corporation,Food Producers,Farming & Fishing,Food & Beverage,SJ1
Industrials,7226082.0,7226082.0,21/11/2007 00:00:00,108085512252.0,Song Da 1.01 Joint Stock Company,Construction & Materials,Heavy Construction,Construction & Materials,SJC
Utilities,68998620.0,68998620.0,25/12/2006 00:00:00,1034979300000.0,Can Don Hydropower Joint Stock Company,Electricity,Conventional Electricity,Utilities,SJD
Industrials,21971826.0,21971826.0,14/12/2006 00:00:00,577859023800.0,Song Da No11 Joint Stock Company,Construction & Materials,Heavy Construction,Construction & Materials,SJE
Basic Materials,79200000.0,79200000.0,05/07/2017 00:00:00,257400000000.0,Sunstar Investment Joint Stock Company,Chemicals,Specialty Chemicals,Chemicals,SJF
Industrials,449537112.0,449537112.0,12/02/2018 00:00:00,5843982456000.0,Song Da Corporation,Construction & Materials,Heavy Construction,Construction & Materials,SJG
Industrials,5000000.0,5000000.0,10/01/2008 00:00:00,31165000000.0,Song Da 19 Joint Stock Company,Construction & Materials,Heavy Construction,Construction & Materials,SJM
Financials,114855540.0,114855540.0,06/07/2006 00:00:00,5467079040000.0,Song Da Urban &amp; Industrial Zone Investment and Development Joint Stock Company,Real Estate Investment & Services,Real Estate Holding & Development,Real Estate,SJS
Consumer Services,63331735.0,63331735.0,08/07/2014 00:00:00,886644290000.0,Superdong - Kien Giang Fast Ferry Joint Stock Company,Travel & Leisure,Travel & Tourism,Travel & Leisure,SKG
Consumer Goods,16126740.0,16126740.0,25/10/2017 00:00:00,765600000000.0,Khanh Hoa Sanest Soft Drink Joint Stock Company,Beverages,Soft Drinks,Food & Beverage,SKH
Consumer Goods,5000000.0,5000000.0,10/10/2018 00:00:00,33000000000.0,Sanna Khanh Hoa Beverage Joint Stock Company,Beverages,Soft Drinks,Food & Beverage,SKN
Consumer Goods,23000000.0,23000000.0,03/11/2017 00:00:00,637100000000.0,Khanh Hoa Salanges Nest Soft Drink Joint Stock Company,Beverages,Soft Drinks,Food & Beverage,SKV
Consumer Goods,9791945.0,9791945.0,16/10/2012 00:00:00,1194617290000.0,Son La Sugar Joint Stock Company,Food Producers,Food Products,Food & Beverage,SLS
Utilities,20352836.0,20352836.0,19/10/2010 00:00:00,142469852000.0,Saigon Machinery Spare Parts Joint Stock Company,Electricity,Conventional Electricity,Utilities,SMA
Consumer Goods,29846648.0,29846648.0,08/09/2010 00:00:00,1298329188000.0,Sai Gon - Mien Trung Beer Joint Stock Company,Beverages,Brewers,Food & Beverage,SMB
Basic Materials,73678587.0,73678587.0,30/10/2006 00:00:00,739748711850.0,SMC Investment Trading Joint Stock Company,Industrial Metals & Mining,Steel,Basic Resources,SMC
Consumer Services,4405000.0,4405000.0,14/07/2015 00:00:00,58320500000.0,South Books and Educational Equipment Joint Stock Company,Media,Publishing,Media,SMN
Technology,5467432.0,5467432.0,30/07/2010 00:00:00,38272024000.0,SAMETEL Corporation,Technology Hardware & Equipment,Telecommunications Equipment,Technology,SMT
Consumer Goods,5000000.0,5000000.0,11/11/2014 00:00:00,75000000000.0,Nam Can Seaproducts Import Export Joint Stock Company,Food Producers,Farming & Fishing,Food & Beverage,SNC
Industrials,376500000.0,376500000.0,20/11/2017 00:00:00,7833288390800.0,Sonadezi Corporation,Construction & Materials,Heavy Construction,Construction & Materials,SNZ
Utilities,20746000.0,20746000.0,30/09/2016 00:00:00,307633291000.0,Su Pan 2 Hydropower Joint Stock Company,Electricity,Conventional Electricity,Utilities,SP2
Consumer Goods,9500000.0,9500000.0,17/10/2016 00:00:00,307800000000.0,Phu Bai Spinning Joint Stock Company,Personal Goods,Clothing & Accessories,Personal & Household Goods,SPB
Basic Materials,10530000.0,10530000.0,09/09/2010 00:00:00,155844000000.0,Saigon Plant Protection Joint Stock Company,Chemicals,Specialty Chemicals,Chemicals,SPC
Consumer Goods,12000000.0,12000000.0,22/04/2010 00:00:00,138000000000.0,Danang Seaproducts Import - Export Corporation,Food Producers,Farming & Fishing,Food & Beverage,SPD
Consumer Goods,10000000.0,10000000.0,20/05/2014 00:00:00,135000000000.0,Ha Noi Seaproducts Import Export Joint Stock Corporation,Food Producers,Farming & Fishing,Food & Beverage,SPH
Basic Materials,16815000.0,16815000.0,26/09/2012 00:00:00,47082000000.0,Spiral Galaxy Joint Stock Company,Mining,General Mining,Basic Resources,SPI
Health Care,14000000.0,14000000.0,21/05/2010 00:00:00,192780000000.0,S.P.M Corporation,Pharmaceuticals & Biotechnology,Pharmaceuticals,Health Care,SPM
Industrials,25120000.0,25120000.0,25/09/2008 00:00:00,14946400000.0,Saigon Plastic Packaging Joint Stock Company,General Industrials,Containers & Packaging,Industrial Goods & Services,SPP
Consumer Goods,10800000.0,10800000.0,14/02/2017 00:00:00,142560000000.0,Special Aquatic Products Joint Stock Company,Food Producers,Farming & Fishing,Food & Beverage,SPV
Basic Materials,110000000.0,110000000.0,17/12/2009 00:00:00,1399500857000.0,Sai Gon - Quy Nhon Mining Corporation,Mining,General Mining,Basic Resources,SQC
Technology,43199974.0,43199974.0,18/01/2008 00:00:00,142559914200.0,Sara Vietnam Joint Stock Company,Software & Computer Services,Software,Technology,SRA
Technology,8500000.0,8500000.0,17/03/2008 00:00:00,15385000000.0,Sara Joint Stock Company,Software & Computer Services,Software,Technology,SRB
Consumer Goods,28065765.0,28065765.0,07/10/2009 00:00:00,468658245600.0,Sao Vang Rubber Joint Stock Company,Automobiles & Parts,Tires,Automobiles & Parts,SRC
Industrials,35566780.0,35566780.0,21/10/2009 00:00:00,332799783000.0,Searefico Corporation,Industrial Engineering,Industrial Machinery,Industrial Goods & Services,SRF
Consumer Services,50310000.0,50310000.0,25/11/2016 00:00:00,226395000000.0,Saigon Railway Transport Joint Stock Company,Travel & Leisure,Travel & Tourism,Travel & Leisure,SRT
Banks,1980898268.0,1980898268.0,24/03/2021 00:00:00,64779470009000.0,Southeast Asia Commercial Joint Stock Bank,Banks,Banks,Banks,SSB
Consumer Goods,14992367.0,14992367.0,01/03/2005 00:00:00,374927926250.0,Southern Seed Joint-stock Company,Food Producers,Farming & Fishing,Food & Beverage,SSC
Consumer Goods,3200000.0,3200000.0,20/04/2010 00:00:00,32000555000.0,G Sai Gon Education Joint Stock Company,Personal Goods,Footwear,Personal & Household Goods,SSF
Industrials,5000000.0,5000000.0,05/01/2011 00:00:00,33872092000.0,Seagull Shipping Company,Industrial Transportation,Marine Transportation,Industrial Goods & Services,SSG
Financials,375000000.0,375000000.0,04/08/2021 00:00:00,26166375000000.0,Sunshine Homes Development Joint Stock Company,Real Estate Investment & Services,Real Estate Holding & Development,Real Estate,SSH
Financials,1491130137.0,1491130137.0,15/12/2006 00:00:00,27251237642700.0,SSI Securities Corporation,Financial Services,Investment Services,Financial Services,SSI
Basic Materials,5501024.0,5501024.0,17/11/2008 00:00:00,21768898800.0,Steel Structure Manufacture Joint Stock Company,Industrial Metals & Mining,Steel,Basic Resources,SSM
Consumer Goods,39600000.0,39600000.0,15/10/2013 00:00:00,130838400000.0,Saigon Sea Products Import Export Joint Stock Corporation,Food Producers,Farming & Fishing,Food & Beverage,SSN
Technology,25720902.0,25720902.0,18/12/2007 00:00:00,202166289720.0,Sieu Thanh Joint Stock Corporation,Technology Hardware & Equipment,Electronic Office Equipment,Technology,ST8
Banks,1885215716.0,1885215716.0,12/07/2006 00:00:00,44302569326000.0,SaiGon Thuong Tin Commercial Joint Stock Bank,Banks,Banks,Banks,STB
Consumer Services,5665530.0,5665530.0,27/12/2006 00:00:00,104812305000.0,Book And Educational Equipment Joint Stock Company of Ho Chi Minh City,Media,Publishing,Media,STC
Industrials,98253357.0,98253357.0,02/03/2010 00:00:00,4126640994000.0,South Logistics Joint Stock Company,Industrial Transportation,Transportation Services,Industrial Goods & Services,STG
Consumer Services,19500000.0,19500000.0,17/03/2020 00:00:00,95550000000.0,Thai Nguyen Book Distribution Joint Stock Company,Media,Publishing,Media,STH
Consumer Goods,84363825.0,84363825.0,30/09/2015 00:00:00,2119194332500.0,Century Synthetic Fiber Corporation,Personal Goods,Clothing & Accessories,Personal & Household Goods,STK
Financials,15000000.0,15000000.0,23/09/2008 00:00:00,20430000000.0,SongDa - ThangLong Joint Stock Company,Real Estate Investment & Services,Real Estate Holding & Development,Real Estate,STL
Industrials,8045744.0,8045744.0,09/10/2006 00:00:00,53747822100.0,Song Da Industry Trade Joint Stock Company,General Industrials,Containers & Packaging,Industrial Goods & Services,STP
Industrials,2768221.0,2768221.0,30/03/2010 00:00:00,66136593700.0,Saigon Transport Agency Joint Stock Company,Industrial Transportation,Trucking,Industrial Goods & Services,STS
Consumer Services,8000000.0,8000000.0,08/07/2011 00:00:00,19248000000.0,Saigon Tourist Transport Corporation,Travel & Leisure,Travel & Tourism,Travel & Leisure,STT
Utilities,15863133.0,15863133.0,06/07/2018 00:00:00,63452532000.0,Soc Trang Water Supply Joint Stock Company,"Gas, Water & Multi-utilities",Water,Utilities,STW
Consumer Goods,33320532.0,33320532.0,21/12/2006 00:00:00,3347658216000.0,Sai Gon General Service Corporation,Automobiles & Parts,Automobiles,Automobiles & Parts,SVC
Consumer Goods,25800000.0,25800000.0,02/02/2021 00:00:00,83093783080.0,Vu Dang Investment & Trading Joint Stock Company,Personal Goods,Clothing & Accessories,Personal & Household Goods,SVD
Industrials,29350000.0,29350000.0,06/04/2016 00:00:00,140880000000.0,Industrial Gas and Welding Electrode Joint Stock Company,General Industrials,Diversified Industrials,Industrial Goods & Services,SVG
Utilities,14820662.0,14820662.0,28/12/2017 00:00:00,88923972000.0,Song Vang HydroPower Joint Stock Company,Electricity,Conventional Electricity,Utilities,SVH
Industrials,12832437.0,12832437.0,22/12/2008 00:00:00,816142993200.0,Bien Hoa Packaging Joint Stock Company,General Industrials,Containers & Packaging,Industrial Goods & Services,SVI
Industrials,21000000.0,21000000.0,26/07/2011 00:00:00,86100000000.0,Vexilla Viet Nam Group Joint Stock Company,Construction & Materials,Heavy Construction,Construction & Materials,SVN
Basic Materials,15053369.0,15053369.0,05/10/2011 00:00:00,161071048300.0,Sai Gon Vien Dong Technology Joint Stock Company,Forestry & Paper,Paper,Basic Resources,SVT
Industrials,67100000.0,67100000.0,29/04/2011 00:00:00,1356963300000.0,Southern Waterborne Transport Corporation,Industrial Transportation,Marine Transportation,Industrial Goods & Services,SWC
Financials,30000000.0,30000000.0,20/12/2019 00:00:00,792000000000.0,Sonadezi Long Binh Share Holding Company,Real Estate Investment & Services,Real Estate Holding & Development,Real Estate,SZB
Financials,100000000.0,100000000.0,15/01/2019 00:00:00,2690000000000.0,Sonadezi Chau Duc Shareholding Company,Real Estate Investment & Services,Real Estate Holding & Development,Real Estate,SZC
Industrials,30000000.0,30000000.0,09/12/2016 00:00:00,357000000000.0,Sonadezi Environment Joint Stock Company,Support Services,Waste & Disposal Services,Industrial Goods & Services,SZE
Financials,54898000.0,54898000.0,27/12/2021 00:00:00,1800654400000.0,Sonadezi Giang Dien Shareholding Company,Real Estate Investment & Services,Real Estate Holding & Development,Real Estate,SZG
Financials,20000000.0,20000000.0,09/09/2008 00:00:00,909545000000.0,Sonadezi Long Thanh Shareholding Company,Real Estate Investment & Services,Real Estate Holding & Development,Real Estate,SZL
Industrials,2309908.0,2309908.0,05/01/2018 00:00:00,13166475600.0,386 Thanh An Construction and Investment Joint Stock Company,Construction & Materials,Heavy Construction,Construction & Materials,TA3
Industrials,3000000.0,3000000.0,28/11/2017 00:00:00,41700000000.0,"Thanh An 665 Investment, Installation And Construction Joint Stock Company",Construction & Materials,Heavy Construction,Construction & Materials,TA6
Industrials,12419787.0,12419787.0,31/07/2015 00:00:00,150279422700.0,Thanh An 96 Construction and Installation Joint Stock Company,Construction & Materials,Heavy Construction,Construction & Materials,TA9
Financials,24914991.0,24914991.0,12/01/2010 00:00:00,2767465393200.0,Tran Anh Digital World Joint Stock Company,Real Estate Investment & Services,Real Estate Holding & Development,Real Estate,TAG
Consumer Goods,1613690.0,1613690.0,10/06/2019 00:00:00,88914319000.0,Thuan An Coffee Joint Stock Company,Beverages,Soft Drinks,Food & Beverage,TAN
Consumer Goods,78319777.0,78319777.0,20/02/2019 00:00:00,900677435500.0,Trung An Hi-tech Farming Joint Stock Company,Food Producers,Farming & Fishing,Food & Beverage,TAR
Utilities,5000000.0,5000000.0,29/07/2016 00:00:00,99500000000.0,Trung An Water Supply Joint Stock Company,"Gas, Water & Multi-utilities",Water,Utilities,TAW
Industrials,1250000.0,1250000.0,30/12/2016 00:00:00,11375000000.0,VVMI - Manufacturing and Materials Equipment Trading Joint Stock Company,General Industrials,Containers & Packaging,Industrial Goods & Services,TB8
Utilities,63500000.0,63500000.0,19/10/2009 00:00:00,1847850000000.0,Thac Ba Hydropower Joint Stock Company,Electricity,Conventional Electricity,Utilities,TBC
Industrials,32486392.0,32486392.0,15/10/2014 00:00:00,3728115080000.0,Dong Anh Electrical Equipment Corporation,Electronic & Electrical Equipment,Electronic Equipment,Industrial Goods & Services,TBD
Industrials,93117800.0,93117800.0,13/08/2021 00:00:00,528909104000.0,General Department Store Joint Stock Company,Industrial Transportation,Transportation Services,Industrial Goods & Services,TBH
Financials,8060000.0,8060000.0,20/07/2022 00:00:00,49166000000.0,Tan Binh Real Estate Joint Stock Company,Real Estate Investment & Services,Real Estate Holding & Development,Real Estate,TBR
Industrials,1656470.0,1656470.0,01/03/2010 00:00:00,9110585000.0,Bentre Transportation Works Contruction Joint Stock Company,Construction & Materials,Heavy Construction,Construction & Materials,TBT
Industrials,1510280.0,1510280.0,18/11/2008 00:00:00,33679244000.0,Thai Binh Cement Joint Stock Company,Construction & Materials,Building Materials & Fixtures,Construction & Materials,TBX
Basic Materials,32496105.0,32496105.0,26/06/2008 00:00:00,152731693500.0,Vinacomin - Coc Sau Coal Joint Stock Company,Mining,Coal,Basic Resources,TC6
Banks,3510914798.0,3510914798.0,04/06/2018 00:00:00,97075782986400.0,Vietnam Technological And Commercial Joint Stock Bank,Banks,Banks,Banks,TCB
Industrials,244418304.0,244418304.0,26/05/2017 00:00:00,1478730739200.0,Transport and Industry Development Investment Joint Stock Company,Construction & Materials,Heavy Construction,Construction & Materials,TCD
Financials,668215843.0,668215843.0,05/10/2016 00:00:00,4650782267280.0,Hoang Huy Investment Financial Services Joint Stock Company,Real Estate Investment & Services,Real Estate Holding & Development,Real Estate,TCH
Financials,100979982.0,100979982.0,05/09/2018 00:00:00,689693277060.0,ThanhCong Securities Company,Financial Services,Investment Services,Financial Services,TCI
Consumer Goods,10000000.0,10000000.0,24/11/2017 00:00:00,50000000000.0,To Chau Joint Stock Company,Food Producers,Farming & Fishing,Food & Beverage,TCJ
Industrials,23850000.0,23850000.0,27/10/2017 00:00:00,93015000000.0,Construction Machinery Corporation - JSC,Construction & Materials,Heavy Construction,Construction & Materials,TCK
Industrials,30158436.0,30158436.0,24/12/2009 00:00:00,922848141600.0,Tan Cang Logistics and Stevedoring Join Stock Company,Industrial Transportation,Trucking,Industrial Goods & Services,TCL
Consumer Goods,82047127.0,82047127.0,15/10/2007 00:00:00,4253032536300.0,Thanh Cong Textile Garment Investment Trading Joint Stock Company,Personal Goods,Clothing & Accessories,Personal & Household Goods,TCM
Industrials,18711000.0,18711000.0,27/02/2012 00:00:00,125176590000.0,Duyen Hai Multi Modal Transport Joint Stock Company,Industrial Transportation,Trucking,Industrial Goods & Services,TCO
Industrials,10373190.0,10373190.0,29/12/2006 00:00:00,154445482800.0,Taicera Enterprise Company,Construction & Materials,Building Materials & Fixtures,Construction & Materials,TCR
Consumer Services,12788000.0,12788000.0,06/12/2006 00:00:00,460368000000.0,Tay Ninh Cable Car Tour Company,Travel & Leisure,Travel & Tourism,Travel & Leisure,TCT
Industrials,19991020.0,19991020.0,26/06/2017 00:00:00,489779990000.0,Tan Cang Warehousing Joint Stock Company,Industrial Transportation,Transportation Services,Industrial Goods & Services,TCW
Utilities,8230000.0,8230000.0,19/07/2017 00:00:00,292165000000.0,Dinh Binh Hydropower Joint Stock Company,Electricity,Conventional Electricity,Utilities,TDB
Financials,100000000.0,100000000.0,04/05/2010 00:00:00,1065000000000.0,Binhduong Trade And Development Joint Stock Company,Real Estate Investment & Services,Real Estate Services,Real Estate,TDC
Industrials,30000000.0,30000000.0,12/05/2020 00:00:00,540000000000.0,Trung Do Joint Stock Company,Construction & Materials,Building Materials & Fixtures,Construction & Materials,TDF
Utilities,16770000.0,16770000.0,15/06/2017 00:00:00,60372000000.0,TDG Global Investment Joint Stock Company,"Gas, Water & Multi-utilities",Gas Distribution,Utilities,TDG
Financials,112652767.0,112652767.0,14/12/2006 00:00:00,321060385950.0,Thu Duc Housing Development Corporation,Real Estate Investment & Services,Real Estate Holding & Development,Real Estate,TDH
Utilities,100000000.0,100000000.0,01/04/2016 00:00:00,3600000000000.0,Thu Dau Mot Water Joint Stock Company,"Gas, Water & Multi-utilities",Water,Utilities,TDM
Basic Materials,29439097.0,29439097.0,21/11/2008 00:00:00,220793227500.0,Vinacomin - Deo Nai Coal Joint Stock Company,Mining,Coal,Basic Resources,TDN
Industrials,60210902.0,60210902.0,12/11/2018 00:00:00,2191668050000.0,Thuan Duc Joint Stock Company,General Industrials,Containers & Packaging,Industrial Goods & Services,TDP
Basic Materials,12225393.0,12225393.0,06/10/2011 00:00:00,158930109000.0,VNSTEEL - Thu Duc Steel Joint Stock Company,Industrial Metals & Mining,Steel,Basic Resources,TDS
Consumer Goods,23896534.0,23896534.0,18/07/2018 00:00:00,188782618600.0,TDT Investment And Development Joint Stock Company,Personal Goods,Clothing & Accessories,Personal & Household Goods,TDT
Utilities,8500000.0,8500000.0,11/11/2010 00:00:00,342125000000.0,Thu Duc Water Supply Joint Stock Company,"Gas, Water & Multi-utilities",Water,Utilities,TDW
Industrials,12500000.0,12500000.0,10/05/2022 00:00:00,387500000000.0,Transport Engineering Design InCorporated,Construction & Materials,Heavy Construction,Construction & Materials,TED
Financials,65591772.0,65591772.0,22/12/2015 00:00:00,540476201280.0,Truong Thanh Energy and Real Estate Joint Stock Company,Real Estate Investment & Services,Real Estate Holding & Development,Real Estate,TEG
Industrials,5000000.0,5000000.0,26/09/2017 00:00:00,36000000000.0,Telecommunication Project Construction Development Joint Stock Company,Construction & Materials,Heavy Construction,Construction & Materials,TEL
Consumer Goods,5702940.0,5702940.0,28/04/2010 00:00:00,172799082000.0,Northern Textiles And Garments Joint Stock Company (TEXTACO),Personal Goods,Clothing & Accessories,Personal & Household Goods,TET
Consumer Goods,16829994.0,16829994.0,03/12/2015 00:00:00,100979964000.0,Trang Corporation,Food Producers,Food Products,Food & Beverage,TFC
Industrials,27299990.0,27299990.0,25/05/2018 00:00:00,112748958700.0,Louis Capital Joint Stock Company,Construction & Materials,Heavy Construction,Construction & Materials,TGG
Industrials,10000000.0,10000000.0,24/06/2009 00:00:00,46964750000.0,Truong Phu Joint Stock Company,Electronic & Electrical Equipment,Electrical Components & Equipment,Industrial Goods & Services,TGP
Consumer Services,13539267.0,13539267.0,11/11/2009 00:00:00,40617678000.0,The Vietnam National General Export - Import Joint Stock Company No.1,Food & Drug Retailers,Food Retailers & Wholesalers,Retail,TH1
Consumer Goods,11424570.0,11424570.0,19/11/2008 00:00:00,143949582000.0,Ha Noi - Thanh Hoa Beer Joint Stock Company,Beverages,Brewers,Food & Beverage,THB
Financials,350000000.0,350000000.0,19/06/2020 00:00:00,12950000000000.0,Thaiholdings Joint Stock Company,Real Estate Investment & Services,Real Estate Holding & Development,Real Estate,THD
Industrials,19963893.0,19963893.0,28/07/2011 00:00:00,850461841800.0,Tien Giang Investment and Construction Joint Stock Company,Construction & Materials,Heavy Construction,Construction & Materials,THG
Industrials,48800000.0,48800000.0,15/06/2017 00:00:00,1205360000000.0,Electrical Equipment Joint Stock Company,Electronic & Electrical Equipment,Electronic Equipment,Industrial Goods & Services,THI
Utilities,32995411.0,32995411.0,05/10/2017 00:00:00,122083020700.0,Thanh Hoa Water Supply Joint Stock Company,"Gas, Water & Multi-utilities",Water,Utilities,THN
Consumer Goods,21611185.0,21611185.0,18/11/2019 00:00:00,216107850000.0,Thuan Phuoc Seafoods and trading corporation,Food Producers,Farming & Fishing,Food & Beverage,THP
Consumer Services,3000000.0,3000000.0,12/11/2013 00:00:00,54810000000.0,Song Da Thanh Hoa Joint Stock Company,General Retailers,Broadline Retailers,Retail,THS
Basic Materials,24569052.0,24569052.0,24/10/2008 00:00:00,213750752400.0,Vinacomin - Ha Tu Coal Joint Stock Company,Mining,Coal,Basic Resources,THT
Industrials,3297790.0,3297790.0,06/06/2017 00:00:00,32318342000.0,Thanh Hoa Urban Construction and Environment Joint Stock Company,Support Services,Waste & Disposal Services,Industrial Goods & Services,THU
Utilities,5000000.0,5000000.0,01/03/2016 00:00:00,42982800000.0,Tan Hoa Water Supply Joint Stock Company,"Gas, Water & Multi-utilities",Water,Utilities,THW
Financials,200000000.0,200000000.0,12/12/2018 00:00:00,5221200000000.0,Tin Nghia Corporation,Real Estate Investment & Services,Real Estate Holding & Development,Real Estate,TID
Industrials,9569900.0,9569900.0,11/12/2009 00:00:00,24977439000.0,Telecommunications Industry Electronics Joint Stock Company,Electronic & Electrical Equipment,Electrical Components & Equipment,Industrial Goods & Services,TIE
Financials,176006485.0,176006485.0,08/10/2010 00:00:00,1513655771000.0,ThangLong Investment Group Joint Stock Company,Real Estate Investment & Services,Real Estate Holding & Development,Real Estate,TIG
,0,0,,893968929644.0,,,,,TIN
Financials,65007857.0,65007857.0,06/06/2016 00:00:00,1140887890350.0,Tin Nghia Industrial Park Development Joint Stock Company,Real Estate Investment & Services,Real Estate Holding & Development,Real Estate,TIP
Basic Materials,184000000.0,184000000.0,24/03/2011 00:00:00,939815301200.0,Thai Nguyen Iron and Steel Joint Stock Corporation,Industrial Metals & Mining,Steel,Basic Resources,TIS
Financials,30000000.0,30000000.0,25/11/2009 00:00:00,975000000000.0,Tan Binh Import - Export Joint Stock Corporation,Real Estate Investment & Services,Real Estate Holding & Development,Real Estate,TIX
