_id,author,content,tags,authorSlug,length,dateAdded,dateModified
0mRrz9znDm,Bill Watterson,All this modern technology just makes people try to do everything at once.,['technology'],bill-watterson,74,2020-07-10,2020-07-10
tvXaBe-wkKU,Octavia E. Butler,Sometimes being a friend means mastering the art of timing. There is a time for silence. A time to let go and allow people to hurl themselves into their own destiny. And a time to prepare to pick up the pieces when it's all over.,['friendship'],octavia-e-butler,229,2020-07-10,2020-07-10
CBJHf3W4l,Kahlil Gibran,Your friend is your needs answered.,['friendship'],kahlil-gibran,35,2020-07-10,2020-07-10
C71_HiGpvT2j,Confucius,The superior man is satisfied and composed; the mean man is always full of distress.,['wisdom'],confucius,84,2020-06-24,2022-07-04
zJg0xZQ2Hk2f,Henry Ford,Obstacles are those frightful things you see when you take your eyes off your goal.,"['famous-quotes', 'wisdom']",henry-ford,83,2020-06-24,2020-06-24
sHokWyhncAPe,Laozi,From wonder into wonder existence opens.,['wisdom'],laozi,40,2020-06-24,2022-07-04
Rp9oE96Hqv9j,Napoleon Hill,Cherish your visions and your dreams as they are the children of your soul; the blueprints of your ultimate achievements.,['famous-quotes'],napoleon-hill,121,2020-06-24,2020-06-24
QIgGGw79Wb,Helen Keller,Walking with a friend in the dark is better than walking alone in the light.,['friendship'],helen-keller,76,2020-06-24,2020-06-24
O1oEhziR2P7H,Cicero,We must not say every mistake is a foolish one.,['famous-quotes'],cicero,47,2020-06-24,2020-06-24
LnGZJqhevdWo,Dalai Lama,"The most important thing is transforming our minds, for a new way of thinking, a new outlook: we should strive to develop a new inner world.",['famous-quotes'],dalai-lama,140,2020-06-24,2020-06-24
HI5Afb6wjI8n,Ralph Waldo Emerson,What is a weed? A plant whose virtues have not yet been discovered.,['famous-quotes'],ralph-waldo-emerson,67,2020-06-24,2020-06-24
mnFoWZfga9OZ,Wayne Dyer,Go for it now. The future is promised to no one.,"['motivational', 'inspirational']",wayne-dyer,48,2020-06-24,2022-07-04
c2crwHSzalPu,William Ellery Channing,"Difficulties are meant to rouse, not discourage. The human spirit is to grow strong by conflict.","['famous-quotes', 'inspirational', 'power-quotes']",william-ellery-channing,96,2020-06-24,2020-06-24
kS2H14WhWSor,Buddha,The thought manifests as the word. The word manifests as the deed. The deed develops into habit. And the habit hardens into character.,['wisdom'],buddha,134,2020-06-24,2022-07-04
mVZ3mhSDcX15,Dr. Seuss,Today you are you! That is truer than true! There is no one alive who is you-er than you!,['famous-quotes'],dr-seuss,89,2020-06-24,2020-06-24
qho6kC7InWuX,Virgil,They can conquer who believe they can.,['famous-quotes'],virgil,38,2020-06-24,2020-06-24
RBidV2o5GA,Og Mandino,"Beginning today, treat everyone you meet as if they were going to be dead by midnight. Extend to them all the care, kindness and understanding you can muster, and do it with no thought of any reward. Your life will never be the same again.",['inspirational'],og-mandino,239,2020-06-24,2020-06-24
8wyvvijMkl,Samuel Johnson,To keep your secret is wisdom; but to expect others to keep it is folly.,['wisdom'],samuel-johnson,72,2020-06-24,2020-06-24
POF-Umusm4LH,Augustine of Hippo,"The world is a book, and those who do not travel read only a page.",['famous-quotes'],augustine-of-hippo,66,2020-06-24,2020-06-24
3sJ6JeUcIf6C,Confucius,"When it is obvious that the goals cannot be reached, don't adjust the goals, adjust the action steps.","['famous-quotes', 'wisdom']",confucius,101,2020-06-24,2020-06-24
U8B6iFEz1V7,Laozi,An ant on the move does more than a dozing ox,['wisdom'],laozi,45,2020-06-24,2022-07-04
3ng6IDEjZW4v,Napoleon Hill,"Edison failed 10,000 times before he made the electric light. Do not be discouraged if you fail a few times.",['famous-quotes'],napoleon-hill,108,2020-06-24,2020-06-24
4Q7v92RUbie,George Herbert,None knows the weight of another's burden.,['wisdom'],george-herbert,42,2020-06-24,2020-06-24
iMBF9RD67JO7,John Quincy Adams,"If your actions inspire others to dream more, learn more, do more and become more, you are a leader.",['famous-quotes'],john-quincy-adams,100,2020-05-21,2020-05-21
b-zLcfguzkk7,Laozi,"When you are content to be simply yourself and don't compare or compete, everybody will respect you.",['wisdom'],laozi,100,2020-05-21,2022-07-04
oKpokhAy8o17,Mahatma Gandhi,"It is the quality of our work which will please God, not the quantity.",['wisdom'],mahatma-gandhi,70,2020-05-21,2022-07-04
tMv7BXOXe,Confucius,"The will to win, the desire to succeed, the urge to reach your full potential... these are the keys that will unlock the door to personal excellence.",['inspirational'],confucius,149,2020-05-21,2020-05-21
aqcSKjNUlSZt,Ella Wheeler Wilcox,"The truest greatness lies in being kind, the truest wisdom in a happy mind.","['famous-quotes', 'wisdom']",ella-wheeler-wilcox,75,2020-05-21,2020-05-21
4uAgduNKEAKW,William Blake,"For everything that lives is holy, life delights in life.",['famous-quotes'],william-blake,57,2020-05-21,2020-05-21
u1_HfDEEgcz,Don Shula,The superior man blames himself. The inferior man blames others.,['wisdom'],don-shula,64,2020-05-21,2020-05-21
ZQGCgHM3F5m3,Albert Einstein,"Try not to become a man of success, but rather try to become a man of value.","['famous-quotes', 'life']",albert-einstein,76,2020-05-21,2020-05-21
DQFsUHF3g12U,Bruce Lee,A wise man can learn more from a foolish question than a fool can learn from a wise answer.,['famous-quotes'],bruce-lee,91,2020-05-21,2020-05-21
yFqk57G890gk,Eleanor Roosevelt,It is not fair to ask of others what you are unwilling to do yourself.,['famous-quotes'],eleanor-roosevelt,70,2020-05-21,2020-05-21
vpKhzzrropUL,Maya Angelou,All great achievements require time.,['famous-quotes'],maya-angelou,36,2020-05-21,2020-05-21
hSxHK-iwap5,Napoleon Hill,No alibi will save you from accepting the responsibility.,['famous-quotes'],napoleon-hill,57,2020-05-21,2020-05-21
q0u7Pv-hsQQ,Ovid,All things change; nothing perishes.,"['change', 'wisdom']",ovid,36,2020-05-21,2022-07-04
3E7C0r4EhlHT,Ralph Waldo Emerson,Build a better mousetrap and the world will beat a path to your door.,['famous-quotes'],ralph-waldo-emerson,69,2020-05-21,2020-05-21
IPv8r6n1dC,John Burroughs,The smallest deed is better than the greatest intention.,['wisdom'],john-burroughs,56,2020-05-21,2020-05-21
Q0WgKeCECMfA,Anaïs Nin,Dreams pass into the reality of action. From the actions stems the dream again; and this interdependence produces the highest form of living.,['famous-quotes'],anais-nin,141,2020-05-21,2020-05-21
6GGoFR7ekS4A,Babatunde Olatunji,Yesterday is history. Tomorrow is a mystery. And today? Today is a gift. That is why we call it the present.,['famous-quotes'],babatunde-olatunji,108,2020-05-21,2020-05-21
2Mx1de_dko_,Johann Wolfgang von Goethe,Mountains cannot be surmounted except by winding paths.,"['famous-quotes', 'inspirational']",johann-wolfgang-von-goethe,55,2020-05-21,2020-05-21
0lGYdcfvWc,Laozi,To lead people walk behind them.,['wisdom'],laozi,32,2020-05-21,2022-07-04
gp8JCh6guz4B,Napoleon Hill,There are no limitations to the mind except those we acknowledge.,['famous-quotes'],napoleon-hill,65,2020-05-21,2020-05-21
yE-5JJkxPMwS,Thomas à Kempis,"Be not angry that you cannot make others as you wish them to be, since you cannot make yourself as you wish to be.",['famous-quotes'],thomas-a-kempis,114,2020-05-21,2020-05-21
J-Q-UnpXS3G2,Winston Churchill,The pessimist sees difficulty in every opportunity. The optimist sees the opportunity in every difficulty.,['famous-quotes'],winston-churchill,106,2020-05-21,2020-05-21
KMNxDlj3xrMA,Johann Wolfgang von Goethe,In the end we retain from our studies only that which we practically apply.,"['famous-quotes', 'education']",johann-wolfgang-von-goethe,75,2020-04-15,2020-04-15
PC6SCHS2uMD,Laozi,The journey of a thousand miles begins with one step.,"['famous-quotes', 'wisdom']",laozi,53,2020-04-15,2020-04-15
U50kYf5u3f4B,Martin Luther King Jr.,"Life's most persistent and urgent question is, 'What are you doing for others?'",['famous-quotes'],martin-luther-king-jr,79,2020-04-15,2020-04-15
f071rzur67M2,Sophocles,"Men of perverse opinion do not know the excellence of what is in their hands, till someone dash it from them.",['famous-quotes'],sophocles,109,2020-04-15,2021-06-17
72cQQpoOS_,Henry David Thoreau,All this worldly wisdom was once the unamiable heresy of some wise man.,['wisdom'],henry-david-thoreau,71,2020-04-15,2020-04-15
1IyeJ8SjYlLe,Alan Watts,No valid plans for the future can be made by those who have no capacity for living now.,"['famous-quotes', 'life', 'future']",alan-watts,87,2020-04-15,2020-04-15
d7YaDDmP1FiW,Helen Keller,We could never learn to be brave and patient if there were only joy in the world.,['famous-quotes'],helen-keller,81,2020-04-15,2020-04-15
uamoi_rJmU,Rumi,"Grief can be the garden of compassion. If you keep your heart open through everything, your pain can become your greatest ally in your life's search for love and wisdom.",['wisdom'],rumi,169,2020-04-15,2020-04-15
Aw2IkKJ2mX,Laozi,"Knowing others is wisdom, knowing yourself is Enlightenment.",['wisdom'],laozi,60,2020-04-15,2020-04-15
YylNTIZwjyg2,Elizabeth Kenny,He who angers you conquers you.,['famous-quotes'],elizabeth-kenny,31,2020-04-15,2020-04-15
URebKOwzXSM-,Hannah Szenes,"One needs something to believe in, something for which one can have whole-hearted enthusiasm. One needs to feel that one's life has meaning, that one is needed in this world.",['famous-quotes'],hannah-szenes,174,2020-04-15,2022-01-07
-jrI1ouM7lbW,Henri-Frédéric Amiel,Almost everything comes from nothing.,['famous-quotes'],henri-frederic-amiel,37,2020-04-15,2020-04-15
haE3BcDtjrBQ,John Barrymore,Happiness often sneaks in through a door you didn't know you left open.,['famous-quotes'],john-barrymore,71,2020-04-15,2020-04-15
_ZVJWv9HJsBe,Mark Twain,"Whoever is happy will make others happy, too.",['famous-quotes'],mark-twain,45,2020-04-15,2020-04-15
TPsLPsnjVANf,Napoleon,The best cure for the body is a quiet mind.,['famous-quotes'],napoleon,43,2020-04-15,2020-04-15
XNeFvcA985pC,Napoleon Hill,When your desires are strong enough you will appear to possess superhuman powers to achieve.,['famous-quotes'],napoleon-hill,92,2020-04-15,2020-04-15
-GABSGde5f,Jimi Hendrix,"Knowledge speaks, but wisdom listens.",['wisdom'],jimi-hendrix,37,2020-04-15,2020-04-15
gfTHZTAshWP,Aeschylus,Wisdom comes alone through suffering.,['wisdom'],aeschylus,37,2020-04-15,2020-04-15
puEMvYGsD,Ernie Banks,"Loyalty and friendship, which is to me the same, created all the wealth that I've ever thought I'd have.",['friendship'],ernie-banks,104,2020-04-15,2020-04-15
a7XBvRnXiE,Plautus,Nothing but heaven itself is better than a friend who is really a friend.,['friendship'],plautus,73,2020-04-15,2020-04-15
arvubIjXpahy,Mark Twain,"Always tell the truth. That way, you don't have to remember what you said.",['famous-quotes'],mark-twain,74,2020-04-15,2020-04-15
vNz2HBNrEPZK,Mother Teresa,"Do not wait for leaders; do it alone, person to person.",['famous-quotes'],mother-teresa,55,2020-04-15,2020-04-15
z56LpsUqHr,William Wordsworth,Wisdom is oftentimes nearer when we stoop than when we soar.,['wisdom'],william-wordsworth,60,2020-04-15,2020-04-15
U6Al9aA7g7,Elbert Hubbard,One machine can do the work of fifty ordinary men. No machine can do the work of one extraordinary man.,['technology'],elbert-hubbard,103,2020-04-15,2020-04-15
4KgGhGyG8A,Charles Eastman,"Friendship is held to be the severest test of character. It is easy, we think, to be loyal to a family and clan, whose blood is in your own veins.",['friendship'],charles-eastman,146,2020-04-15,2020-04-15
j7esy7a9tvwi,Buddha,When you realize how perfect everything is you will tilt your head back and laugh at the sky.,['wisdom'],buddha,93,2020-04-14,2022-07-04
6uwpDHGyz1Nd,Epictetus,Make the best use of what is in your power and take the rest as it happens.,['famous-quotes'],epictetus,75,2020-04-14,2021-06-17
UydvuUuGWjGo,Rabindranath Tagore,We read the world wrong and say that it deceives us.,['famous-quotes'],rabindranath-tagore,52,2020-04-14,2020-04-14
mH6airzttYXS,Ralph Waldo Emerson,Each man has his own vocation; his talent is his call. There is one direction in which all space is open to him.,['famous-quotes'],ralph-waldo-emerson,112,2020-04-14,2020-04-14
RcVCmaE4Ti,Confucius,"By three methods we may learn wisdom: First, by reflection, which is noblest; Second, by imitation, which is easiest; and third by experience, which is the bitterest.",['wisdom'],confucius,166,2020-04-14,2020-04-14
nByyAlmcbrZ,Benjamin Disraeli,The secret of success is constancy to purpose.,['success'],benjamin-disraeli,46,2020-04-14,2022-07-04
EbwcJxDo-wVb,Everett Dirksen,"I am a man of fixed and unbending principles, the first of which is to be flexible at all times.",['famous-quotes'],everett-dirksen,96,2020-04-14,2020-04-14
3Zd4zOud2gp9,Pema Chödrön,The greatest obstacle to connecting with our joy is resentment.,['famous-quotes'],pema-chodron,63,2020-04-14,2020-04-14
PnQ8g2gz_sY2,Winston Churchill,"I never worry about action, but only inaction.",['famous-quotes'],winston-churchill,46,2020-04-14,2020-04-14
SmY4xzg7NR8p,Zig Ziglar,You are the only person on earth who can use your ability.,['famous-quotes'],zig-ziglar,58,2020-04-14,2020-04-14
mVQdjgbqV9,Thomas Fuller,"If you have one true friend, you have more than your share.",['friendship'],thomas-fuller,59,2020-04-14,2021-06-17
Px4iWP-ghc,William Butler Yeats,There are no strangers here; Only friends you haven't yet met.,['friendship'],william-butler-yeats,62,2020-04-14,2020-04-14
2r5oVsxF_c,Ralph Waldo Emerson,A friend may well be reckoned the masterpiece of nature.,"['friendship', 'famous-quotes']",ralph-waldo-emerson,56,2020-04-14,2020-04-14
GO3s1i6LD9,Woody Allen,I don't want to achieve immortality through my work... I want to achieve it through not dying.,['film'],woody-allen,94,2020-04-14,2020-04-14
7qMTJxZR1ZRF,Dalai Lama,"Genuine love should first be directed at oneself; if we do not love ourselves, how can we love others?",['famous-quotes'],dalai-lama,102,2020-04-14,2020-04-14
r0Ioz99q4PGu,Helen Keller,"The best and most beautiful things in the world cannot be seen, nor touched... but are felt in the heart.",['famous-quotes'],helen-keller,105,2020-04-14,2020-04-14
V7HF0nCuOodn,Melody Beattie,"Gratitude makes sense of our past, brings peace for today, and creates a vision for tomorrow.",['famous-quotes'],melody-beattie,93,2020-04-14,2020-04-14
yzPY72AXGkD,Ovid,The cause is hidden. The effect is visible to all.,['famous-quotes'],ovid,50,2020-04-14,2020-04-14
D-KuPZEq59LD,Robert M. Pirsig,The place to improve the world is first in one's own heart and head and hands.,['famous-quotes'],robert-m-pirsig,78,2020-04-14,2020-04-14
NrvGiElhOT,Samuel Richardson,"Marriage is the highest state of friendship. If happy, it lessens our cares by dividing them, at the same time that it doubles our pleasures by mutual participation.",['friendship'],samuel-richardson,165,2020-04-14,2020-04-14
W0OwmMfXLe,Mignon McLaughlin,"It is important to our friends to believe that we are unreservedly frank with them, and important to friendship that we are not.",['friendship'],mignon-mc-laughlin,128,2020-04-14,2020-04-14
2C-BAEVx44Os,Abraham Lincoln,"I walk slowly, but I never walk backward.","['famous-quotes', 'wisdom']",abraham-lincoln,41,2020-04-14,2020-04-14
dHwWmstTfXUC,Alfred Tennyson,The happiness of a man in this life does not consist in the absence but in the mastery of his passions.,"['famous-quotes', 'happiness']",alfred-tennyson,103,2020-04-14,2020-04-14
FGX8aUpiiS5z,Buddha,I do not believe in a fate that falls on men however they act; but I do believe in a fate that falls on them unless they act.,['wisdom'],buddha,125,2020-04-14,2022-07-04
MCaYdNBRu3VH,Carl Jung,Everything that irritates us about others can lead us to an understanding of ourselves.,"['famous-quotes', 'wisdom']",carl-jung,87,2020-04-14,2020-04-14
HBLejCmmWoIy,Dalai Lama,"Happiness mainly comes from our own attitude, rather than from external factors.",['famous-quotes'],dalai-lama,80,2020-04-14,2020-04-14
lza5X_2y7dWb,Elisabeth Kübler-Ross,"I believe that we are solely responsible for our choices, and we have to accept the consequences of every deed, word, and thought throughout our lifetime.",['famous-quotes'],elisabeth-kubler-ross,154,2020-04-14,2020-04-14
JIP8Z3unkKLi,Johann Wolfgang von Goethe,"If you must tell me your opinions, tell me what you believe in. I have plenty of doubts of my own.",['famous-quotes'],johann-wolfgang-von-goethe,98,2020-04-14,2021-06-17
n9hmgKxlcKXC,Tony Robbins,It is in your moments of decision that your destiny is shaped.,['famous-quotes'],tony-robbins,62,2020-04-14,2020-04-14
bAHGv1WELu,Ludwig van Beethoven,Music is a higher revelation than all wisdom and philosophy.,['wisdom'],ludwig-van-beethoven,60,2020-04-14,2020-04-14
G83dxdKwOL,Euripides,Along with success comes a reputation for wisdom.,['wisdom'],euripides,49,2020-04-14,2020-04-14
8s9V_Hceyb,Woody Allen,I was thrown out of college for cheating on the metaphysics exam; I looked into the soul of the boy sitting next to me.,['film'],woody-allen,119,2020-04-14,2020-04-14
WNmBUviZYXwd,Anaïs Nin,"There is not one big cosmic meaning for all, there is only the meaning we each give to our life.",['famous-quotes'],anais-nin,96,2020-04-02,2020-04-02
zW4dI1tPjSYf,Buckminster Fuller,There is nothing in a caterpillar that tells you it's going to be a butterfly.,['famous-quotes'],buckminster-fuller,78,2020-04-02,2020-04-02
IcEZdEWfRppj,Pablo Picasso,I begin with an idea and then it becomes something else.,['famous-quotes'],pablo-picasso,56,2020-04-02,2020-04-02
PHGSW3XxBio6,Blaise Pascal,Man is equally incapable of seeing the nothingness from which he emerges and the infinity in which he is engulfed.,['famous-quotes'],blaise-pascal,114,2020-04-02,2020-04-02
Stv2simFUzRv,Helen Keller,The most beautiful things in the world cannot be seen or even touched. They must be felt with the heart.,['famous-quotes'],helen-keller,104,2020-04-02,2020-04-02
jHbdcQgIflCX,Jim Rohn,"If you don't design your own life plan, chances are you'll fall into someone else's plan. And guess what they have planned for you? Not much.","['famous-quotes', 'life']",jim-rohn,141,2020-04-02,2020-04-02
QZoT0w8MRyc_,John F. Kennedy,Those who dare to fail miserably can achieve greatly.,['famous-quotes'],john-f-kennedy,53,2020-04-02,2020-04-02
dnatcNZd_hIB,Michelangelo,"The greatest danger for most of us is not that our aim is too high, and we miss it, but that it is too low, and we reach it.",['famous-quotes'],michelangelo,124,2020-04-02,2021-06-17
5hD_31Fa8j1L,Oprah Winfrey,"Lots of people want to ride with you in the limo, but what you want is someone who will take the bus with you when the limo breaks down.","['famous-quotes', 'friendship']",oprah-winfrey,136,2020-04-02,2020-04-02
OXotxJfzEaS9,Richard Bach,Happiness is the reward we get for living to the highest right we know.,['famous-quotes'],richard-bach,71,2020-04-02,2020-04-02
S_61PHNDnbZ,Sophocles,Wisdom is the supreme part of happiness.,"['famous-quotes', 'wisdom']",sophocles,40,2020-04-02,2020-04-02
ShnYV3CU2,John Burroughs,Wisdom cannot come by railroad or automobile or airplane or be hurried up by telegraph or telephone.,['wisdom'],john-burroughs,100,2020-04-02,2021-06-17
zH4KOvULrvVs,Agatha Christie,"Good advice is always certain to be ignored, but that's no reason not to give it.",['famous-quotes'],agatha-christie,81,2020-04-02,2020-04-02
cVe_Ylw-Om,Buddha,Peace comes from within. Do not seek it without.,['wisdom'],buddha,48,2020-04-02,2022-07-04
zMXSJtfKVxBW,Wayne Dyer,I cannot always control what goes on outside. But I can always control what goes on inside.,['famous-quotes'],wayne-dyer,91,2020-04-02,2020-04-02
1Q8ejwCpJW,Robert Schuller,I'd rather attempt to do something great and fail than to attempt to do nothing and succeed.,['inspirational'],robert-schuller,92,2020-04-02,2020-04-02
NzmVr08q5EkO,Benjamin Franklin,Tell me and I forget. Teach me and I remember. Involve me and I learn.,['famous-quotes'],benjamin-franklin,70,2020-04-02,2020-04-02
8ckx1hj821s9,Laozi,The key to growth is the introduction of higher dimensions of consciousness into our awareness.,['wisdom'],laozi,95,2020-04-02,2022-07-04
kFTTIYLRDSTd,Mary Kay Ash,"Aerodynamically the bumblebee shouldn't be able to fly, but the bumblebee doesn't know that, so it goes on flying anyway.",['famous-quotes'],mary-kay-ash,121,2020-04-02,2021-06-17
6dj60GUobqhK,Voltaire,Think for yourselves and let others enjoy the privilege to do so too.,['famous-quotes'],voltaire,69,2020-04-02,2020-04-02
gFupCkjzmop,Daniel J. Boorstin,The greatest obstacle to discovery is not ignorance - it is the illusion of knowledge.,['wisdom'],daniel-j-boorstin,86,2020-04-02,2020-04-02
CF7uqSGvDt,Mark Goulston,"Know what's important and what isn't. Have the wisdom to know the right thing to do, the integrity to do it, the character to stand up to those who don't, and the courage to stop those who won't.",['wisdom'],mark-goulston,195,2020-04-02,2020-04-02
Z_czr8xado,Leonard Nimoy,"Logic is the beginning of wisdom, not the end.",['wisdom'],leonard-nimoy,46,2020-04-02,2020-04-02
9wXFYAMkNn,Simone de Beauvoir,"One's life has value so long as one attributes value to the life of others, by means of love, friendship, indignation and compassion.",['friendship'],simone-de-beauvoir,133,2020-04-02,2020-04-02
2tKyChNM7PeF,Denis Waitley,The only person who never makes mistakes is the person who never does anything.,['famous-quotes'],denis-waitley,79,2020-03-27,2020-03-27
eJC3Bf-J2fe,Eleanor Roosevelt,The future belongs to those who believe in the beauty of their dreams.,"['future', 'wisdom']",eleanor-roosevelt,70,2020-03-27,2022-07-04
HHvawzJ0YMs3,Pablo Picasso,"I am always doing that which I cannot do, in order that I may learn how to do it.",['famous-quotes'],pablo-picasso,81,2020-03-27,2020-03-27
tVqHnTXq3bDN,Ralph Waldo Emerson,It is one of the blessings of old friends that you can afford to be stupid with them.,"['famous-quotes', 'friendship']",ralph-waldo-emerson,85,2020-03-27,2020-03-27
dEyIaoXFto_A,Ralph Waldo Emerson,Happiness is a perfume you cannot pour on others without getting a few drops on yourself.,['famous-quotes'],ralph-waldo-emerson,89,2020-03-27,2020-03-27
q3SfzGZd2iGb,Sigmund Freud,The most complicated achievements of thought are possible without the assistance of consciousness.,['famous-quotes'],sigmund-freud,98,2020-03-27,2020-03-27
Qp99OW_XqORq,Walter Benjamin,To be happy is to be able to become aware of oneself without fright.,['famous-quotes'],walter-benjamin,68,2020-03-27,2020-03-27
UewpZTMf9n,Kahlil Gibran,In the sweetness of friendship let there be laughter and sharing of pleasures. For in the dew of little things the heart finds its morning and is refreshed.,['friendship'],kahlil-gibran,156,2020-03-27,2021-06-17
lIUtN4osu967,Elbert Hubbard,The greatest mistake you can make in life is to be continually fearing you will make one.,['famous-quotes'],elbert-hubbard,89,2020-03-27,2020-03-27
4XDrxqT1-YwP,Nikola Tesla,"Our virtues and our failings are inseparable, like force and matter. When they separate, man is no more.",['famous-quotes'],nikola-tesla,104,2020-03-27,2020-03-27
OHLUBhIrqucy,Walter Lippmann,Ideals are an imaginative understanding of that which is desirable in that which is possible.,['famous-quotes'],walter-lippmann,93,2020-03-27,2020-03-27
pAcdc2oMJ_,Bernard Shaw,"We are made wise not by the recollection of our past, but by the responsibility for our future.",['wisdom'],bernard-shaw,95,2020-03-27,2020-03-27
VhB6QxfGuNjt,Buddha,"Just as a candle cannot burn without fire, men cannot live without a spiritual life.",['wisdom'],buddha,84,2020-03-27,2022-07-04
RKOxn5gYEO33,Confucius,To study and not think is a waste. To think and not study is dangerous.,['wisdom'],confucius,71,2020-03-27,2022-07-04
UG8slERojHSm,Winston Churchill,"We make a living by what we get, but we make a life by what we give.",['famous-quotes'],winston-churchill,68,2020-03-27,2020-03-27
v7SkiwdfxA,Muhammad Ali,"Friendship... is not something you learn in school. But if you haven't learned the meaning of friendship, you really haven't learned anything.",['friendship'],muhammad-ali,142,2020-03-27,2020-03-27
3QpzvAuTw-,Anton Chekhov,"Love, friendship and respect do not unite people as much as a common hatred for something.",['friendship'],anton-chekhov,90,2020-03-27,2020-03-27
N9BhgsYxSz,Virginia Woolf,Some people go to priests; others to poetry; I to my friends.,['friendship'],virginia-woolf,61,2020-03-27,2020-03-27
S47CRwtgyIsp,Albert Schweitzer,"Constant kindness can accomplish much. As the sun makes ice melt, kindness causes misunderstanding, mistrust, and hostility to evaporate.",['famous-quotes'],albert-schweitzer,137,2020-03-27,2020-03-27
RmeADLR8F3X2,Anne Frank,How wonderful it is that nobody need wait a single moment before starting to improve the world.,['famous-quotes'],anne-frank,95,2020-03-27,2020-03-27
orZod3ezinb,Buddha,"What we think, we become.",['wisdom'],buddha,25,2020-03-27,2022-07-04
IDY1i8GNwhVZ,Grandma Moses,"Life is what you make of it. Always has been, always will be.",['famous-quotes'],grandma-moses,61,2020-03-27,2020-03-27
w8y_LUEZQZwe,Laozi,"I have just three things to teach: simplicity, patience, compassion. These three are your greatest treasures.","['famous-quotes', 'wisdom']",laozi,109,2020-03-27,2020-03-27
bT4wt0vfm_F,Walt Disney,"If you can dream it, you can do it.","['famous-quotes', 'inspirational']",walt-disney,35,2020-03-27,2020-03-27
