_id,author,content,tags,authorSlug,length,dateAdded,dateModified
Z5FIvoa4U1f-,Ralph Waldo Emerson,"We must be as courteous to a man as we are to a picture, which we are willing to give the advantage of a good light.",['famous-quotes'],ralph-waldo-emerson,116,2019-12-23,2019-12-23
obE41Svazc,Isocrates,True knowledge exists in knowing that you know nothing.,['wisdom'],isocrates,55,2019-12-23,2019-12-23
rROktmIDga,Rowan Williams,"And when the world is created, it is created in such a way that those eternal objects of God's loving wisdom become actualities - interacting with one another, relating to God in the finite realm.",['wisdom'],rowan-williams,196,2019-12-23,2019-12-23
FG1kVHjOKx,Euripides,One loyal friend is worth ten thousand relatives.,['friendship'],euripides,49,2019-12-23,2019-12-23
eePyEVbQEdl,Washington Irving,"Sweet is the memory of distant friends! Like the mellow rays of the departing sun, it falls tenderly, yet sadly, on the heart.",['friendship'],washington-irving,126,2019-12-23,2019-12-23
apQ8nGGjT14_,Aristotle,Love is composed of a single soul inhabiting two bodies.,['famous-quotes'],aristotle,56,2019-12-23,2019-12-23
ZahS1pL6yi-9,Buddha,"To live a pure unselfish life, one must count nothing as one's own in the midst of abundance.","['famous-quotes', 'wisdom']",buddha,93,2019-12-23,2022-07-04
BPH3iUjq75e,Helen Keller,Keep yourself to the sunshine and you cannot see the shadow.,['famous-quotes'],helen-keller,60,2019-12-23,2019-12-23
4y3iRzObjqK1,Marcel Proust,Let us be grateful to people who make us happy; they are the charming gardeners who make our souls blossom.,"['famous-quotes', 'friendship']",marcel-proust,107,2019-12-23,2019-12-23
Llo063kGTo,Larry Niven,Ethics change with technology.,['technology'],larry-niven,30,2019-12-23,2019-12-23
juG0aJTnYxmf,Confucius,"The Superior Man is aware of Righteousness, the inferior man is aware of advantage.",['wisdom'],confucius,83,2019-12-23,2022-07-04
TGQrxqaS3rW9,Robert Graves,Intuition is the supra-logic that cuts out all the routine processes of thought and leaps straight from the problem to the answer.,['famous-quotes'],robert-graves,130,2019-12-23,2019-12-23
esZiZpODqx,Woody Allen,His lack of education is more than compensated for by his keenly developed moral bankruptcy.,['film'],woody-allen,92,2019-12-23,2019-12-23
2kY4qTishsqp,Antoine de Saint-Exupéry,"Love does not consist of gazing at each other, but in looking together in the same direction.",['famous-quotes'],antoine-de-saint-exupery,93,2019-12-23,2019-12-23
S1jK2eB0lfyM,Dhammapada,"Just as a flower, which seems beautiful has color but no perfume, so are the fruitless words of a man who speaks them but does them not.",['famous-quotes'],dhammapada,136,2019-12-23,2019-12-23
y2PmdIlS5U6_,George Eliot,"What do we live for, if it is not to make life less difficult for each other?",['famous-quotes'],george-eliot,77,2019-12-23,2019-12-23
WBaxVQ5fAMhK,John Wooden,You can't let praise or criticism get to you. It's a weakness to get caught up in either one.,['famous-quotes'],john-wooden,93,2019-12-23,2019-12-23
UYpi0ue4EwbH,Marie Curie,"Nothing in life is to be feared, it is only to be understood. Now is the time to understand more, so that we may fear less.",['famous-quotes'],marie-curie,123,2019-12-23,2019-12-23
DqmA8fnr4xJY,Plato,Wise men speak because they have something to say; Fools because they have to say something.,['famous-quotes'],plato,92,2019-12-23,2019-12-23
OSF3eMB6sZaP,Simone Weil,"Liberty, taking the word in its concrete sense, consists in the ability to choose.",['famous-quotes'],simone-weil,82,2019-12-23,2019-12-23
LVmRBE6cytXv,Thomas Jefferson,Reason and free inquiry are the only effectual agents against error.,['famous-quotes'],thomas-jefferson,68,2019-12-23,2019-12-23
X_gg4PL5iirC,William Shakespeare,Go to your bosom: Knock there and ask your heart what it doth know.,['famous-quotes'],william-shakespeare,67,2019-12-23,2021-06-17
iUfi8hroM95v,Jim Rohn,"The more you care, the stronger you can be.",['famous-quotes'],jim-rohn,43,2019-12-14,2019-12-14
VU3FSQfTmG,Jean-Jacques Rousseau,What wisdom can you find that is greater than kindness?,['wisdom'],jean-jacques-rousseau,55,2019-12-14,2019-12-14
vGnmDd7QrhPz,Corita Kent,Life is a succession of moments. To live each one is to succeed.,['life'],corita-kent,64,2019-12-14,2022-07-04
M18-OH7AvRCD,Dalai Lama,"If we have a positive mental attitude, then even when surrounded by hostility, we shall not lack inner peace.",['famous-quotes'],dalai-lama,109,2019-12-14,2019-12-14
RfsD8oOMcu7,Winston Churchill,Courage is going from failure to failure without losing enthusiasm.,['famous-quotes'],winston-churchill,67,2019-12-14,2019-12-14
jnnIm5mCp1,Marilyn vos Savant,"To acquire knowledge, one must study; but to acquire wisdom, one must observe.",['wisdom'],marilyn-vos-savant,78,2019-12-14,2019-12-14
DNjQty5jeU,Clay Shirky,Communications tools don't get socially interesting until they get technologically boring.,['technology'],clay-shirky,90,2019-12-14,2022-01-07
rF6UYZ9W4T,Richard Burton,"False friendship, like the ivy, decays and ruins the walls it embraces; but true friendship gives new life and animation to the object it supports.",['friendship'],richard-burton,147,2019-12-14,2019-12-14
q_cFcKHlt5,Giotto,The sincere friends of this world are as ship lights in the stormiest of nights.,['friendship'],giotto,80,2019-12-14,2019-12-14
u03ZNGHYHV80,Charlotte Brontë,"Life is so constructed that an event does not, cannot, will not, match the expectation.",['famous-quotes'],charlotte-bronte,87,2019-12-14,2019-12-14
Yc3iNMjBHHg,Elizabeth Browning,Light tomorrow with today!,['famous-quotes'],elizabeth-browning,26,2019-12-14,2019-12-14
yOGaxdDvToGD,Franklin D. Roosevelt,"When you come to the end of your rope, tie a knot and hang on.",['famous-quotes'],franklin-d-roosevelt,62,2019-12-14,2019-12-14
__MSA1A1By9u,James Oppenheim,"The foolish man seeks happiness in the distance, the wise grows it under his feet.",['famous-quotes'],james-oppenheim,82,2019-12-14,2019-12-14
V5ekc_oeKEV,Napoleon,Victory belongs to the most persevering.,['famous-quotes'],napoleon,40,2019-12-14,2019-12-14
HL4UTxkSa_Zq,Oprah Winfrey,"With every experience, you alone are painting your own canvas, thought by thought, choice by choice.",['famous-quotes'],oprah-winfrey,100,2019-12-14,2019-12-14
WDGgxBqNWco9,Oscar Wilde,The smallest act of kindness is worth more than the grandest intention.,['famous-quotes'],oscar-wilde,71,2019-12-14,2019-12-14
3qJt6fZmCanr,Albert Einstein,"Setting an example is not the main means of influencing another, it is the only means.",['famous-quotes'],albert-einstein,86,2019-12-14,2019-12-14
HvG-tlzaCwnS,Helen Keller,"Face your deficiencies and acknowledge them; but do not let them master you. Let them teach you patience, sweetness, insight.",['famous-quotes'],helen-keller,125,2019-12-14,2019-12-14
ueyq9zjTg9Rb,Richard Bach,Every gift from a friend is a wish for your happiness.,['famous-quotes'],richard-bach,54,2019-12-14,2019-12-14
qnZp8X0a7ju1,Wayne Dyer,Miracles come in moments. Be ready and willing.,['famous-quotes'],wayne-dyer,47,2019-12-14,2019-12-14
r9DZsOfySa,Man Ray,Technology is anything that wasn't around when you were born.,['technology'],man-ray,61,2019-12-14,2022-01-07
OVNhFsYzj_lB,Richard Garriott,"Chaos and Order are not enemies, only opposites.",['famous-quotes'],richard-garriott,48,2019-12-13,2019-12-13
uxtOnAdYE7Wn,William Arthur Ward,Four steps to achievement: Plan purposefully. Prepare prayerfully. Proceed positively. Pursue persistently.,['famous-quotes'],william-arthur-ward,107,2019-12-13,2019-12-13
83qqDAKJAP,Lucretius,The fall of dropping water wears away the Stone.,['wisdom'],lucretius,48,2019-12-13,2019-12-13
YaDOvF786E,Woody Allen,I'm astounded by people who want to 'know' the universe when it's hard enough to find your way around Chinatown.,['film'],woody-allen,112,2019-12-13,2019-12-13
aNE_rvppMD,Walter Benjamin,"The art of storytelling is reaching its end because the epic side of truth, wisdom, is dying out.",['wisdom'],walter-benjamin,97,2019-12-13,2019-12-13
bTpqZkd3K7,Avery Brooks,Knowledge is going to make you stronger. Knowledge is going to let you control your life. Knowledge is going to give you the wisdom to teach their children. Knowledge is the thing that makes you smile in the face of disaster.,['wisdom'],avery-brooks,225,2019-12-13,2019-12-13
HeconvRtwo0P,Bertrand Russell,The happiness that is genuinely satisfying is accompanied by the fullest exercise of our faculties and the fullest realization of the world in which we live.,['famous-quotes'],bertrand-russell,157,2019-12-13,2019-12-13
wPJ_Mb4EjPlE,Paavo Nurmi,"Mind is everything: muscle, pieces of rubber. All that I am, I am because of my mind.",['famous-quotes'],paavo-nurmi,85,2019-12-13,2019-12-13
9pQeVJgxcsKT,Pablo Picasso,"I am always doing that which I cannot do, in order that I may learn how to do it.",['famous-quotes'],pablo-picasso,81,2019-12-13,2021-06-17
icKAUNx1oTrA,Thích Nhất Hạnh,The amount of happiness that you have depends on the amount of freedom you have in your heart.,['freedom'],thich-nhat-hanh,94,2019-12-13,2022-07-04
7Gy2Y5Zxuzh,Albert Camus,Autumn is a second spring when every leaf is a flower.,"['famous-quotes', 'nature']",albert-camus,54,2019-12-13,2019-12-13
mT5cy5juDLmk,Dalai Lama,"See the positive side, the potential, and make an effort.",['famous-quotes'],dalai-lama,57,2019-12-13,2019-12-13
g3faTGC59w-c,Helen Keller,"When one door of happiness closes, another opens; but often we look so long at the closed door that we do not see the one which has been opened for us.",['famous-quotes'],helen-keller,151,2019-12-13,2019-12-13
A5l8yCGO4BL5,Mahatma Gandhi,Forgiveness is choosing to love. It is the first skill of self-giving love.,['wisdom'],mahatma-gandhi,75,2019-12-13,2022-07-04
9P-7UiqTJx,Don DeLillo,This is the whole point of technology. It creates an appetite for immortality on the one hand. It threatens universal extinction on the other. Technology is lust removed from nature.,['technology'],don-de-lillo,182,2019-12-13,2019-12-13
Sj_MF0e3EN,Thomas Edison,I have friends in overalls whose friendship I would not swap for the favor of the kings of the world.,['friendship'],thomas-edison,101,2019-12-13,2019-12-13
RIpsjNjqPm,Steven Van Zandt,"Rock n' roll as a genre is different from pop and hip hop: it is about bands, and that for me suggests brotherhood, family, friendship and community.",['friendship'],steven-van-zandt,149,2019-12-13,2019-12-13
uz67qLy3TOtD,Buddha,Every human being is the author of his own health or disease.,"['famous-quotes', 'wisdom']",buddha,61,2019-12-02,2022-07-04
MRUQtEH0tbXo,Lou Holtz,I can't believe that God put us on this earth to be ordinary.,['famous-quotes'],lou-holtz,61,2019-12-02,2019-12-02
lvcJukDLhxz3,Mahatma Gandhi,The difference between what we do and what we are capable of doing would suffice to solve most of the world's problems.,['wisdom'],mahatma-gandhi,119,2019-12-02,2022-07-04
QtuKHLeFEBK5,Sam Keen,"We come to love not by finding a perfect person, but by learning to see an imperfect person perfectly.",['famous-quotes'],sam-keen,102,2019-12-02,2019-12-02
b1idr5ua4wW,Friedrich Nietzsche,There is more wisdom in your body than in your deepest philosophy.,['wisdom'],friedrich-nietzsche,66,2019-12-02,2019-12-02
97Zb1PjxN7,Len Wein,A true friend is someone who is there for you when he'd rather be anywhere else.,['friendship'],len-wein,80,2019-12-02,2019-12-02
m29zdeLKtCge,Confucius,"Our greatest glory is not in never falling, but in rising every time we fall.",['wisdom'],confucius,77,2019-12-02,2022-07-04
4AZF5nEIPN9,Michael Korda,"To succeed, we must first believe that we can.",['famous-quotes'],michael-korda,46,2019-12-02,2019-12-02
ZKp5o1R_6pa,Euripides,Leave no stone unturned.,['wisdom'],euripides,24,2019-12-02,2019-12-02
H02wWGf1IC,Stewart Brand,"Once a new technology rolls over you, if you're not part of the steamroller, you're part of the road.",['technology'],stewart-brand,101,2019-12-02,2022-01-07
ZP4Osu902G-r,John Powell,The only real mistake is the one from which we learn nothing.,['famous-quotes'],john-powell,61,2019-12-02,2019-12-02
dZewn83VJ8,Will Durant,"Science gives us knowledge, but only philosophy can give us wisdom.",['wisdom'],will-durant,67,2019-12-02,2019-12-02
CJuMv920yzP,A. Powell Davies,Life is just a chance to grow a soul.,"['famous-quotes', 'life']",a-powell-davies,37,2019-12-02,2019-12-02
LT9DDr9oO_1,Buddha,"In separateness lies the world's great misery, in compassion lies the world's true strength.","['famous-quotes', 'wisdom']",buddha,92,2019-12-02,2022-07-04
5ewQ54oqW1HS,Max Planck,"It is not the possession of truth, but the success which attends the seeking after it, that enriches the seeker and brings happiness to him.",['success'],max-planck,140,2019-12-02,2022-07-04
S7VBLnPG-q,Friedrich Nietzsche,Does wisdom perhaps appear on the earth as a raven which is inspired by the smell of carrion?,['wisdom'],friedrich-nietzsche,93,2019-12-02,2019-12-02
wnQptqWbvNW,Ellen Gilchrist,Don't ruin the present with the ruined past.,['famous-quotes'],ellen-gilchrist,44,2019-11-26,2019-11-26
KIDs-gaScpd0,Judy Garland,"For it was not into my ear you whispered, but into my heart. It was not my lips you kissed, but my soul.",['famous-quotes'],judy-garland,104,2019-11-26,2019-11-26
NGkPndhijwUh,Marcus Aurelius,"Look back over the past, with its changing empires that rose and fell, and you can foresee the future, too.",['future'],marcus-aurelius,107,2019-11-26,2022-07-04
l_yiUqaRnc,A. Powell Davies,"When a friend is in trouble, don't annoy him by asking if there is anything you can do. Think up something appropriate and do it.",['friendship'],a-powell-davies,129,2019-11-26,2019-11-26
KwZ2j2-rBUbs,Joseph Campbell,"When we quit thinking primarily about ourselves and our own self-preservation, we undergo a truly heroic transformation of consciousness.",['famous-quotes'],joseph-campbell,137,2019-11-26,2019-11-26
rIUMUrUMtzXv,Seneca the Younger,There is no great genius without some touch of madness.,['famous-quotes'],seneca-the-younger,55,2019-11-26,2019-11-26
3x87VqS_qvus,Tryon Edwards,"He that never changes his opinions, never corrects his mistakes, and will never be wiser on the morrow than he is today.","['change', 'wisdom']",tryon-edwards,120,2019-11-26,2022-07-04
mi54WW7d_b,William Blake,The road of excess leads to the palace of wisdom.,['wisdom'],william-blake,49,2019-11-26,2019-11-26
adYjdj0WmI,Emily Dickinson,My friends are my estate.,['friendship'],emily-dickinson,25,2019-11-26,2019-11-26
exKuJv1ZQG0,Arthur Conan Doyle,"Whenever you have eliminated the impossible, whatever remains, however improbable, must be the truth.",['famous-quotes'],arthur-conan-doyle,101,2019-11-26,2019-11-26
3tXfdExB8jB,Sigmund Freud,From error to error one discovers the entire truth.,['famous-quotes'],sigmund-freud,51,2019-11-26,2019-11-26
2uxg2JtbtWQ,Mencius,Friendship is one mind in two bodies.,['friendship'],mencius,37,2019-11-26,2019-11-26
uUMvpp64j2oS,Confucius,"To give oneself earnestly to the duties due to men, and, while respecting spiritual beings, to keep aloof from them, may be called wisdom.",['wisdom'],confucius,138,2019-11-26,2022-07-04
5UL7N8Q2QEH1,Denis Waitley,There are two primary choices in life: to accept conditions as they exist or accept responsibility for changing them.,['famous-quotes'],denis-waitley,117,2019-11-26,2021-06-17
F8x4_uMBx-eO,Nikola Tesla,"Let the future tell the truth and evaluate each one according to his work and accomplishments. The present is theirs; the future, for which I have really worked, is mine.","['future', 'famous-quotes']",nikola-tesla,170,2019-11-26,2022-07-04
UNlGWHNGjOXe,Og Mandino,Do all things with love.,['famous-quotes'],og-mandino,24,2019-11-26,2019-11-26
iOP3zVICCTtp,René Descartes,Divide each difficulty into as many parts as is feasible and necessary to resolve it.,['famous-quotes'],rene-descartes,85,2019-11-26,2019-11-26
oExWZWaD3aPW,W. H. Auden,"To choose what is difficult all one's days, as if it were easy, that is faith.",['famous-quotes'],w-h-auden,78,2019-11-26,2021-06-17
XSBuuvIdzX,John Locke,A friendship founded on business is better than a business founded on friendship.,['friendship'],john-locke,81,2019-11-26,2019-11-26
nyqZk3TwZb_C,Charlotte Perkins Gilman,"Let us revere, let us worship, but erect and open-eyed, the highest, not the lowest; the future, not the past!",['wisdom'],charlotte-perkins-gilman,110,2019-11-16,2022-07-04
Qhc0Ny5-nYwV,Daisaku Ikeda,"If we look at the world with a love of life, the world will reveal its beauty to us.",['famous-quotes'],daisaku-ikeda,84,2019-11-16,2019-11-16
g5vqbyRGRtGG,John Lennon,"You may say I'm a dreamer, but I'm not the only one, I hope someday you will join us, and the world will live as one.",['famous-quotes'],john-lennon,117,2019-11-16,2022-01-07
ST-c8lhICwVj,Brian Tracy,"There is never enough time to do everything, but there is always enough time to do the most important thing.",['famous-quotes'],brian-tracy,108,2019-11-16,2019-11-16
psDF8kzy2M,Woodrow Wilson,"You are not here merely to make a living. You are here in order to enable the world to live more amply, with greater vision, with a finer spirit of hope and achievement. You are here to enrich the world, and you impoverish yourself if you forget the errand.",['inspirational'],woodrow-wilson,257,2019-11-16,2019-11-16
Dg-s-e2zAXKs,Albert Schweitzer,One who gains strength by overcoming obstacles possesses the only strength which can overcome adversity.,"['famous-quotes', 'inspirational']",albert-schweitzer,104,2019-11-16,2019-11-16
rEeMIL3Ro-r,Johann Wolfgang von Goethe,Knowing is not enough; we must apply!,"['famous-quotes', 'inspirational']",johann-wolfgang-von-goethe,37,2019-11-16,2019-11-16
HmFAPaZJYAn,Maya Angelou,I believe that every person is born with talent.,['famous-quotes'],maya-angelou,48,2019-11-16,2019-11-16
5yzpEPenl4TS,Robert Louis Stevenson,Don't judge each day by the harvest you reap but by the seeds that you plant.,['famous-quotes'],robert-louis-stevenson,77,2019-11-16,2019-11-16
AeJkfzeXkGnI,Thích Nhất Hạnh,"The most precious gift we can offer anyone is our attention. When mindfulness embraces those we love, they will bloom like flowers.",['famous-quotes'],thich-nhat-hanh,131,2019-11-16,2019-11-16
sAqRoYN_WRkP,Voltaire,"The longer we dwell on our misfortunes, the greater is their power to harm us.",['famous-quotes'],voltaire,78,2019-11-16,2019-11-16
UNCIDxM-0I4m,Walt Whitman,Keep your face always toward the sunshine - and shadows will fall behind you.,['famous-quotes'],walt-whitman,77,2019-11-16,2019-11-16
EDE9gJO2jc1,Ralph Waldo Emerson,"Before we acquire great power, we must acquire wisdom to use it well.",['wisdom'],ralph-waldo-emerson,69,2019-11-16,2021-06-17
HFT6qcdMVVt,George Washington,"Be courteous to all, but intimate with few, and let those few be well tried before you give them your confidence.",['friendship'],george-washington,113,2019-11-16,2019-11-16
AUGTBH2V__b,Oscar Wilde,True friends stab you in the front.,"['friendship', 'famous-quotes']",oscar-wilde,35,2019-11-16,2019-11-16
9L8UeWBjSVtf,Albert Schweitzer,Wherever a man turns he can find someone who needs him.,['famous-quotes'],albert-schweitzer,55,2019-11-16,2019-11-16
4eha14Kcc5Pi,Antoine de Saint-Exupéry,"It is only with the heart that one can see rightly, what is essential is invisible to the eye.",['famous-quotes'],antoine-de-saint-exupery,94,2019-11-16,2019-11-16
Ps20py3bE1JW,Booker T. Washington,Excellence is to do a common thing in an uncommon way.,['famous-quotes'],booker-t-washington,54,2019-11-16,2019-11-16
JjBqM4t-sxsr,Plato,"Wise men talk because they have something to say; fools, because they have to say something.",['famous-quotes'],plato,92,2019-11-16,2019-11-16
WAtpd3n0mH2,Charles F. Kettering,One fails forward toward success.,['success'],charles-f-kettering,33,2019-10-18,2022-07-04
kd2p5bp3pJ9g,John Dewey,"Without some goals and some efforts to reach it, no man can live.",['famous-quotes'],john-dewey,65,2019-10-18,2019-10-18
w_AfQ8L1U5-P,Leonardo da Vinci,I have been impressed with the urgency of doing. Knowing is not enough; we must apply. Being willing is not enough; we must do.,['famous-quotes'],leonardo-da-vinci,127,2019-10-18,2019-10-18
Jsh8Bmjmnf,Benjamin Franklin,"Without freedom of thought, there can be no such thing as wisdom - and no such thing as public liberty without freedom of speech.","['wisdom', 'politics', 'social-justice', 'freedom']",benjamin-franklin,129,2019-10-18,2022-07-04
mZGMxqlkKn,Lord Byron,"Friendship may, and often does, grow into love, but love never subsides into friendship.",['friendship'],lord-byron,88,2019-10-18,2019-10-18
4zzDULN1Lx,Woody Allen,I took a speed-reading course and read 'War and Peace' in twenty minutes. It involves Russia.,['film'],woody-allen,93,2019-10-18,2021-06-17
KhFHSkcaefSF,Edith Wharton,If only wed stop trying to be happy wed have a pretty good time.,['famous-quotes'],edith-wharton,64,2019-10-18,2019-10-18
NZx4vMwOCDxJ,George Sand,"There is only one happiness in life, to love and be loved.",['famous-quotes'],george-sand,58,2019-10-18,2019-10-18
PCb9mzq4_Q_w,Napoleon Hill,The ladder of success is never crowded at the top.,['success'],napoleon-hill,50,2019-10-18,2022-07-04
BTR1osiyS1M5,Peter Drucker,The best way to predict your future is to create it.,"['future', 'inspirational']",peter-drucker,52,2019-10-18,2022-07-04
6Frokv7EPoui,Sophocles,Ignorant men don't know what good they hold in their hands until they've flung it away.,['famous-quotes'],sophocles,87,2019-10-18,2019-10-18
ghsWhOeHC-85,Uta Hagen,We must overcome the notion that we must be regular. It robs you of the chance to be extraordinary and leads you to the mediocre.,['famous-quotes'],uta-hagen,129,2019-10-18,2019-10-18
plsqfJPouyr8,William James,"The greatest discovery of our generation is that human beings can alter their lives by altering their attitudes of mind. As you think, so shall you be.",['famous-quotes'],william-james,151,2019-10-18,2019-10-18
P4WtPxjdH735,Epictetus,"When you are offended at any man's fault, turn to yourself and study your own failings. Then you will forget your anger.",['famous-quotes'],epictetus,120,2019-10-18,2019-10-18
iDSY05hYTVIU,Galileo Galilei,All truths are easy to understand once they are discovered; the point is to discover them.,['famous-quotes'],galileo-galilei,90,2019-10-18,2019-10-18
OG9-EbvEi-v,Mahatma Gandhi,We must become the change we want to see.,"['change', 'wisdom']",mahatma-gandhi,41,2019-10-18,2022-07-04
b64MwqrSHMN,Oscar Wilde,Experience is simply the name we give our mistakes.,['famous-quotes'],oscar-wilde,51,2019-10-18,2019-10-18
Rn3KahYUQG2Q,William Butler Yeats,Think as a wise man but communicate in the language of the people.,['famous-quotes'],william-butler-yeats,66,2019-10-18,2019-10-18
OP57ZqfTQf,Swami Vivekananda,We are what our thoughts have made us; so take care about what you think. Words are secondary. Thoughts live; they travel far.,['wisdom'],swami-vivekananda,126,2019-10-18,2019-10-18
19tTwDy5lWHD,Benjamin Disraeli,"Never apologize for showing feeling. When you do so, you apologize for truth.",['famous-quotes'],benjamin-disraeli,77,2019-10-18,2019-10-18
OyLHLZT290ii,John Lubbock,A day of worry is more exhausting than a day of work.,['famous-quotes'],john-lubbock,53,2019-10-18,2019-10-18
H-AvX5eVCKBF,Louisa May Alcott,"I'm not afraid of storms, for I'm learning how to sail my ship.",['famous-quotes'],louisa-may-alcott,63,2019-10-18,2022-01-07
h3vqfIeuhcho,Moncure D. Conway,The best thing in every noble dream is the dreamer...,['famous-quotes'],moncure-d-conway,53,2019-10-18,2019-10-18
y1RIkUSWFpl,Seneca the Younger,The greatest remedy for anger is delay.,['famous-quotes'],seneca-the-younger,39,2019-10-18,2019-10-18
IPe2ciM16GMn,Doug Larson,Wisdom is the reward you get for a lifetime of listening when you'd have preferred to talk.,['famous-quotes'],doug-larson,91,2019-10-12,2019-10-12
SRODo46S0vo,Marilyn Monroe,"Experts on romance say for a happy marriage there has to be more than a passionate love. For a lasting union, they insist, there must be a genuine liking for each other. Which, in my book, is a good definition for friendship.",['friendship'],marilyn-monroe,225,2019-10-12,2019-10-12
YqOPx7bH29,William Shakespeare,Action is eloquence.,['literature'],william-shakespeare,20,2019-10-12,2019-10-12
wFpuOZ-TFZZy,Buddha,The foot feels the foot when it feels the ground.,['wisdom'],buddha,49,2019-10-12,2022-07-04
WLJJ_y-H-sH0,Epictetus,He is a wise man who does not grieve for the things which he has not but rejoices for those which he has.,['famous-quotes'],epictetus,105,2019-10-12,2021-06-17
0I3MzxBI2Cyo,Ralph Waldo Emerson,"Life is a succession of lessons, which must be lived to be understood.",['life'],ralph-waldo-emerson,70,2019-10-12,2022-07-04
J5S_pwTvaT,Joan Rivers,"Yesterday is history, tomorrow is a mystery, today is God's gift, that's why we call it the present.",['wisdom'],joan-rivers,100,2019-10-12,2019-10-12
kLPjPfFmTx,Herbert Hoover,Wisdom often times consists of knowing what to do next.,['wisdom'],herbert-hoover,55,2019-10-12,2021-06-17
VgsphQQC9g,John Brunner,"It's supposed to be automatic, but actually you have to push this button.",['technology'],john-brunner,73,2019-10-12,2022-01-07
-p4UJJtG2e0g,Carl Jung,"Knowledge rests not upon truth alone, but upon error also.",['famous-quotes'],carl-jung,58,2019-10-12,2019-10-12
ZxKQ6LZn9nZl,Napoleon Hill,The world has the habit of making room for the man whose actions show that he knows where he is going.,['famous-quotes'],napoleon-hill,102,2019-10-12,2019-10-12
