_id,author,content,tags,authorSlug,length,dateAdded,dateModified
utsFFZkN6YU,Akhenaten,"True wisdom is less presuming than folly. The wise man doubteth often, and changeth his mind; the fool is obstinate, and doubteth not; he knoweth all things but his own ignorance.",['wisdom'],akhenaten,179,2021-02-12,2021-02-12
yHmYezfz4G,Jane Austen,"Business, you know, may bring you money, but friendship hardly ever does.",['friendship'],jane-austen,73,2021-02-12,2021-02-12
EFIK1GrN6Otv,Eckhart Tolle,You cannot find yourself by going into the past. You can find yourself by coming into the present.,['famous-quotes'],eckhart-tolle,98,2021-02-12,2021-02-12
07zmPxxgF8H,Elizabeth Browning,Love doesn't make the world go round; love is what makes the ride worthwhile.,['famous-quotes'],elizabeth-browning,77,2021-02-12,2021-06-17
mhBblBxFy-nH,Ivy Baker Priest,The world is round and the place which may seem like the end may also be the beginning.,['famous-quotes'],ivy-baker-priest,87,2021-02-12,2021-02-12
-KQWifS-IfX,Tony Robbins,"Whatever happens, take responsibility.",['famous-quotes'],tony-robbins,38,2021-02-12,2021-02-12
-dQf7muOG4,Pablo Picasso,Computers are useless. They can only give you answers.,['technology'],pablo-picasso,54,2021-02-12,2021-02-12
HHqa6LTGObSq,Albert Einstein,Life is like riding a bicycle. To keep your balance you must keep moving.,"['famous-quotes', 'life']",albert-einstein,73,2021-02-12,2021-02-12
CeKZLrUeWIp,Aristotle,Change in all things is sweet.,"['famous-quotes', 'change', 'wisdom']",aristotle,30,2021-02-12,2022-07-04
rXZQtra6Obce,Milton Berle,"If opportunity doesn't knock, build a door.",['famous-quotes'],milton-berle,43,2021-02-12,2021-02-12
uOzqCA_J_8Nd,Richard Bach,"Allow the world to live as it chooses, and allow yourself to live as you choose.",['famous-quotes'],richard-bach,80,2021-02-12,2021-02-12
i8lV7rU4HN40,Bernice Reagon,"Life's challenges are not supposed to paralyze you, they're supposed to help you discover who you are.",['famous-quotes'],bernice-reagon,102,2021-02-12,2021-02-12
1SHCOeLgKWa0,Francis Bacon,A wise man will make more opportunities than he finds.,['famous-quotes'],francis-bacon,54,2021-02-12,2021-02-12
0Ku0Ubwupkxi,Henri-Frédéric Amiel,So long as a person is capable of self-renewal they are a living being.,['famous-quotes'],henri-frederic-amiel,71,2021-02-12,2021-02-12
K4fn0Bz-4V1-,Pema Chödrön,"When you begin to touch your heart or let your heart be touched, you begin to discover that it's bottomless.",['famous-quotes'],pema-chodron,108,2021-02-12,2021-02-12
Yl8o9gfnbm,Pierre Teilhard de Chardin,The world is round so that friendship may encircle it.,['friendship'],pierre-teilhard-de-chardin,54,2021-02-12,2021-02-12
Z_9VClTWUcSv,Alfred Adler,"Trust only movement. Life happens at the level of events, not of words. Trust movement.","['famous-quotes', 'life']",alfred-adler,87,2021-01-30,2021-01-30
YvtmjTGA6Qs1,Laozi,He who knows himself is enlightened.,['wisdom'],laozi,36,2021-01-30,2022-07-04
IvoOxxfBcYN,Seneca the Younger,Luck is what happens when preparation meets opportunity.,['famous-quotes'],seneca-the-younger,56,2021-01-30,2021-01-30
oz5pv73WCUYX,Walt Disney,"All our dreams can come true, if we have the courage to pursue them.","['famous-quotes', 'success']",walt-disney,68,2021-01-30,2022-07-04
h_J3NODgXZ5,Ralph Waldo Emerson,The years teach much which the days never know.,['famous-quotes'],ralph-waldo-emerson,47,2021-01-30,2021-01-30
MJmapSmIK3,Jean-Paul Sartre,"The more sand that has escaped from the hourglass of our life, the clearer we should see through it.",['wisdom'],jean-paul-sartre,100,2021-01-30,2021-01-30
OwQANbtdRT,Henry Ford,My best friend is the one who brings out the best in me.,['friendship'],henry-ford,56,2021-01-30,2021-01-30
VqDHgHOYYTsd,Gordon Hinckley,"Our lives are the only meaningful expression of what we believe and in Whom we believe. And the only real wealth, for any of us, lies in our faith.",['famous-quotes'],gordon-hinckley,147,2021-01-30,2021-01-30
3VC1Tk541UV,Ralph Waldo Emerson,"Life is a progress, and not a station.",['famous-quotes'],ralph-waldo-emerson,38,2021-01-30,2021-01-30
FFdTTIJ6aqj_,Ralph Waldo Emerson,Everything in the universe goes by indirection. There are no straight lines.,['famous-quotes'],ralph-waldo-emerson,76,2021-01-30,2021-01-30
mJqyHSkJN,Thomas Edison,Genius is one percent inspiration and ninety-nine percent perspiration.,"['famous-quotes', 'wisdom']",thomas-edison,71,2021-01-30,2021-01-30
spBflSxoTt,Thomas Paine,A long habit of not thinking a thing wrong gives it a superficial appearance of being right.,['wisdom'],thomas-paine,92,2021-01-30,2021-01-30
OawbCWOFWi,Benjamin Franklin,The doorstep to the temple of wisdom is a knowledge of our own ignorance.,['wisdom'],benjamin-franklin,73,2021-01-30,2021-01-30
1pk3RmCB6q,Arthur Ashe,We must reach out our hand in friendship and dignity both to those who would befriend us and those who would be our enemy.,['friendship'],arthur-ashe,122,2021-01-30,2021-01-30
0IP2kpOHSiPj,Calvin Coolidge,I have never been hurt by anything I didn't say.,['famous-quotes'],calvin-coolidge,48,2021-01-30,2021-01-30
heFGlWwPZjvX,Hannah Arendt,"Promises are the uniquely human way of ordering the future, making it predictable and reliable to the extent that this is humanly possible.",['future'],hannah-arendt,139,2021-01-30,2022-07-04
w7BFNBIxOvmc,Leonardo da Vinci,Iron rusts from disuse; water loses its purity from stagnation... even so does inaction sap the vigor of the mind.,['famous-quotes'],leonardo-da-vinci,114,2021-01-30,2021-06-17
4E342E1vP,Jerome,"Good, better, best. Never let it rest. ‘Til your good is better and your better is best.",['inspirational'],jerome,88,2021-01-30,2021-06-17
P3evPhlvU8bV,John Updike,"Dreams come true. Without that possibility, nature would not incite us to have them.",['famous-quotes'],john-updike,84,2021-01-20,2021-01-20
5OsoVNA7a0ad,Saul Alinsky,"As an organizer I start from where the world is, as it is, not as I would like it to be.",['famous-quotes'],saul-alinsky,88,2021-01-20,2021-01-20
IROEi_B-5kj,Margaret Thatcher,"If you set out to be liked, you would be prepared to compromise on anything at any time, and you would achieve nothing.",['wisdom'],margaret-thatcher,119,2021-01-20,2021-01-20
5nc3WYWdbYLu,Bruce Lee,"Always be yourself, express yourself, have faith in yourself, do not go out and look for a successful personality and duplicate it.","['famous-quotes', 'success']",bruce-lee,131,2021-01-20,2022-07-04
OuOSAZxGADC,Frank Herbert,The beginning of knowledge is the discovery of something we do not understand.,['famous-quotes'],frank-herbert,78,2021-01-20,2021-01-20
mQ9rgTxuKeXa,Henry van Dyke Jr.,"Be glad of life because it gives you the chance to love, to work, to play, and to look up at the stars.",['famous-quotes'],henry-van-dyke-jr,103,2021-01-20,2021-01-20
XefAFBJI_Cf,Jim Rohn,Either you run the day or the day runs you.,['famous-quotes'],jim-rohn,43,2021-01-20,2021-01-20
SjSXV2RqMnq3,Socrates,The greatest way to live with honor in this world is to be what we pretend to be.,['famous-quotes'],socrates,81,2021-01-20,2021-01-20
R80GBolDfAev,Tom Lehrer,Life is like a sewer. What you get out of it depends on what you put into it.,['famous-quotes'],tom-lehrer,77,2021-01-20,2021-01-20
mjKwHGRjIE,Walt Disney,"The more you like yourself, the less you are like anyone else, which makes you unique.",['wisdom'],walt-disney,86,2021-01-20,2021-01-20
Chvu_626SS,Henry David Thoreau,The most I can do for my friend is simply be his friend.,['friendship'],henry-david-thoreau,56,2021-01-20,2021-01-20
AUq_HnRp2Isp,Edward Young,"On every thorn, delightful wisdom grows, in every rill a sweet instruction flows.",['famous-quotes'],edward-young,81,2021-01-20,2021-06-17
4jQJJntuZhaq,Henry Reed,Intuition is the very force or activity of the soul in its experience through whatever has been the experience of the soul itself.,['famous-quotes'],henry-reed,130,2021-01-20,2021-01-20
xzOfgffA_i4K,Jean Antoine Petit-Senn,Not what we have but what we enjoy constitutes our abundance.,['famous-quotes'],jean-antoine-petit-senn,61,2021-01-20,2021-01-20
WuHLOLFI2uKy,Dalai Lama,To be aware of a single shortcoming in oneself is more useful than to be aware of a thousand in someone else.,['famous-quotes'],dalai-lama,109,2021-01-20,2021-01-20
N-_tRxD3bY,Friedrich Nietzsche,"Rejoicing in our joy, not suffering over our suffering, makes someone a friend.",['friendship'],friedrich-nietzsche,79,2021-01-20,2021-01-20
u3yMrJpE9TSf,Arthur Rubinstein,Of course there is no formula for success except perhaps an unconditional acceptance of life and what it brings.,['success'],arthur-rubinstein,112,2021-01-20,2022-07-04
305CvwuKqye,Blaise Pascal,The heart has its reasons which reason knows not of.,['famous-quotes'],blaise-pascal,52,2021-01-20,2021-01-20
Rx5_LAiVmhoP,Buddha,"Do not overrate what you have received, nor envy others. He who envies others does not obtain peace of mind.",['wisdom'],buddha,108,2021-01-20,2022-07-04
gjXvu4IvrUf,Thomas Fuller,No garden is without its weeds.,['famous-quotes'],thomas-fuller,31,2021-01-20,2021-01-20
StQwgV2uHKio,William Blake,"In seed time learn, in harvest teach, in winter enjoy.",['famous-quotes'],william-blake,54,2021-01-20,2021-01-20
GcWOk8pTEf,George S. Patton,Accept the challenges so that you can feel the exhilaration of victory.,['inspirational'],george-s-patton,71,2021-01-20,2021-01-20
YRWT98QBEC,Jean de La Bruyère,Love and friendship exclude each other.,['friendship'],jean-de-la-bruyere,39,2021-01-20,2021-01-20
m99OMcyrelGE,Brendan Behan,No yesterdays are ever wasted for those who give themselves to today.,['famous-quotes'],brendan-behan,69,2021-01-19,2021-01-19
2LmdIfvSmBlD,James M. Beggs,"Before you put on a frown, make absolutely sure there are no smiles available.",['famous-quotes'],james-m-beggs,78,2021-01-19,2021-01-19
0mvbtxiIrRtQ,Laozi,"When I let go of what I am, I become what I might be.",['wisdom'],laozi,53,2021-01-19,2022-07-04
gBdWfRIFkxx4,Oscar Wilde,The aim of life is self-development. To realize one's nature perfectly - that is what each of us is here for.,['famous-quotes'],oscar-wilde,109,2021-01-19,2022-01-07
JfTBllGjt7L,William Shakespeare,"Love all, trust a few, do wrong to none.",['famous-quotes'],william-shakespeare,40,2021-01-19,2021-01-19
4xj3TdB9Tq,Martin Luther King Jr.,That old law about 'an eye for an eye' leaves everybody blind. The time is always right to do the right thing.,['wisdom'],martin-luther-king-jr,110,2021-01-19,2021-01-19
8bIHIEuQP5,Michelle Obama,"The fact is, with every friendship you make, and every bond of trust you establish, you are shaping the image of America projected to the rest of the world. That is so important. So when you study abroad, you're actually helping to make America stronger.",['friendship'],michelle-obama,254,2021-01-19,2021-01-19
_ZVOiIVt8xAR,Doris Day,Gratitude is riches. Complaint is poverty.,['famous-quotes'],doris-day,42,2021-01-19,2021-01-19
28NZgIOW_fUV,Johann Wolfgang von Goethe,A man sees in the world what he carries in his heart.,['famous-quotes'],johann-wolfgang-von-goethe,53,2021-01-19,2021-01-19
8Lkh3gqcSh,Johann Wolfgang von Goethe,Difficulties increase the nearer we get to the goal.,"['famous-quotes', 'inspirational']",johann-wolfgang-von-goethe,52,2021-01-19,2021-01-19
TcvsfRbBFgvq,Mother Teresa,"Let us always meet each other with smile, for the smile is the beginning of love.",['famous-quotes'],mother-teresa,81,2021-01-19,2021-01-19
cJH-_m1_f0Um,Ralph Waldo Emerson,"So is cheerfulness, or a good temper, the more it is spent, the more remains.",['famous-quotes'],ralph-waldo-emerson,77,2021-01-19,2021-01-19
r9VIoOzFdUGU,Seneca the Younger,"The conditions of conquest are always easy. We have but to toil awhile, endure awhile, believe always, and never turn back.",['famous-quotes'],seneca-the-younger,123,2021-01-19,2021-01-19
zOivJtHmwWgt,Abraham Lincoln,The best thing about the future is that it only comes one day at a time.,"['famous-quotes', 'life', 'future']",abraham-lincoln,72,2021-01-19,2022-07-04
rc2Yx_x_X0qD,Bruce Lee,"The less effort, the faster and more powerful you will be.",['famous-quotes'],bruce-lee,58,2021-01-19,2021-01-19
2OVqy9KVYy3m,Buddha,No one saves us but ourselves. No one can and no one may. We ourselves must walk the path.,['wisdom'],buddha,90,2021-01-19,2022-07-04
UyHlTZCE77,Aristotle,Well begun is half done.,['famous-quotes'],aristotle,24,2021-01-19,2021-01-19
LlHX1-JaSX4v,Buddha,"However many holy words you read, however many you speak, what good will they do you if you do not act on upon them?",['wisdom'],buddha,116,2021-01-19,2022-07-04
i9HLCPii77bH,Ralph Waldo Emerson,"Great are they who see that spiritual is stronger than any material force, that thoughts rule the world.",['famous-quotes'],ralph-waldo-emerson,104,2021-01-19,2021-01-19
CAnUBEJ1mw,A. P. J. Abdul Kalam,We should not give up and we should not allow the problem to defeat us.,['inspirational'],a-p-j-abdul-kalam,71,2021-01-19,2021-01-19
G3x14DbMCIe,Jane Wyman,The opportunity for brotherhood presents itself every time you meet a human being.,['wisdom'],jane-wyman,82,2021-01-19,2021-01-19
QzPXTQCfcDZ,Charlotte Brontë,A ruffled mind makes a restless pillow.,['wisdom'],charlotte-bronte,39,2021-01-19,2021-01-19
YB-FRt_brC,Abigail Adams,"Wisdom and penetration are the fruit of experience, not the lessons of retirement and leisure. Great necessities call out great virtues.",['wisdom'],abigail-adams,136,2021-01-19,2021-01-19
tCC5J50uJR,Christopher Reeve,"Never accept ultimatums, conventional wisdom, or absolutes.",['wisdom'],christopher-reeve,59,2021-01-19,2021-01-19
x6LCvKtrXx,Ella Wheeler Wilcox,"All love that has not friendship for its base, is like a mansion built upon the sand.","['friendship', 'love']",ella-wheeler-wilcox,85,2021-01-19,2021-01-19
FO4v4ZdByU,Henry David Thoreau,A man cannot be said to succeed in this life who does not satisfy one friend.,['friendship'],henry-david-thoreau,77,2021-01-19,2021-01-19
I6EOd5T7NbBg,Elbert Hubbard,The final proof of greatness lies in being able to endure criticism without resentment.,['famous-quotes'],elbert-hubbard,87,2021-01-11,2021-01-11
5eTiZJCTAy9B,Elizabeth Browning,"Whoso loves, believes the impossible.",['famous-quotes'],elizabeth-browning,37,2021-01-11,2021-01-11
d4my6t1iI1q1,Norman Schwarzkopf,The truth of the matter is that you always know the right thing to do. The hard part is doing it.,['famous-quotes'],norman-schwarzkopf,97,2021-01-11,2021-01-11
gn9Z3AvohhS7,Ralph Waldo Emerson,The only way to have a friend is to be one.,"['famous-quotes', 'friendship']",ralph-waldo-emerson,43,2021-01-11,2021-01-11
O_jlFdjUtHPT,Richard Bach,"Every person, all the events of your life are there because you have drawn them there. What you choose to do with them is up to you.",['famous-quotes'],richard-bach,132,2021-01-11,2021-01-11
QTf15XLSdB,Victoria Osteen,"I think that we have a great opportunity to impart our wisdom and our knowledge and our experience to this younger generation. It may be different times, but experience transcends time, and wisdom transcends time.",['wisdom'],victoria-osteen,213,2021-01-11,2021-01-11
5_6lVDMuo9IM,George Orwell,Happiness can exist only in acceptance.,['famous-quotes'],george-orwell,39,2021-01-11,2021-01-11
z4yEYvKjp0T,Publilius Syrus,"While we stop to think, we often miss our opportunity.",['famous-quotes'],publilius-syrus,54,2021-01-11,2021-01-11
C3knCn6X0qO,Thomas Jefferson,Never put off till tomorrow what you can do today.,['famous-quotes'],thomas-jefferson,50,2021-01-11,2021-01-11
U6Xb-Ni4mQr7,W. Clement Stone,No matter how carefully you plan your goals they will never be more that pipe dreams unless you pursue them with gusto.,['famous-quotes'],w-clement-stone,119,2021-01-11,2021-01-11
lxVMQLtBP7,Douglas Adams,"First we thought the PC was a calculator. Then we found out how to turn numbers into letters with ASCII — and we thought it was a typewriter. Then we discovered graphics, and we thought it was a television. With the World Wide Web, we've realized it's a brochure.",['technology'],douglas-adams,263,2021-01-11,2022-01-07
eFUpcDDj16lQ,John Galsworthy,"Love has no age, no limit; and no death.",['famous-quotes'],john-galsworthy,40,2021-01-11,2021-01-11
cHatxDPK4Xsl,Leo Tolstoy,We lost because we told ourselves we lost.,['famous-quotes'],leo-tolstoy,42,2021-01-11,2021-01-11
iUBBoBk8rSal,Oprah Winfrey,"If you want your life to be more rewarding, you have to change the way you think.","['famous-quotes', 'change']",oprah-winfrey,81,2021-01-11,2022-07-04
xqpuo_rjf_1g,Søren Kierkegaard,To dare is to lose ones footing momentarily. To not dare is to lose oneself.,['famous-quotes'],soren-kierkegaard,76,2021-01-11,2021-01-11
nIBJdpafN5Kc,Voltaire,God gave us the gift of life; it is up to us to give ourselves the gift of living well.,['famous-quotes'],voltaire,87,2021-01-11,2021-01-11
0UR-CxrV5U,Thomas Hobbes,It is not wisdom but Authority that makes a law.,['wisdom'],thomas-hobbes,48,2021-01-11,2021-01-11
LBG_RasdBg_,Barack Obama,No party has a monopoly on wisdom. No democracy works without compromise.,['wisdom'],barack-obama,73,2021-01-11,2022-09-25
GwbIPJqtzp,Josh Billings,"Wisdom has never made a bigot, but learning has.",['wisdom'],josh-billings,48,2021-01-11,2021-01-11
Qz9ozuQJXq,Chuck Swindoll,"I cannot even imagine where I would be today were it not for that handful of friends who have given me a heart full of joy. Let's face it, friends make life a lot more fun.",['friendship'],chuck-swindoll,172,2021-01-11,2021-01-11
DNp5YdIcsG,Thomas Jefferson,"I never considered a difference of opinion in politics, in religion, in philosophy, as cause for withdrawing from a friend.",['friendship'],thomas-jefferson,123,2021-01-11,2021-01-11
GnTIVgh6A0KW,Henri-Frédéric Amiel,Work while you have the light. You are responsible for the talent that has been entrusted to you.,['famous-quotes'],henri-frederic-amiel,97,2021-01-11,2021-01-11
vYLcN2OYHyPj,Henry Wadsworth Longfellow,"Perseverance is a great element of success. If you only knock long enough and loud enough at the gate, you are sure to wake up somebody.",['success'],henry-wadsworth-longfellow,136,2021-01-11,2022-07-04
UXEo6vW4i1Jw,Laozi,Music in the soul can be heard by the universe.,['wisdom'],laozi,47,2021-01-11,2022-07-04
Q5QkyjYFY5s,Leonardo da Vinci,Nothing strengthens authority so much as silence.,['famous-quotes'],leonardo-da-vinci,49,2021-01-11,2021-01-11
N3YI0c4c6TR,Manuel Puig,I allow my intuition to lead my path.,['famous-quotes'],manuel-puig,37,2021-01-11,2021-01-11
hObyYZLdWKe,Pablo Picasso,Everything you can imagine is real.,['famous-quotes'],pablo-picasso,35,2021-01-11,2021-01-11
079ozBy6_8xH,Tony Robbins,You always succeed in producing a result.,['famous-quotes'],tony-robbins,41,2021-01-11,2021-01-11
4zV5Pz4HES,George Eliot,Where is the Life we have lost in living? Where is the wisdom we have lost in knowledge? Where is the knowledge we have lost in information?,['wisdom'],george-eliot,140,2021-01-11,2021-01-11
jGNbZBKJFhRZ,Abraham Lincoln,"Be sure you put your feet in the right place, then stand firm.","['famous-quotes', 'wisdom']",abraham-lincoln,62,2021-01-10,2021-01-10
CmSBhf2rWoUM,Arthur Conan Doyle,"Mediocrity knows nothing higher than itself, but talent instantly recognizes genius.",['famous-quotes'],arthur-conan-doyle,84,2021-01-10,2021-01-10
VPGzjvTJI7Uj,Bruce Lee,All fixed set patterns are incapable of adaptability or pliability. The truth is outside of all fixed patterns.,['famous-quotes'],bruce-lee,111,2021-01-10,2021-01-10
ptKYlB1uxnOr,Laozi,"A leader is best when people barely know he exists, when his work is done, his aim fulfilled, they will say: we did it ourselves.","['wisdom', 'leadership']",laozi,129,2021-01-10,2022-07-04
-ScvfiXp-jo-,Naguib Mahfouz,You can tell whether a man is clever by his answers. You can tell whether a man is wise by his questions.,['famous-quotes'],naguib-mahfouz,105,2021-01-10,2021-01-10
XO5HJtunnL1g,Richard Bach,"Don't believe what your eyes are telling you. All they show is limitation. Look with your understanding, find out what you already know, and you'll see the way to fly.",['famous-quotes'],richard-bach,167,2021-01-10,2021-01-10
VyI86KmWFu1,Seneca the Younger,Begin at once to live and count each separate day as a separate life.,['famous-quotes'],seneca-the-younger,69,2021-01-10,2021-01-10
PrlfORUW5kZm,Augustine of Hippo,"Better to have loved and lost, than to have never loved at all.",['famous-quotes'],augustine-of-hippo,63,2021-01-10,2021-01-10
4W0N-xcOuLo6,Theodore Roosevelt,Believe you can and you're halfway there.,['famous-quotes'],theodore-roosevelt,41,2021-01-10,2021-01-10
JdALGB3Qy982,Thomas Jefferson,"I'm a great believer in luck and I find the harder I work, the more I have of it.",['famous-quotes'],thomas-jefferson,81,2021-01-10,2021-01-10
hmXfyn9YHg,Thomas Jefferson,"I hope our wisdom will grow with our power, and teach us, that the less we use our power the greater it will be.",['wisdom'],thomas-jefferson,112,2021-01-10,2021-01-10
FO7XX9krDFzO,Henry Ward Beecher,"Every artist dips his brush in his own soul, and paints his own nature into his pictures.",['famous-quotes'],henry-ward-beecher,89,2021-01-10,2021-01-10
ZIUHncH2frxc,Dale Earnhardt,The winner ain't the one with the fastest car it's the one who refuses to lose.,['famous-quotes'],dale-earnhardt,79,2021-01-10,2021-01-10
Dy894N3FJzj8,Frederick Douglass,"I prefer to be true to myself, even at the hazard of incurring the ridicule of others, rather than to be false, and to incur my own abhorrence.",['famous-quotes'],frederick-douglass,143,2021-01-10,2021-01-10
gXJa2hBwIpVh,John Dewey,Arriving at one point is the starting point to another.,['famous-quotes'],john-dewey,55,2021-01-10,2021-01-10
9RD4qy5UxMm9,Muhammad Ali,To be able to give away riches is mandatory if you wish to possess them. This is the only way that you will be truly rich.,['famous-quotes'],muhammad-ali,122,2021-01-10,2021-01-10
94-9NFLcRNOc,Oliver Wendell Holmes Jr.,What lies behind us and what lies before us are small matters compared to what lies within us.,['famous-quotes'],oliver-wendell-holmes-jr,94,2021-01-10,2021-01-10
MJw4V38c9J,Carol Burnett,Only I can change my life. No one can do it for me.,['inspirational'],carol-burnett,51,2021-01-10,2021-01-10
l3-XvfRVtd,Buddha,"Let my skin and sinews and bones dry up, together with all the flesh and blood of my body! I welcome it! But I will not move from this spot until I have attained the supreme and final wisdom.",['wisdom'],buddha,191,2021-01-10,2021-01-10
d5mCJQDeQb,Robert Frost,A poem begins in delight and ends in wisdom.,['wisdom'],robert-frost,44,2021-01-10,2021-01-10
vTuH0Rn4lt-l,Benjamin Franklin,Watch the little things; a small leak will sink a great ship.,['famous-quotes'],benjamin-franklin,61,2021-01-10,2021-01-10
V8reXkHpukCS,Dale Carnegie,Success is getting what you want. Happiness is wanting what you get.,['happiness'],dale-carnegie,68,2021-01-10,2022-07-04
_5G4HT7Jd5bb,Laozi,"If you would take, you must first give, this is the beginning of intelligence.",['wisdom'],laozi,78,2021-01-10,2022-07-04
1sVeX5R0Ct3,Seneca the Younger,The mind unlearns with difficulty what it has long learned.,['famous-quotes'],seneca-the-younger,59,2021-01-10,2021-01-10
WGKvYTlZfcdS,Stephen King,Get busy living or get busy dying.,['famous-quotes'],stephen-king,34,2021-01-10,2021-01-10
-93zOmlMP9,Nathaniel Hawthorne,"The greatest obstacle to being heroic is the doubt whether one may not be going to prove oneself a fool; the truest heroism is to resist the doubt; and the profoundest wisdom, to know when it ought to be resisted, and when it be obeyed.",['wisdom'],nathaniel-hawthorne,236,2021-01-10,2021-06-17
mRyh-i79x-,Martin Luther King Jr.,Love is the only force capable of transforming an enemy into a friend.,"['friendship', 'love']",martin-luther-king-jr,70,2021-01-10,2021-01-10
2JW89vF7EEGl,Billy Wilder,"Trust your own instinct. Your mistakes might as well be your own, instead of someone else's.",['famous-quotes'],billy-wilder,92,2020-12-19,2022-01-07
_8BQWXM3flJ-,John Dewey,"The self is not something ready-made, but something in continuous formation through choice of action.",['famous-quotes'],john-dewey,101,2020-12-19,2020-12-19
_cllvgW3qw9C,Seneca the Younger,Most powerful is he who has himself in his own power.,['famous-quotes'],seneca-the-younger,53,2020-12-19,2020-12-19
Rwi_mTUgp02y,William Shakespeare,"All the world is a stage, And all the men and women merely players. They have their exits and entrances; Each man in his time plays many parts.",['famous-quotes'],william-shakespeare,143,2020-12-19,2021-06-17
GLwOgSgQOg,Libby Larsen,The great myth of our times is that technology is communication.,['technology'],libby-larsen,64,2020-12-19,2020-12-19
9dfEMpnCoiQ,Christopher Reeve,"Once you choose hope, anything's possible.",['famous-quotes'],christopher-reeve,42,2020-12-19,2022-01-07
UXR4urX1Deim,Danilo Dolci,"It's important to know that words don't move mountains. Work, exacting work moves mountains.",['famous-quotes'],danilo-dolci,92,2020-12-19,2020-12-19
_KiEvJQt0dRj,Napoleon Hill,Your big opportunity may be right where you are now.,['famous-quotes'],napoleon-hill,52,2020-12-19,2020-12-19
tuumN1PRD0F,Princess Diana,Only do what your heart tells you.,['famous-quotes'],princess-diana,34,2020-12-19,2020-12-19
uXHzy3qRhoCy,Thích Nhất Hạnh,"If we are not fully ourselves, truly in the present moment, we miss everything.",['famous-quotes'],thich-nhat-hanh,79,2020-12-19,2020-12-19
i067mT4BGk,James F. Byrnes,Friendship without self-interest is one of the rare and beautiful things of life.,['friendship'],james-f-byrnes,81,2020-12-19,2020-12-19
