"symbol","market","name","industry","supersector","sector","subsector","listedDate","issueShare","marketCap","priceChangedFiveDayPercent","priceChangedOneMonthPercent","priceChangedThreeMonthsPercent"
"BCE","HOSE","Binh Duong Construction And Civil Engineering Joint Stock Company","Industrials","Construction & Materials","Construction & Materials","Heavy Construction","2010-06-28","35000000","314300000000","N/A","N/A","N/A"
"BWE","HOSE","Binh Duong Water Environment Joint Stock Company","Utilities","Utilities","Gas, Water & Multi-utilities","Water","2017-07-20","192920000","9819628000000","N/A","N/A","N/A"
"IJC","HOSE","Becamex Infrastructure Development Joint Stock Company","Financials","Real Estate","Real Estate Investment & Services","Real Estate Holding & Development","2010-04-19","217097323","4472204853800","N/A","N/A","N/A"
"TDC","HOSE","Binhduong Trade And Development Joint Stock Company","Financials","Real Estate","Real Estate Investment & Services","Real Estate Services","2010-05-04","100000000","2435000000000","N/A","N/A","N/A"
"TTN","UPCOM","Viet Nam Technology & Telecommunication Joint Stock Company","Telecommunications","Telecommunications","Fixed Line Telecommunications","Fixed Line Telecommunications","2017-04-19","36727500","439921995000","N/A","N/A","N/A"
"UDJ","UPCOM","Becamex Urban Development Joint Stock Company","Industrials","Construction & Materials","Construction & Materials","Heavy Construction","2009-12-22","16500000","220308000000","N/A","N/A","N/A"