"symbol","market","name","industry","supersector","sector","subsector","listedDate","issueShare","marketCap","priceChangedFiveDayPercent","priceChangedOneMonthPercent","priceChangedThreeMonthsPercent"
"PAI","UPCOM","Petroleum Information Technology Telecom and Automation Joint Stock Company","Telecommunications","Telecommunications","Fixed Line Telecommunications","Fixed Line Telecommunications","2017-01-23","4235290","55058770000","N/A","N/A","N/A"
"PCE","HNX","Central Petrovietnam Fertilizer and Chemicals Joint Stock Company","Basic Materials","Chemicals","Chemicals","Specialty Chemicals","2015-07-23","10000000","285000000000","N/A","N/A","N/A"
"PMB","HNX","North PetroVietnam Fertilizer and Chemicals Joint Stock Company","Basic Materials","Chemicals","Chemicals","Specialty Chemicals","2015-10-07","12000000","171600000000","N/A","N/A","N/A"
"PMP","HNX","Dam Phu My Packing Joint Stock Company","Industrials","Industrial Goods & Services","General Industrials","Containers & Packaging","2015-09-22","4200000","75180000000","N/A","N/A","N/A"
"PSE","HNX","South-East PetroVietnam Fertilizer and Chemicals Joint Stock Company","Basic Materials","Chemicals","Chemicals","Specialty Chemicals","2015-03-18","12500000","261250000000","N/A","N/A","N/A"
"PSW","HNX","South West PetroVietNam Fertilizer and Chemicals Joint Stock Company","Basic Materials","Chemicals","Chemicals","Specialty Chemicals","2013-07-05","17000000","215900000000","N/A","N/A","N/A"
"PXC","UPCOM","Petrovietnam Urban Develoment Joint Stock Company","Financials","Real Estate","Real Estate Investment & Services","Real Estate Holding & Development","2017-02-09","28068900","14034450000","N/A","N/A","N/A"