"symbol","market","name","industry","supersector","sector","subsector","listedDate","issueShare","marketCap","priceChangedFiveDayPercent","priceChangedOneMonthPercent","priceChangedThreeMonthsPercent"
"POS","UPCOM","PTSC Offshore Services Joint Stock Company","Oil & Gas","Oil & Gas","Oil Equipment, Services & Distribution","Oil Equipment & Services","2016-11-25","40000000","570440000000","5.59","6.99","N/A"
"PQN","UPCOM","PTSC Quang Ngai Joint Stock Company","Industrials","Industrial Goods & Services","Industrial Transportation","Transportation Services","2019-10-04","30000000","120000000000","N/A","N/A","N/A"
"PSB","UPCOM","Sao Mai - Ben Dinh Petroleum Investment Joint Stock Company","Industrials","Construction & Materials","Construction & Materials","Heavy Construction","2010-02-25","50000000","394900000000","6.33","N/A","N/A"
"PSN","UPCOM","PTSC Thanh Hoa Technical Services Company","Industrials","Industrial Goods & Services","Industrial Transportation","Transportation Services","2017-06-29","40000000","516000000000","N/A","N/A","N/A"
"PSP","UPCOM","Dinh Vu Petroleum Service Port Joint Stock Company","Industrials","Industrial Goods & Services","Industrial Transportation","Trucking","2009-11-10","22500000","400000000000","N/A","N/A","N/A"