"symbol","market","name","industry","supersector","sector","subsector","listedDate","issueShare","marketCap","priceChangedFiveDayPercent","priceChangedOneMonthPercent","priceChangedThreeMonthsPercent"
"ITD","HOSE","Innovative Technology Development Corporation","Technology","Technology","Technology Hardware & Equipment","Computer Hardware","2011-12-20","21343654","230795406100","N/A","N/A","N/A"
"LTC","UPCOM","Low Current Telecommunication Joint Stock Company","Technology","Technology","Technology Hardware & Equipment","Computer Hardware","2006-12-14","4586000","7745754000","N/A","N/A","N/A"
"ONE","HNX","One Communication Technology Corporation","Technology","Technology","Technology Hardware & Equipment","Computer Hardware","2008-06-24","7960310","56044971800","N/A","N/A","N/A"
"POT","HNX","Post and Telecommunication Equipment JSC","Technology","Technology","Technology Hardware & Equipment","Computer Hardware","2006-12-20","19430006","503237155400","N/A","N/A","N/A"
"VEC","UPCOM","Vietnam Electronics And Informatics Joint Stock Corporation","Technology","Technology","Technology Hardware & Equipment","Computer Hardware","2017-07-14","43800000","536462400000","N/A","N/A","N/A"