symbol,name,lastsale,netchange,pctchange,marketCap,url
KAIRU,Kairos Acquisition Corp. Unit,$10.05,-0.02,-0.199%,NA,/market-activity/stocks/kairu
KAIRW,Kairos Acquisition Corp. Warrant,$0.0032,-0.0175,-84.541%,NA,/market-activity/stocks/kairw
KAL,Kalera Public Limited Company Ordinary Shares,$0.1568,0.0068,4.533%,"14,406,443",/market-activity/stocks/kal
KALA,"Kala Pharmaceuticals, Inc. Common Stock",$5.2729,-0.0171,-0.323%,"295,598,062",/market-activity/stocks/kala
KALU,Kaiser Aluminum Corporation Common Stock,$89.65,-0.75,-0.83%,"1,429,077,031",/market-activity/stocks/kalu
KALV,"KalVista Pharmaceuticals, Inc. Common Stock",$5.34,-0.05,-0.928%,"131,374,803",/market-activity/stocks/kalv
KALWW,Kalera Public Limited Company Warrant,$0.0204,0.0014,7.368%,NA,/market-activity/stocks/kalww
KAMN,Kaman Corporation Common Stock,$20.685,0.315,1.546%,"579,570,843",/market-activity/stocks/kamn
KAR,"KAR Auction Services, Inc Common Stock",$14.07,0.33,2.402%,"1,532,333,365",/market-activity/stocks/kar
KARO,Karooooo Ltd. Ordinary Shares,$25.00,-0.4899,-1.922%,"773,777,650",/market-activity/stocks/karo
KAVL,"Kaival Brands Innovations Group, Inc. Common Stock",$1.0259,-0.0441,-4.121%,"57,623,869",/market-activity/stocks/kavl
KB,KB Financial Group Inc,$40.40,0.99,2.512%,"15,601,627,924",/market-activity/stocks/kb
KBAL,"Kimball International, Inc. Class B Common Stock",$7.1675,0.0075,0.105%,"262,140,604",/market-activity/stocks/kbal
KBH,KB Home Common Stock,$32.6405,1.2505,3.984%,"2,793,511,668",/market-activity/stocks/kbh
KBNT,"Kubient, Inc. Common Stock",$1.00,0.0098,0.99%,"14,402,500",/market-activity/stocks/kbnt
KBNTW,"Kubient, Inc. Warrant",$0.1184,0.0262,28.416%,NA,/market-activity/stocks/kbntw
KBR,"KBR, Inc. Common Stock",$51.95,0.28,0.542%,"7,127,343,577",/market-activity/stocks/kbr
KC,Kingsoft Cloud Holdings Limited American Depositary Shares,$2.83,-0.19,-6.291%,"680,781,180",/market-activity/stocks/kc
KCGI,Kensington Capital Acquisition Corp. V Class A Ordinary Shares,$10.14,UNCH,--,"349,830,000",/market-activity/stocks/kcgi
KD,"Kyndryl Holdings, Inc. Common Stock",$11.906,0.196,1.674%,"2,700,162,490",/market-activity/stocks/kd
KDNY,"Chinook Therapeutics, Inc. Common Stock",$22.31,-0.34,-1.501%,"1,426,515,232",/market-activity/stocks/kdny
KDP,Keurig Dr Pepper Inc. Common Stock,$38.73,0.06,0.155%,"54,851,413,120",/market-activity/stocks/kdp
KE,"Kimball Electronics, Inc. Common Stock",$22.83,-0.26,-1.126%,"564,136,857",/market-activity/stocks/ke
KELYA,"Kelly Services, Inc. Class A Common Stock",$17.075,0.085,0.50%,"647,962,476",/market-activity/stocks/kelya
KELYB,"Kelly Services, Inc. Class B Common Stock",$16.45,UNCH,--,"624,244,962",/market-activity/stocks/kelyb
KEN,Kenon Holdings Ltd. Ordinary Shares,$37.00,1.09,3.035%,"1,993,724,132",/market-activity/stocks/ken
KEP,Korea Electric Power Corporation Common Stock,$8.00,-0.08,-0.99%,"10,271,425,232",/market-activity/stocks/kep
KEQU,Kewaunee Scientific Corporation Common Stock,$16.70,UNCH,--,"47,264,340",/market-activity/stocks/kequ
KERN,Akerna Corp. Common Stock,$0.8498,-0.0102,-1.186%,"11,947,089",/market-activity/stocks/kern
KERNW,Akerna Corp Warrant,$0.0188,UNCH,--,NA,/market-activity/stocks/kernw
KEX,Kirby Corporation Common Stock,$69.43,-0.36,-0.516%,"4,158,857,000",/market-activity/stocks/kex
KEY,KeyCorp Common Stock,$18.75,-0.06,-0.319%,"17,493,179,869",/market-activity/stocks/key
KEY^I,"KeyCorp Depositary Shares Each Representing a 1/40th Ownership Interest in a Share of Fixed-to-Floating Rate Perpetual Non-Cumulative Preferred Stock, Series E",$24.92,0.09,0.362%,NA,/market-activity/stocks/key^i
KEY^J,"KeyCorp Depositary Shares each representing a 1/40th ownership interest in a share of Fixed Rate Perpetual Non-Cumulative Preferred Stock, Series F",$23.677,-0.023,-0.097%,NA,/market-activity/stocks/key^j
KEY^K,"KeyCorp Depositary Shares, each representing a 1/40th ownership interest in a share of Fixed Rate Perpetual Non-Cumulative Preferred Stock, Series G",$23.45,0.17,0.73%,NA,/market-activity/stocks/key^k
KEY^L,"KeyCorp Depositary Shares each representing a 1/40th ownership interest in a share of Fixed Rate Perpetual Non-Cumulative Preferred Stock, Series H",$24.87,0.06,0.242%,NA,/market-activity/stocks/key^l
KEYS,Keysight Technologies Inc. Common Stock,$183.89,3.00,1.658%,"32,824,365,000",/market-activity/stocks/keys
KF,"Korea Fund, Inc. (The) New Common Stock",$25.0776,0.0876,0.351%,"125,475,922",/market-activity/stocks/kf
KFFB,Kentucky First Federal Bancorp Common Stock,$7.2499,UNCH,--,"59,120,723",/market-activity/stocks/kffb
KFRC,"Kforce, Inc. Common Stock",$59.435,0.365,0.618%,"1,233,492,950",/market-activity/stocks/kfrc
KFS,"Kingsway Financial Services, Inc. Common Stock (DE)",$7.30,UNCH,--,"176,839,697",/market-activity/stocks/kfs
KFY,Korn Ferry Common Stock,$57.98,0.95,1.666%,"3,094,966,022",/market-activity/stocks/kfy
KGC,Kinross Gold Corporation Common Stock,$4.375,0.245,5.932%,"5,623,654,654",/market-activity/stocks/kgc
KHC,The Kraft Heinz Company Common Stock,$39.83,0.48,1.22%,"48,788,968,432",/market-activity/stocks/khc
KIDS,OrthoPediatrics Corp. Common Stock,$44.035,0.045,0.102%,"1,008,027,203",/market-activity/stocks/kids
KIM,Kimco Realty Corporation Common Stock,$23.085,0.165,0.72%,"14,277,168,237",/market-activity/stocks/kim
KIM^L,"Kimco Realty Corporation Class L Depositary Shares, each of which represents a one-one thousandth fractional interest in a share of 5.125% Class L Cumulative Redeemable Preferred Stock, liquidation preference $25,000.00 per share",$20.9255,0.0155,0.074%,NA,/market-activity/stocks/kim^l
KIM^M,"Kimco Realty Corporation Class M Depositary Shares, each of which represents a one-one thousandth fractional interest in a share of 5.25% Class M Cumulative Redeemable Preferred Stock, liquidation preference $25,000.00 per share",$21.1178,-0.0122,-0.058%,NA,/market-activity/stocks/kim^m
KIND,"Nextdoor Holdings, Inc. Class A Common Stock",$2.225,-0.025,-1.111%,"822,277,444",/market-activity/stocks/kind
KINS,"Kingstone Companies, Inc. Common Stock",$0.9999,-0.0101,-1.00%,"10,683,431",/market-activity/stocks/kins
KINZ,KINS Technology Group Inc. Class A Common Stock,$10.11,-0.01,-0.099%,"79,242,180",/market-activity/stocks/kinz
KINZU,KINS Technology Group Inc. Unit,$10.11,0.035,0.347%,NA,/market-activity/stocks/kinzu
KINZW,KINS Technology Group Inc. Warrant,$0.0213,-0.0267,-55.625%,NA,/market-activity/stocks/kinzw
KIO,KKR Income Opportunities Fund Common Shares,$11.68,0.11,0.951%,"260,934,879",/market-activity/stocks/kio
KIQ,Kelso Technologies Inc Ordinary Shares,$0.24,0.0051,2.171%,"13,036,821",/market-activity/stocks/kiq
KIRK,"Kirkland's, Inc. COMMONSTOCK",$3.88,0.04,1.042%,"49,486,948",/market-activity/stocks/kirk
KITT,"Nauticus Robotics, Inc. Common stock",$3.6901,-0.0999,-2.636%,"174,360,070",/market-activity/stocks/kitt
KITTW,"Nauticus Robotics, Inc. Warrant",$0.155,-0.005,-3.125%,NA,/market-activity/stocks/kittw
KKR,KKR & Co. Inc. Common Stock,$52.56,0.64,1.233%,"45,260,039,519",/market-activity/stocks/kkr
KKR^C,KKR & Co. Inc. 6.00% Series C Mandatory Convertible Preferred Stock,$62.85,UNCH,--,NA,/market-activity/stocks/kkr^c
KKRS,KKR Group Finance Co. IX LLC 4.625% Subordinated Notes due 2061,$18.425,0.095,0.518%,NA,/market-activity/stocks/kkrs
KLAC,KLA Corporation Common Stock,$384.38,-8.77,-2.231%,"54,473,690,532",/market-activity/stocks/klac
KLAQ,KL Acquisition Corp Class A Common Stock,$10.06,-0.005,-0.05%,"361,531,250",/market-activity/stocks/klaq
KLAQU,KL Acquisition Corp Unit,$10.04,UNCH,--,NA,/market-activity/stocks/klaqu
KLAQW,KL Acquisition Corp Warrant,$0.0017,-0.0084,-83.168%,NA,/market-activity/stocks/klaqw
KLIC,"Kulicke and Soffa Industries, Inc. Common Stock",$46.98,-0.97,-2.023%,"2,678,752,056",/market-activity/stocks/klic
KLR,"Kaleyra, Inc. Common Stock",$1.1815,0.0115,0.983%,"53,204,780",/market-activity/stocks/klr
KLTR,"Kaltura, Inc. Common Stock",$1.92,0.01,0.524%,"255,868,537",/market-activity/stocks/kltr
KLXE,"KLX Energy Services Holdings, Inc. Common Stock",$16.49,0.71,4.499%,"202,421,560",/market-activity/stocks/klxe
KMB,Kimberly-Clark Corporation Common Stock,$136.49,0.86,0.634%,"46,064,295,910",/market-activity/stocks/kmb
KMDA,Kamada Ltd. Ordinary Shares,$4.66,-0.04,-0.851%,"208,770,349",/market-activity/stocks/kmda
KMF,"Kayne Anderson NextGen Energy & Infrastructure, Inc.",$8.15,0.12,1.494%,"384,659,315",/market-activity/stocks/kmf
KMI,"Kinder Morgan, Inc. Common Stock",$19.30,0.18,0.941%,"43,381,421,970",/market-activity/stocks/kmi
KMPB,Kemper Corporation 5.875% Fixed-Rate Reset Junior Subordinated Debentures due 2062,$19.9265,0.0165,0.083%,NA,/market-activity/stocks/kmpb
KMPH,"KemPharm, Inc. Common Stock",$4.7401,-0.0199,-0.418%,"163,556,496",/market-activity/stocks/kmph
KMPR,Kemper Corporation,$56.96,0.04,0.07%,"3,638,897,688",/market-activity/stocks/kmpr
KMT,Kennametal Inc. Common Stock,$26.78,0.36,1.363%,"2,157,835,644",/market-activity/stocks/kmt
KMX,CarMax Inc,$69.7043,0.3443,0.496%,"11,014,359,189",/market-activity/stocks/kmx
KN,Knowles Corporation Common Stock,$15.90,0.30,1.923%,"1,446,048,507",/market-activity/stocks/kn
KNBE,"KnowBe4, Inc. Class A Common Stock",$24.68,-0.01,-0.041%,"4,354,601,912",/market-activity/stocks/knbe
KNDI,"Kandi Technologies Group, Inc Common Stock",$2.74,0.01,0.366%,"203,397,683",/market-activity/stocks/kndi
KNOP,KNOT Offshore Partners LP Common Units representing Limited Partner Interests,$11.0367,-0.4233,-3.694%,"374,816,773",/market-activity/stocks/knop
KNSA,"Kiniksa Pharmaceuticals, Ltd. Class A Common Stock",$16.755,-0.075,-0.446%,"1,165,004,672",/market-activity/stocks/knsa
KNSL,"Kinsale Capital Group, Inc. Common Stock",$304.76,-3.45,-1.119%,"7,033,932,419",/market-activity/stocks/knsl
KNSW,KnightSwan Acquisition Corporation Class A Common Stock,$10.10,UNCH,--,"290,375,000",/market-activity/stocks/knsw
KNTE,Kinnate Biopharma Inc. Common Stock,$8.31,0.39,4.924%,"367,008,516",/market-activity/stocks/knte
KNTK,Kinetik Holdings Inc. Class A Common Stock,$34.74,0.71,2.086%,"4,689,738,251",/market-activity/stocks/kntk
KNW,"Know Labs, Inc. Common Stock",$1.60,0.07,4.575%,"76,782,850",/market-activity/stocks/knw
KNX,Knight-Swift Transportation Holdings Inc.,$55.37,-0.06,-0.108%,"8,897,737,520",/market-activity/stocks/knx
KO,Coca-Cola Company (The) Common Stock,$63.79,0.18,0.283%,"275,860,701,111",/market-activity/stocks/ko
KOD,Kodiak Sciences Inc Common Stock,$7.48,0.10,1.355%,"391,272,472",/market-activity/stocks/kod
KODK,Eastman Kodak Company Common New,$4.185,-0.045,-1.064%,"331,040,933",/market-activity/stocks/kodk
KOF,"Coca Cola Femsa S.A.B. de C.V.  American Depositary Shares, each representing 10 Units (each Unit consists of 3 Series B Shares and 5 Series L Shares)",$68.79,0.48,0.703%,"14,451,625,117",/market-activity/stocks/kof
KOP,Koppers Holdings Inc. Koppers Holdings Inc. Common Stock,$30.13,0.34,1.141%,"629,656,891",/market-activity/stocks/kop
KOPN,Kopin Corporation Common Stock,$1.67,0.05,3.086%,"158,857,845",/market-activity/stocks/kopn
KORE,"KORE Group Holdings, Inc. Common Stock",$2.34,-0.04,-1.681%,"178,517,994",/market-activity/stocks/kore
KOS,Kosmos Energy Ltd. Common Shares (DE),$6.65,UNCH,--,"3,031,691,782",/market-activity/stocks/kos
KOSS,Koss Corporation Common Stock,$6.50,0.05,0.775%,"59,668,668",/market-activity/stocks/koss
KPLT,"Katapult Holdings, Inc. Common Stock",$1.21,0.01,0.833%,"119,122,375",/market-activity/stocks/kplt
KPLTW,"Katapult Holdings, Inc. Warrant",$0.1279,0.0289,29.192%,NA,/market-activity/stocks/kpltw
KPRX,"Kiora Pharmaceuticals, Inc.  Common Stock",$3.65,0.10,2.817%,"4,167,800",/market-activity/stocks/kprx
KPTI,Karyopharm Therapeutics Inc. Common Stock,$5.19,-0.10,-1.89%,"421,194,585",/market-activity/stocks/kpti
KR,Kroger Company (The) Common Stock,$47.8702,-1.3198,-2.683%,"34,265,791,652",/market-activity/stocks/kr
KRBP,"Kiromic BioPharma, Inc. Common Stock",$0.2565,-0.0011,-0.427%,"4,680,283",/market-activity/stocks/krbp
KRC,Kilroy Realty Corporation Common Stock,$43.95,0.73,1.689%,"5,136,764,059",/market-activity/stocks/krc
KREF,KKR Real Estate Finance Trust Inc. Common Stock,$16.73,0.18,1.088%,"1,155,959,534",/market-activity/stocks/kref
KREF^A,KKR Real Estate Finance Trust Inc. 6.50% Series A Cumulative Redeemable Preferred Stock,$17.85,0.10,0.563%,NA,/market-activity/stocks/kref^a
KRG,Kite Realty Group Trust Common Stock,$22.86,0.06,0.263%,"5,008,601,014",/market-activity/stocks/krg
KRKR,36Kr Holdings Inc. American Depositary Shares,$1.15,0.04,3.604%,"46,709,007",/market-activity/stocks/krkr
KRMD,"KORU Medical Systems, Inc. Common Stock",$3.10,0.15,5.085%,"140,367,839",/market-activity/stocks/krmd
KRNL,"Kernel Group Holdings, Inc. Class A Ordinary Shares",$10.04,UNCH,--,"382,461,250",/market-activity/stocks/krnl
KRNLU,"Kernel Group Holdings, Inc. Units",$10.05,0.03,0.299%,NA,/market-activity/stocks/krnlu
KRNLW,"Kernel Group Holdings, Inc. Warrants",$0.0216,UNCH,--,NA,/market-activity/stocks/krnlw
KRNT,Kornit Digital Ltd. Ordinary Shares,$25.61,-0.03,-0.117%,"1,278,258,920",/market-activity/stocks/krnt
KRNY,Kearny Financial Corp Common Stock,$9.53,-0.14,-1.448%,"643,920,858",/market-activity/stocks/krny
KRO,Kronos Worldwide Inc Common Stock,$9.50,0.29,3.149%,"1,096,965,257",/market-activity/stocks/kro
KRON,"Kronos Bio, Inc. Common Stock",$1.90,UNCH,--,"108,106,911",/market-activity/stocks/kron
KROS,"Keros Therapeutics, Inc. Common Stock",$48.80,-1.04,-2.087%,"1,344,110,649",/market-activity/stocks/kros
KRP,Kimbell Royalty Partners Common Units Representing Limited Partner Interests,$17.64,0.37,2.142%,"1,059,849,267",/market-activity/stocks/krp
KRT,Karat Packaging Inc. Common Stock,$13.82,UNCH,--,"275,128,726",/market-activity/stocks/krt
KRTX,"Karuna Therapeutics, Inc. Common Stock",$228.04,-7.27,-3.09%,"7,836,087,667",/market-activity/stocks/krtx
KRUS,"Kura Sushi USA, Inc. Class A Common Stock",$66.64,0.94,1.431%,"652,333,962",/market-activity/stocks/krus
KRYS,"Krystal Biotech, Inc. Common Stock",$77.5095,-0.2305,-0.297%,"1,995,687,245",/market-activity/stocks/krys
KSCP,"Knightscope, Inc. Class A Common Stock",$2.17,-0.01,-0.459%,"81,441,636",/market-activity/stocks/kscp
KSI,Kadem Sustainable Impact Corporation Class A common stock,$9.95,UNCH,--,"217,656,250",/market-activity/stocks/ksi
KSICW,Kadem Sustainable Impact Corporation Warrant,$0.025,UNCH,--,NA,/market-activity/stocks/ksicw
KSM,DWS Strategic Municipal Income Trust,$8.38,0.04,0.48%,"93,889,026",/market-activity/stocks/ksm
KSPN,Kaspien Holdings Inc. Common Stock,$0.805,-0.03,-3.593%,"2,910,712",/market-activity/stocks/kspn
KSS,Kohl's Corporation Common Stock,$31.87,-0.21,-0.655%,"3,717,253,697",/market-activity/stocks/kss
KT,KT Corporation Common Stock,$14.22,-0.04,-0.281%,"7,281,853,762",/market-activity/stocks/kt
KTB,"Kontoor Brands, Inc. Common Stock ",$44.29,0.84,1.933%,"2,456,573,151",/market-activity/stocks/ktb
KTCC,Key Tronic Corporation Common Stock,$4.8773,0.0123,0.253%,"52,488,873",/market-activity/stocks/ktcc
KTF,DWS Municipal Income Trust,$8.99,0.06,0.672%,"355,113,433",/market-activity/stocks/ktf
KTH,Structures Products Cp 8% CorTS Issued by Peco Energy Cap Tr II Preferred Stock,$28.75,-0.1464,-0.507%,NA,/market-activity/stocks/kth
KTN,Structured Products Corp 8.205% CorTS 8.205% Corporate Backed Trust Securities (CorTS),$27.7108,-0.1591,-0.571%,NA,/market-activity/stocks/ktn
KTOS,"Kratos Defense & Security Solutions, Inc. Common Stock",$9.72,0.20,2.101%,"1,224,301,914",/market-activity/stocks/ktos
KTRA,"Kintara Therapeutics, Inc. Common Stock",$7.06,0.36,5.373%,"11,409,991",/market-activity/stocks/ktra
KTTA,Pasithea Therapeutics Corp. Common Stock,$0.9751,-0.0151,-1.525%,"28,520,396",/market-activity/stocks/ktta
KTTAW,Pasithea Therapeutics Corp. Warrant,$0.0421,-0.0111,-20.865%,NA,/market-activity/stocks/kttaw
KUKE,"Kuke Music Holding Limited American Depositary Shares, each representing one Ordinary Share",$0.67,0.03,4.688%,"19,810,058",/market-activity/stocks/kuke
KULR,"KULR Technology Group, Inc. Common Stock",$1.75,0.03,1.744%,"197,306,527",/market-activity/stocks/kulr
KURA,"Kura Oncology, Inc. Common Stock",$15.67,-0.10,-0.634%,"1,048,275,551",/market-activity/stocks/kura
KVHI,"KVH Industries, Inc. Common Stock",$11.48,0.09,0.79%,"218,981,677",/market-activity/stocks/kvhi
KVSA,Khosla Ventures Acquisition Co. Class A Common Stock,$9.96,UNCH,--,"403,280,400",/market-activity/stocks/kvsa
KVSC,Khosla Ventures Acquisition Co. III Class A Common Stock,$9.93,-0.01,-0.101%,"623,175,272",/market-activity/stocks/kvsc
KW,Kennedy-Wilson Holdings Inc. Common Stock,$17.29,0.27,1.586%,"2,382,402,379",/market-activity/stocks/kw
KWR,Quaker Houghton Common Stock,$198.12,1.33,0.676%,"3,552,621,272",/market-activity/stocks/kwr
KXIN,Kaixin Auto Holdings Ordinary Shares,$0.501,0.011,2.245%,"98,844,892",/market-activity/stocks/kxin
KYCHR,Keyarch Acquisition Corporation Rights,$0.07,UNCH,--,NA,/market-activity/stocks/kychr
KYCHU,Keyarch Acquisition Corporation Unit,$10.08,-0.05,-0.494%,NA,/market-activity/stocks/kychu
KYMR,"Kymera Therapeutics, Inc. Common Stock",$28.485,-0.495,-1.708%,"1,562,821,749",/market-activity/stocks/kymr
KYN,"Kayne Anderson Energy Infrastructure Fund, Inc.",$9.15,0.11,1.217%,"1,245,603,500",/market-activity/stocks/kyn
KZIA,Kazia Therapeutics Limited American Depositary Shares,$0.63,0.0264,4.374%,"9,520,106",/market-activity/stocks/kzia
KZR,"Kezar Life Sciences, Inc. Common Stock",$7.66,-0.15,-1.921%,"523,775,932",/market-activity/stocks/kzr
L,Loews Corporation Common Stock,$57.77,-0.38,-0.653%,"13,716,160,794",/market-activity/stocks/l
LAAA,Lakeshore Acquisition I Corp. Ordinary Shares,$10.45,UNCH,--,"46,913,269",/market-activity/stocks/laaa
LAAAU,Lakeshore Acquisition I Corp. Unit,$10.75,0.52,5.083%,NA,/market-activity/stocks/laaau
LAAAW,Lakeshore Acquisition I Corp. Warrant,$0.13,-0.0076,-5.523%,NA,/market-activity/stocks/laaaw
LAB,Standard BioTools Inc. Common Stock,$1.37,-0.02,-1.439%,"108,636,127",/market-activity/stocks/lab
LABP,"Landos Biopharma, Inc. Common Stock",$0.2253,0.0103,4.791%,"9,069,427",/market-activity/stocks/labp
LAC,Lithium Americas Corp. Common Shares,$25.12,0.14,0.56%,"3,391,200,000",/market-activity/stocks/lac
LAD,"Lithia Motors, Inc. Common Stock",$240.4919,1.1819,0.494%,"6,574,666,404",/market-activity/stocks/lad
LADR,Ladder Capital Corp Class A Common Stock,$11.19,0.09,0.811%,"1,416,255,065",/market-activity/stocks/ladr
LAKE,"Lakeland Industries, Inc. Common Stock",$13.48,0.15,1.125%,"101,298,493",/market-activity/stocks/lake
LAMR,Lamar Advertising Company Class A Common Stock,$100.95,0.81,0.809%,"10,264,946,297",/market-activity/stocks/lamr
LANC,Lancaster Colony Corporation Common Stock,$206.54,-0.60,-0.29%,"5,690,796,620",/market-activity/stocks/lanc
LAND,Gladstone Land Corporation Common Stock,$20.89,0.35,1.704%,"724,966,664",/market-activity/stocks/land
LANDM,Gladstone Land Corporation 5.00% Series D Cumulative Term Preferred Stock,$23.50,UNCH,--,"566,406,541",/market-activity/stocks/landm
LANDO,Gladstone Land Corporation 6.00% Series B Cumulative Redeemable Preferred Stock,$25.02,0.01,0.04%,NA,/market-activity/stocks/lando
LARK,Landmark Bancorp Inc. Common Stock,$25.65,1.3071,5.37%,"121,333,888",/market-activity/stocks/lark
LASE,Laser Photonics Corporation Common Stock,$2.0997,0.0297,1.435%,"16,542,312",/market-activity/stocks/lase
LASR,"nLIGHT, Inc. Common Stock",$11.035,0.175,1.611%,"499,963,860",/market-activity/stocks/lasr
LATG,LatAmGrowth SPAC Class A Ordinary Shares,$10.21,UNCH,--,"165,912,500",/market-activity/stocks/latg
LATGU,LatAmGrowth SPAC Unit,$10.24,0.01,0.098%,NA,/market-activity/stocks/latgu
LATGW,LatAmGrowth SPAC Warrants,$0.10,0.0087,9.529%,NA,/market-activity/stocks/latgw
LAUR,"Laureate Education, Inc. Common Stock",$10.435,-0.045,-0.429%,"1,635,125,661",/market-activity/stocks/laur
LAW,"CS Disco, Inc. Common Stock",$7.91,0.09,1.151%,"466,988,642",/market-activity/stocks/law
LAZ,"Lazard LTD. Lazard, LTD. Class A Common Stock",$36.59,-0.02,-0.055%,"3,143,644,449",/market-activity/stocks/laz
LAZR,"Luminar Technologies, Inc.  Class A Common Stock",$8.01,0.35,4.569%,"2,905,690,387",/market-activity/stocks/lazr
LAZY,"Lazydays Holdings, Inc. Common Stock",$13.912,0.062,0.448%,"146,586,612",/market-activity/stocks/lazy
LBAI,"Lakeland Bancorp, Inc. Common Stock",$18.60,-0.08,-0.428%,"1,205,458,169",/market-activity/stocks/lbai
LBBB,Lakeshore Acquisition II Corp. Ordinary Shares,$10.13,0.01,0.099%,"92,603,395",/market-activity/stocks/lbbb
LBBBU,Lakeshore Acquisition II Corp. Unit,$10.22,-0.04,-0.39%,NA,/market-activity/stocks/lbbbu
LBC,Luther Burbank Corporation Common Stock,$11.695,-0.165,-1.391%,"597,317,505",/market-activity/stocks/lbc
LBPH,"Longboard Pharmaceuticals, Inc. Common Stock",$5.37,UNCH,--,"92,446,430",/market-activity/stocks/lbph
LBRDA,Liberty Broadband Corporation Class A Common Stock,$90.72,0.52,0.576%,"13,451,667,395",/market-activity/stocks/lbrda
LBRDK,Liberty Broadband Corporation Class C Common Stock,$91.23,0.37,0.407%,"13,527,288,541",/market-activity/stocks/lbrdk
LBRDP,Liberty Broadband Corporation Series A Cumulative Redeemable Preferred Stock,$23.92,UNCH,--,NA,/market-activity/stocks/lbrdp
LBRT,Liberty Energy Inc. Class A common stock,$16.49,-0.04,-0.242%,"3,003,798,942",/market-activity/stocks/lbrt
LBTYA,Liberty Global plc Class A Ordinary Shares,$19.92,-0.16,-0.797%,"9,158,276,812",/market-activity/stocks/lbtya
LBTYB,Liberty Global plc Class B Ordinary Shares,$19.60,UNCH,--,"9,011,155,899",/market-activity/stocks/lbtyb
LBTYK,Liberty Global plc Class C Ordinary Shares,$20.57,-0.11,-0.532%,"9,457,116,166",/market-activity/stocks/lbtyk
LC,LendingClub Corporation Common Stock,$10.415,0.105,1.018%,"1,094,498,769",/market-activity/stocks/lc
LCA,"Landcadia Holdings IV, Inc. Class A Common Stock",$10.01,-0.0163,-0.163%,"625,625,000",/market-activity/stocks/lca
LCAA,L Catterton Asia Acquisition Corp Class A Ordinary Shares,$10.02,0.01,0.10%,"358,852,192",/market-activity/stocks/lcaa
LCAAU,L Catterton Asia Acquisition Corp Units,$10.01,-0.01,-0.10%,NA,/market-activity/stocks/lcaau
LCAHU,"Landcadia Holdings IV, Inc. Units",$10.02,0.01,0.10%,NA,/market-activity/stocks/lcahu
LCAHW,"Landcadia Holdings IV, Inc. Warrant ",$0.13,0.01,8.333%,NA,/market-activity/stocks/lcahw
LCFY,Locafy Limited Ordinary Share,$0.30,UNCH,--,"6,158,641",/market-activity/stocks/lcfy
LCI,Lannett Co Inc Common Stock,$0.585,0.0299,5.386%,"25,156,529",/market-activity/stocks/lci
LCID,"Lucid Group, Inc. Common Stock",$9.915,-0.225,-2.219%,"16,661,474,257",/market-activity/stocks/lcid
LCII,LCI Industries,$99.28,0.42,0.425%,"2,524,719,489",/market-activity/stocks/lcii
LCNB,LCNB Corporation Common Stock,$18.28,0.04,0.219%,"205,969,151",/market-activity/stocks/lcnb
LCTX,"Lineage Cell Therapeutics, Inc. Common Stock",$1.465,0.015,1.034%,"219,722,673",/market-activity/stocks/lctx
LCUT,"Lifetime Brands, Inc. Common Stock",$8.315,-0.095,-1.13%,"182,965,488",/market-activity/stocks/lcut
LCW,Learn CW Investment Corporation Class A Ordinary Shares,$10.03,UNCH,--,"288,362,500",/market-activity/stocks/lcw
LDHA,LDH Growth Corp I Class A Ordinary Shares,$10.02,UNCH,--,"288,075,000",/market-activity/stocks/ldha
LDI,"loanDepot, Inc. Class A Common Stock",$1.57,-0.09,-5.422%,"265,475,682",/market-activity/stocks/ldi
LDOS,"Leidos Holdings, Inc. Common Stock",$109.84,0.51,0.466%,"15,013,980,941",/market-activity/stocks/ldos
LDP,"Cohen & Steers Limited Duration Preferred and Income Fund, Inc.",$19.475,0.215,1.116%,"566,317,829",/market-activity/stocks/ldp
LE,"Lands' End, Inc. Common Stock",$8.90,-2.66,-23.01%,"294,719,611",/market-activity/stocks/le
LEA,Lear Corporation Common Stock,$144.46,0.22,0.153%,"8,538,405,666",/market-activity/stocks/lea
LECO,"Lincoln Electric Holdings, Inc. Common Shares",$147.77,-0.11,-0.074%,"8,532,003,368",/market-activity/stocks/leco
LEDS,SemiLEDS Corporation Common Stock,$2.60,UNCH,--,"12,564,100",/market-activity/stocks/leds
LEE,"Lee Enterprises, Incorporated Common Stock",$18.39,0.39,2.167%,"109,922,823",/market-activity/stocks/lee
LEG,"Leggett & Platt, Incorporated Common Stock",$36.2898,0.6798,1.909%,"4,811,207,222",/market-activity/stocks/leg
LEGA,"Lead Edge Growth Opportunities, Ltd Class A Ordinary Shares",$10.02,UNCH,--,"432,112,500",/market-activity/stocks/lega
LEGAW,"Lead Edge Growth Opportunities, Ltd Warrant",$0.0588,-0.0012,-2.00%,NA,/market-activity/stocks/legaw
LEGH,Legacy Housing Corporation Common Stock (TX),$17.605,0.085,0.485%,"429,667,982",/market-activity/stocks/legh
LEGN,Legend Biotech Corporation American Depositary Shares,$51.40,-0.11,-0.214%,"8,604,503,509",/market-activity/stocks/legn
LEJU,"Leju Holdings Limited American Depositary Shares, each representing one Ordinary share",$1.35,-0.09,-6.25%,"18,471,051",/market-activity/stocks/leju
LEN,Lennar Corporation Class A Common Stock,$89.79,1.96,2.232%,"26,143,847,757",/market-activity/stocks/len
LEO,"BNY Mellon Strategic Municipals, Inc. Common Stock",$6.29,0.02,0.319%,"391,809,472",/market-activity/stocks/leo
LESL,"Leslie's, Inc. Common Stock",$14.16,-0.44,-3.014%,"2,591,672,005",/market-activity/stocks/lesl
LEU,Centrus Energy Corp. Class A Common Stock,$38.025,0.025,0.066%,"552,874,222",/market-activity/stocks/leu
LEV,The Lion Electric Company Common Shares,$2.73,-0.05,-1.799%,"531,563,307",/market-activity/stocks/lev
LEVI,Levi Strauss & Co Class A Common Stock,$16.83,0.30,1.815%,"6,637,633,349",/market-activity/stocks/levi
LEXX,Lexaria Bioscience Corp. Common Stock,$2.99,0.03,1.014%,"17,793,484",/market-activity/stocks/lexx
LEXXW,Lexaria Bioscience Corp. Warrant,$0.57,0.03,5.556%,NA,/market-activity/stocks/lexxw
LFAC,LF Capital Acquisition Corp. II Class A Common Stock,$10.16,0.01,0.099%,"328,612,500",/market-activity/stocks/lfac
LFACW,LF Capital Acquisition Corp. II Warrants,$0.0172,-0.0028,-14.00%,NA,/market-activity/stocks/lfacw
LFCR,"Lifecore Biomedical, Inc. Common Stock",$8.57,0.06,0.705%,"259,641,733",/market-activity/stocks/lfcr
