symbol,name,lastsale,netchange,pctchange,marketCap,url
PRVB,"Provention Bio, Inc. Common Stock",$9.05,0.01,0.111%,"789,075,536",/market-activity/stocks/prvb
PSA,Public Storage Common Stock,$299.73,1.77,0.594%,"52,644,094,035",/market-activity/stocks/psa
PSA^F,"Public Storage Depositary Shares Each Representing 1/1,000 of a 5.15% Cumulative Preferred Share of Beneficial Interest, Series F, par value $0.01 per share",$22.7223,0.2523,1.123%,NA,/market-activity/stocks/psa^f
PSA^G,"Public Storage Depositary Shares, Each Representing 1/1,000 of a 5.05% Cumulative Preferred Share of Beneficial Interest, Series G",$22.8218,0.2218,0.981%,NA,/market-activity/stocks/psa^g
PSA^H,"Public Storage Depositary Shares Each Representing 1/1,000 of a  5.60% Cumulative Preferred  Share of Beneficial Interest, Series H",$24.37,-0.12,-0.49%,NA,/market-activity/stocks/psa^h
PSA^I,"Public Storage Depositary Shares Each Representing 1/1,000 of a 4.875% Cumulative Preferred Share of Beneficial Interest, Series I, par value $0.01 per share",$21.53,0.03,0.14%,NA,/market-activity/stocks/psa^i
PSA^J,"Public Storage Depositary Shares Each Representing 1/1,000 of a 4.700% Cumulative Preferred Share of Beneficial Interest, Series J, par value $0.01 per share",$20.67,0.19,0.928%,NA,/market-activity/stocks/psa^j
PSA^K,"Public Storage Depositary Shares Each Representing 1/1,000 of a 4.75% Cumulative Preferred Share of Beneficial Interest, Series K",$21.05,0.15,0.718%,NA,/market-activity/stocks/psa^k
PSA^L,"Public Storage Depositary Shares Each Representing 1/1,000 of a 4.625% Cumulative Preferred Share of Beneficial Interest, Series L, par value $0.01 per share",$20.3499,0.1899,0.942%,NA,/market-activity/stocks/psa^l
PSA^M,"Public Storage Depositary Shares Each Representing 1/1,000 of a 4.125% Cumulative Preferred Share of Beneficial Interest, Series M",$17.81,0.04,0.225%,NA,/market-activity/stocks/psa^m
PSA^N,"Public Storage Depositary Shares Each Representing 1/1,000 of a 3.875% Cumulative Preferred Share of Beneficial Interest, Series N",$17.20,0.30,1.775%,NA,/market-activity/stocks/psa^n
PSA^O,"Public Storage Depositary Shares Each Representing 1/1,000 of a 3.900% Cumulative Preferred Share of Beneficial Interest, Series O",$17.12,0.19,1.122%,NA,/market-activity/stocks/psa^o
PSA^P,"Public Storage Depositary Shares Each Representing 1/1,000 of a 4.000% Cumulative Preferred Share of Bene cial Interest, Series P",$17.6025,0.1125,0.643%,NA,/market-activity/stocks/psa^p
PSA^Q,"Public Storage Depositary Shares Each Representing 1/1,000 of a 3.950% Cumulative Preferred Share of Beneficial Interest, Series Q, par value $0.01 per share",$17.19,0.12,0.703%,NA,/market-activity/stocks/psa^q
PSA^R,"Public Storage Depositary Shares Each Representing 1/1,000 of a 4.00% Cumulative Preferred Share of Bene cial Interest, Series R",$17.7053,0.1953,1.115%,NA,/market-activity/stocks/psa^r
PSA^S,"Public Storage Depositary Shares Each Representing 1/1,000 of a 4.100% Cumulative Preferred Share of Beneficial Interest, Series S",$17.7443,-0.1857,-1.036%,NA,/market-activity/stocks/psa^s
PSAG,Property Solutions Acquisition Corporation II Class A Common Stock,$9.99,-0.01,-0.10%,"373,918,217",/market-activity/stocks/psag
PSAGU,Property Solutions Acquisition Corporation II Units,$10.00,0.02,0.20%,NA,/market-activity/stocks/psagu
PSAGW,Property Solutions Acquisition Corporation II Warrant,$0.0412,-0.0038,-8.444%,NA,/market-activity/stocks/psagw
PSB^X,"PS Business Parks, Inc. Depositary Shares Each Representing 1/1,000 of a Share of 5.25% Cumulative Preferred Stock, Series X",$15.56,-0.04,-0.256%,NA,/market-activity/stocks/psb^x
PSB^Y,"PS Business Parks, Inc. 5.20% Cumulative Preferred Stock, Series Y",$15.60,-0.03,-0.192%,NA,/market-activity/stocks/psb^y
PSB^Z,"PS Business Parks, Inc. Depositary Shares Each Representing 1/1000 of a Share of 4.875% Cumulative Preferred Stock, Series Z , par value $0.01 per share",$14.59,-0.02,-0.137%,NA,/market-activity/stocks/psb^z
PSEC,Prospect Capital Corporation Common Stock,$7.76,0.02,0.258%,"3,085,550,398",/market-activity/stocks/psec
PSEC^A,Prospect Capital Corporation 5.35% Series A Fixed Rate Cumulative Perpetual Preferred Stock,$17.04,0.01,0.059%,NA,/market-activity/stocks/psec^a
PSF,"Cohen & Steers Select Preferred and Income Fund, Inc. Common Stock",$20.24,0.18,0.897%,"243,418,829",/market-activity/stocks/psf
PSFE,Paysafe Limited Common Shares,$1.47,0.05,3.521%,"1,069,225,024",/market-activity/stocks/psfe
PSHG,Performance Shipping Inc. Common Shares,$4.1896,0.3896,10.253%,"16,961,834",/market-activity/stocks/pshg
PSMT,"PriceSmart, Inc. Common Stock",$70.95,-0.09,-0.127%,"2,192,697,405",/market-activity/stocks/psmt
PSN,Parsons Corporation Common Stock,$49.08,-0.42,-0.848%,"5,079,923,265",/market-activity/stocks/psn
PSNL,"Personalis, Inc. Common Stock",$2.55,0.01,0.394%,"117,226,955",/market-activity/stocks/psnl
PSNY,Polestar Automotive Holding UK PLC Class A ADS,$7.059,-0.381,-5.121%,"14,890,103,163",/market-activity/stocks/psny
PSNYW,Polestar Automotive Holding UK PLC Class C-1 ADS (ADW),$1.38,0.07,5.344%,"2,910,942,395",/market-activity/stocks/psnyw
PSO,"Pearson, Plc Common Stock",$11.4781,-0.5319,-4.429%,"8,244,477,352",/market-activity/stocks/pso
PSPC,Post Holdings Partnering Corporation Series A Common Stock,$9.8301,-0.0699,-0.706%,"434,637,872",/market-activity/stocks/pspc
PSTG,"Pure Storage, Inc. Class A Common Stock",$29.74,0.55,1.884%,"8,889,827,774",/market-activity/stocks/pstg
PSTL,"Postal Realty Trust, Inc. Class A Common Stock",$15.64,0.15,0.968%,"297,812,485",/market-activity/stocks/pstl
PSTV,"PLUS THERAPEUTICS, Inc. Common Stock ",$0.3999,-0.0028,-0.695%,"13,437,189",/market-activity/stocks/pstv
PSTX,"Poseida Therapeutics, Inc. Common Stock",$4.60,0.04,0.877%,"395,367,171",/market-activity/stocks/pstx
PSX,Phillips 66 Common Stock,$107.75,-0.69,-0.636%,"50,926,120,951",/market-activity/stocks/psx
PT,Pintec Technology Holdings Limited American Depositary Shares,$0.3665,-0.0125,-3.298%,"3,180,472",/market-activity/stocks/pt
PTA,Cohen & Steers Tax-Advantaged Preferred Securities and Income Fund Common Shares of Beneficial Interest,$18.77,0.15,0.806%,"1,037,482,788",/market-activity/stocks/pta
PTC,PTC Inc. Common Stock,$127.38,0.17,0.134%,"14,963,579,411",/market-activity/stocks/ptc
PTCT,"PTC Therapeutics, Inc. Common Stock",$41.66,0.17,0.41%,"3,040,235,734",/market-activity/stocks/ptct
PTE,"PolarityTE, Inc. Common Stock",$0.7198,0.0275,3.972%,"5,207,263",/market-activity/stocks/pte
PTEN,"Patterson-UTI Energy, Inc. Common Stock",$17.95,UNCH,--,"3,891,950,054",/market-activity/stocks/pten
PTGX,"Protagonist Therapeutics, Inc. Common Stock",$7.88,-0.03,-0.379%,"387,683,479",/market-activity/stocks/ptgx
PTIX,"Protagenic Therapeutics, Inc. Common Stock",$0.5233,-0.0077,-1.45%,"9,045,377",/market-activity/stocks/ptix
PTIXW,"Protagenic Therapeutics, Inc. Warrant",$0.031,-0.009,-22.50%,NA,/market-activity/stocks/ptixw
PTLO,Portillo's Inc. Class A Common Stock,$19.81,-0.38,-1.882%,"956,876,447",/market-activity/stocks/ptlo
PTMN,Portman Ridge Finance Corporation Common Stock,$22.49,0.28,1.261%,"216,104,453",/market-activity/stocks/ptmn
PTN,"Palatin Technologies, Inc. Common Stock",$4.035,0.085,2.152%,"41,778,091",/market-activity/stocks/ptn
PTNR,Partner Communications Company Ltd. American Depositary Shares,$7.71,0.14,1.849%,"1,429,724,112",/market-activity/stocks/ptnr
PTOC,Pine Technology Acquisition Corp. Class A Common Stock,$9.96,-0.02,-0.20%,"429,525,000",/market-activity/stocks/ptoc
PTOCU,Pine Technology Acquisition Corp. Unit,$9.89,UNCH,--,NA,/market-activity/stocks/ptocu
PTOCW,Pine Technology Acquisition Corp. Warrant,$0.02,UNCH,--,NA,/market-activity/stocks/ptocw
PTON,"Peloton Interactive, Inc. Class A Common Stock",$11.32,-0.06,-0.527%,"3,849,410,386",/market-activity/stocks/pton
PTPI,"Petros Pharmaceuticals, Inc. Common Stock",$3.85,-0.261,-6.349%,"7,972,588",/market-activity/stocks/ptpi
PTRA,Proterra Inc. Common Stock,$5.425,-0.115,-2.076%,"1,223,602,001",/market-activity/stocks/ptra
PTRS,Partners Bancorp Common Stock,$8.59,UNCH,--,"154,290,994",/market-activity/stocks/ptrs
PTSI,"P.A.M. Transportation Services, Inc. Common Stock",$27.60,-0.43,-1.534%,"612,362,939",/market-activity/stocks/ptsi
PTVE,Pactiv Evergreen Inc. Common stock,$11.835,0.195,1.675%,"2,104,299,239",/market-activity/stocks/ptve
PTWO,"Pono Capital Two, Inc. Class A Common Stock",$10.10,UNCH,--,"152,175,438",/market-activity/stocks/ptwo
PTWOU,"Pono Capital Two, Inc. Unit",$10.54,UNCH,--,NA,/market-activity/stocks/ptwou
PTWOW,"Pono Capital Two, Inc. Warrants",$0.03,-0.008,-21.053%,NA,/market-activity/stocks/ptwow
PTY,Pimco Corporate & Income Opportunity Fund,$13.245,0.045,0.341%,"1,608,843,660",/market-activity/stocks/pty
PUBM,"PubMatic, Inc. Class A Common Stock",$15.75,0.08,0.511%,"753,267,438",/market-activity/stocks/pubm
PUCK,Goal Acquisitions Corp. Common Stock,$9.97,0.01,0.10%,"330,617,663",/market-activity/stocks/puck
PUCKU,Goal Acquisitions Corp. Unit,$10.01,UNCH,--,NA,/market-activity/stocks/pucku
PUCKW,Goal Acquisitions Corp. Warrant,$0.06,-0.0006,-0.99%,NA,/market-activity/stocks/puckw
PUK,Prudential Public Limited Company Common Stock,$25.22,1.34,5.611%,"34,668,860,334",/market-activity/stocks/puk
PULM,"Pulmatrix, Inc. Common Stock",$3.69,-0.05,-1.337%,"13,428,593",/market-activity/stocks/pulm
PUMP,ProPetro Holding Corp. Common Stock,$11.01,0.03,0.273%,"1,261,240,476",/market-activity/stocks/pump
PUYI,Puyi Inc. American Depository Shares,$7.06,UNCH,--,"425,821,613",/market-activity/stocks/puyi
PV,Primavera Capital Acquisition Corporation Class A Ordinary Shares,$10.025,UNCH,--,"538,843,750",/market-activity/stocks/pv
PVBC,"Provident Bancorp, Inc. (MD) Common Stock",$6.895,-0.045,-0.648%,"122,169,209",/market-activity/stocks/pvbc
PVH,PVH Corp. Common Stock,$75.84,8.66,12.891%,"5,411,921,923",/market-activity/stocks/pvh
PVL,"Permianville Royalty Trust Trust Units ",$3.5066,0.0266,0.764%,"115,717,800",/market-activity/stocks/pvl
PW,Power REIT (MD) Common Stock,$5.89,0.49,9.074%,"19,965,103",/market-activity/stocks/pw
PW^A,Power REIT 7.75% Series A Cumulative Perpetual Preferred Stock,$18.2625,UNCH,--,NA,/market-activity/stocks/pw^a
PWFL,"PowerFleet, Inc. Common Stock",$2.8066,-0.0134,-0.475%,"101,517,352",/market-activity/stocks/pwfl
PWOD,"Penns Woods Bancorp, Inc. Common Stock",$25.86,UNCH,--,"182,473,306",/market-activity/stocks/pwod
PWP,Perella Weinberg Partners Class A Common Stock,$9.94,0.37,3.866%,"979,095,775",/market-activity/stocks/pwp
PWR,"Quanta Services, Inc. Common Stock",$152.62,2.74,1.828%,"21,809,574,429",/market-activity/stocks/pwr
PWSC,"PowerSchool Holdings, Inc. Class A Common Stock",$20.78,0.37,1.813%,"4,143,984,983",/market-activity/stocks/pwsc
PWUP,PowerUp Acquisition Corp. Class A Ordinary Shares,$10.25,UNCH,--,"368,359,375",/market-activity/stocks/pwup
PWUPW,PowerUp Acquisition Corp. Warrant,$0.0401,UNCH,--,NA,/market-activity/stocks/pwupw
PX,"P10, Inc. Class A Common Stock",$10.38,0.15,1.466%,"1,215,016,970",/market-activity/stocks/px
PXD,Pioneer Natural Resources Company Common Stock,$240.35,4.36,1.848%,"57,106,855,477",/market-activity/stocks/pxd
PXLW,"Pixelworks, Inc.  Common Stock",$1.46,0.01,0.69%,"80,089,817",/market-activity/stocks/pxlw
PXMD,"PaxMedica, Inc. Common Stock",$2.2701,-0.1299,-5.413%,"27,192,277",/market-activity/stocks/pxmd
PXS,Pyxis Tankers Inc. Common Stock,$4.99,0.03,0.605%,"107,583,826",/market-activity/stocks/pxs
PXSAP,Pyxis Tankers Inc. 7.75% Series A Cumulative Convertible Preferred Shares,$24.08,UNCH,--,NA,/market-activity/stocks/pxsap
PXSAW,Pyxis Tankers Inc. Warrant,$1.08,0.08,8.00%,NA,/market-activity/stocks/pxsaw
PYCR,"Paycor HCM, Inc. Common Stock",$29.25,0.33,1.141%,"5,143,787,825",/market-activity/stocks/pycr
PYN,PIMCO New York Municipal Income Fund III Common Shares of Beneficial Interest,$7.87,-0.02,-0.253%,"45,202,242",/market-activity/stocks/pyn
PYPD,PolyPid Ltd. Ordinary Shares,$0.8001,0.0102,1.291%,"15,726,452",/market-activity/stocks/pypd
PYPL,"PayPal Holdings, Inc. Common Stock",$78.81,0.40,0.51%,"89,845,585,559",/market-activity/stocks/pypl
PYR,PyroGenesis Canada Inc. Common Shares,$0.7335,-0.013,-1.741%,"127,291,880",/market-activity/stocks/pyr
PYXS,"Pyxis Oncology, Inc. Common Stock",$1.4873,0.0373,2.572%,"52,200,149",/market-activity/stocks/pyxs
PZC,PIMCO California Municipal Income Fund III Common Shares of Beneficial Interest,$8.70,0.04,0.462%,"195,333,496",/market-activity/stocks/pzc
PZG,Paramount Gold Nevada Corp. Common Stock,$0.37,0.0044,1.204%,"17,364,980",/market-activity/stocks/pzg
PZZA,"Papa John's International, Inc. Common Stock",$84.048,0.788,0.946%,"2,969,260,603",/market-activity/stocks/pzza
QBTS,D-Wave Quantum Inc. Common Shares,$2.325,-0.015,-0.641%,"259,251,438",/market-activity/stocks/qbts
QCOM,QUALCOMM Incorporated Common Stock,$126.46,-0.03,-0.024%,"141,761,660,000",/market-activity/stocks/qcom
QCRH,"QCR Holdings, Inc. Common Stock",$52.66,0.05,0.095%,"889,133,505",/market-activity/stocks/qcrh
QD,"Qudian Inc. American Depositary Shares, each representing one Class A Ordinary Share",$0.76,0.0379,5.249%,"191,880,850",/market-activity/stocks/qd
QDEL,QuidelOrtho Corporation Common Stock,$91.16,3.55,4.052%,"6,020,694,835",/market-activity/stocks/qdel
QFIN,"360 DigiTech, Inc. American Depositary Shares",$15.60,-0.09,-0.574%,"2,437,677,076",/market-activity/stocks/qfin
QFTA,Quantum FinTech Acquisition Corporation Common Stock,$9.925,UNCH,--,"249,675,781",/market-activity/stocks/qfta
QGEN,"Qiagen N.V. Common Shares ",$50.19,0.65,1.312%,"11,428,263,000",/market-activity/stocks/qgen
QH,Quhuo Limited American Depository Shares,$1.42,0.01,0.709%,"8,758,022",/market-activity/stocks/qh
QIPT,Quipt Home Medical Corp. Common Shares,$4.505,0.035,0.783%,"158,753,997",/market-activity/stocks/qipt
QLGN,"Qualigen Therapeutics, Inc. Common Stock",$1.5301,0.0326,2.177%,"6,443,279",/market-activity/stocks/qlgn
QLI,Qilian International Holding Group Ltd. Ordinary Shares,$1.21,-0.03,-2.419%,"43,257,500",/market-activity/stocks/qli
QLYS,"Qualys, Inc. Common Stock",$125.65,2.33,1.889%,"4,773,195,844",/market-activity/stocks/qlys
QMCO,Quantum Corporation Common Stock,$1.26,-0.01,-0.787%,"130,838,403",/market-activity/stocks/qmco
QNCX,"Quince Therapeutics, Inc. Common Stock",$0.73,-0.007,-0.95%,"26,375,123",/market-activity/stocks/qncx
QNRX,"Quoin Pharmaceuticals, Ltd. American Depositary Shares",$1.7539,0.0839,5.024%,"8,500,459",/market-activity/stocks/qnrx
QNST,"QuinStreet, Inc. Common Stock",$14.33,0.10,0.703%,"768,666,187",/market-activity/stocks/qnst
QOMO,Qomolangma Acquisition Corp. Common Stock,$10.05,UNCH,--,"66,205,611",/market-activity/stocks/qomo
QQQX,Nuveen NASDAQ 100 Dynamic Overwrite Fund Shares of Beneficial Interest,$22.35,-0.15,-0.667%,"1,050,882,271",/market-activity/stocks/qqqx
QRHC,Quest Resource Holding Corporation Common Stock,$6.93,0.13,1.912%,"136,905,691",/market-activity/stocks/qrhc
QRTEA,"Qurate Retail, Inc. Series A Common Stock ",$2.36,0.01,0.426%,"902,019,470",/market-activity/stocks/qrtea
QRTEB,"Qurate Retail, Inc. Series B Common Stock ",$8.115,-0.115,-1.397%,"3,101,647,459",/market-activity/stocks/qrteb
QRTEP,"Qurate Retail, Inc. 8.0% Fixed Rate Cumulative Redeemable Preferred Stock",$42.69,-0.28,-0.652%,NA,/market-activity/stocks/qrtep
QRVO,"Qorvo, Inc. Common Stock",$97.90,-1.35,-1.36%,"9,926,029,407",/market-activity/stocks/qrvo
QS,QuantumScape Corporation Class A Common Stock,$7.545,0.055,0.734%,"3,289,298,191",/market-activity/stocks/qs
QSI,Quantum-Si Incorporated Class A Common Stock,$2.36,-0.02,-0.84%,"329,972,828",/market-activity/stocks/qsi
QSIAW,Quantum-Si Incorporated Warrant,$0.35,-0.005,-1.408%,NA,/market-activity/stocks/qsiaw
QSR,Restaurant Brands International Inc. Common Shares,$66.025,-0.325,-0.49%,"20,197,352,536",/market-activity/stocks/qsr
QTEK,QualTek Services Inc. Class A Common Stock,$0.8795,0.084,10.559%,"24,455,077",/market-activity/stocks/qtek
QTEKW,QualTek Services Inc. Warrant,$0.1223,-0.0017,-1.371%,NA,/market-activity/stocks/qtekw
QTNT,Quotient Limited Ordinary Shares,$0.7901,0.0301,3.961%,"2,790,404",/market-activity/stocks/qtnt
QTRX,Quanterix Corporation Common Stock,$13.415,0.115,0.865%,"497,088,868",/market-activity/stocks/qtrx
QTT,Qutoutiao Inc. American Depositary Shares,$0.50,0.0302,6.428%,"14,483,172",/market-activity/stocks/qtt
QTWO,"Q2 Holdings, Inc. Common Stock",$27.90,0.70,2.574%,"1,604,723,965",/market-activity/stocks/qtwo
QUAD,"Quad Graphics, Inc Class A Common Stock",$3.75,0.05,1.351%,"203,192,445",/market-activity/stocks/quad
QUBT,Quantum Computing Inc. Common Stock,$2.27,0.06,2.715%,"120,995,097",/market-activity/stocks/qubt
QUIK,QuickLogic Corporation Common Stock,$6.19,UNCH,--,"81,166,623",/market-activity/stocks/quik
QUMU,Qumu Corporation Common Stock,$0.52,UNCH,--,"9,326,371",/market-activity/stocks/qumu
QUOT,Quotient Technology Inc. Common Stock,$2.995,0.045,1.525%,"289,615,164",/market-activity/stocks/quot
QURE,uniQure N.V. Ordinary Shares,$26.59,0.13,0.491%,"1,244,813,748",/market-activity/stocks/qure
QVCC,"QVC, Inc. 6.250% Senior Secured Notes due 2068",$17.07,0.16,0.946%,NA,/market-activity/stocks/qvcc
QVCD,"QVC, Inc. 6.375% Senior Secured Notes due 2067",$16.77,0.26,1.575%,NA,/market-activity/stocks/qvcd
R,"Ryder System, Inc. Common Stock",$92.49,-1.00,-1.07%,"4,647,723,499",/market-activity/stocks/r
RA,Brookfield Real Assets Income Fund Inc. Common Stock,$18.0481,0.1581,0.884%,"972,126,326",/market-activity/stocks/ra
RAAS,"Cloopen Group Holding Limited American Depositary Shares, each representing two Class A Ordinary Shares",$0.7302,-0.0198,-2.64%,"120,023,101",/market-activity/stocks/raas
RACB,Research Alliance Corp. II Class A Common Stock,$10.06,-0.01,-0.099%,"193,016,190",/market-activity/stocks/racb
RACE,Ferrari N.V. Common Shares,$226.38,3.33,1.493%,"41,295,518,127",/market-activity/stocks/race
RACY,Relativity Acquisition Corp. Class A Common Stock,$10.23,UNCH,--,"190,508,175",/market-activity/stocks/racy
RACYW,Relativity Acquisition Corp. Warrant,$0.035,-0.0125,-26.316%,NA,/market-activity/stocks/racyw
RAD,Rite Aid Corporation Common Stock,$5.07,UNCH,--,"286,634,726",/market-activity/stocks/rad
RADI,"Radius Global Infrastructure, Inc. Class A Common Stock",$12.80,0.14,1.106%,"1,219,629,606",/market-activity/stocks/radi
RAIL,"FreightCar America, Inc. Common Stock",$3.92,0.05,1.292%,"67,515,360",/market-activity/stocks/rail
RAIN,Rain Therapeutics Inc. Common Stock,$7.65,-0.07,-0.907%,"268,829,843",/market-activity/stocks/rain
RAM,Aries I Acquisition Corporation Class A Ordinary Share,$10.21,0.01,0.098%,"60,134,940",/market-activity/stocks/ram
RAMMU,Aries I Acquisition Corporation Unit,$10.23,UNCH,--,NA,/market-activity/stocks/rammu
RAMMW,Aries I Acquisition Corporation Warrant,$0.0858,0.0223,35.118%,NA,/market-activity/stocks/rammw
RAMP,"LiveRamp Holdings, Inc. Common Stock",$22.4601,0.5001,2.277%,"1,493,065,626",/market-activity/stocks/ramp
RAND,Rand Capital Corporation Common Stock,$14.60,0.33,2.313%,"37,682,907",/market-activity/stocks/rand
RANI,"Rani Therapeutics Holdings, Inc. Class A Common Stock",$8.18,-0.10,-1.208%,"413,443,695",/market-activity/stocks/rani
RAPT,"RAPT Therapeutics, Inc. Common Stock",$17.9147,0.2347,1.327%,"608,471,119",/market-activity/stocks/rapt
RARE,Ultragenyx Pharmaceutical Inc. Common Stock,$36.97,0.67,1.846%,"2,591,806,028",/market-activity/stocks/rare
RAVE,"Rave Restaurant Group, Inc. Common Stock",$1.75,-0.04,-2.235%,"28,700,943",/market-activity/stocks/rave
RBA,Ritchie Bros. Auctioneers Incorporated Common Stock,$54.90,0.05,0.091%,"6,086,882,627",/market-activity/stocks/rba
RBB,RBB Bancorp Common Stock,$22.31,-0.16,-0.712%,"424,343,585",/market-activity/stocks/rbb
RBBN,Ribbon Communications Inc. Common Stock,$2.585,0.055,2.174%,"434,598,144",/market-activity/stocks/rbbn
RBC,RBC Bearings Incorporated Common Stock,$239.73,2.76,1.165%,"6,956,328,357",/market-activity/stocks/rbc
RBCAA,"Republic Bancorp, Inc. Class A Common Stock",$43.69,-0.38,-0.862%,"862,739,221",/market-activity/stocks/rbcaa
RBCN,"Rubicon Technology, Inc. Common Stock",$1.88,-0.02,-1.053%,"4,630,231",/market-activity/stocks/rbcn
RBCP,RBC Bearings Incorporated 5.00% Series A Mandatory Convertible Preferred Stock,$115.79,UNCH,--,NA,/market-activity/stocks/rbcp
RBKB,"Rhinebeck Bancorp, Inc. Common Stock",$9.45,UNCH,--,"106,639,139",/market-activity/stocks/rbkb
RBLX,Roblox Corporation Class A Common Stock,$32.33,0.56,1.763%,"19,424,384,222",/market-activity/stocks/rblx
RBOT,Vicarious Surgical Inc. Class A Common Stock,$3.47,-0.03,-0.857%,"424,623,286",/market-activity/stocks/rbot
RBT,"Rubicon Technologies, Inc. Class A Common Stock",$2.01,-0.08,-3.828%,"99,925,620",/market-activity/stocks/rbt
RC,Ready Capital Corproation Common Stock,$13.72,0.32,2.388%,"1,516,236,576",/market-activity/stocks/rc
RC^C,Ready Capital Corporation 6.25% Series C Cumulative Convertible Preferred Stock,$18.20,0.25,1.393%,NA,/market-activity/stocks/rc^c
RC^E,Ready Capital Corporation 6.50% Series E Cumulative Redeemable Preferred Stock,$19.55,0.08,0.411%,NA,/market-activity/stocks/rc^e
RCA,Ready Capital Corporation 7.00% Convertible Senior Notes due 2023,$24.93,-0.0018,-0.007%,NA,/market-activity/stocks/rca
RCAC,Revelstone Capital Acquisition Corp. Class A Common Stock,$9.98,0.02,0.201%,"205,837,500",/market-activity/stocks/rcac
RCACW,Revelstone Capital Acquisition Corp. Warrant,$0.05,-0.0001,-0.20%,NA,/market-activity/stocks/rcacw
RCAT,"Red Cat Holdings, Inc. Common Stock",$1.16,-0.02,-1.695%,"62,786,443",/market-activity/stocks/rcat
RCB,Ready Capital Corporation 6.20% Senior Notes due 2026,$23.3107,-0.6293,-2.629%,NA,/market-activity/stocks/rcb
RCC,Ready Capital Corporation 5.75% Senior Notes due 2026,$23.43,0.02,0.085%,NA,/market-activity/stocks/rcc
RCEL,"Avita Medical, Inc. Common Stock",$7.08,0.43,6.466%,"177,218,786",/market-activity/stocks/rcel
RCFA,RCF Acquisition Corp. Class A Ordinary Shares,$10.19,-0.01,-0.098%,"292,962,500",/market-activity/stocks/rcfa
RCG,"RENN Fund, Inc Common Stock",$2.01,-0.0008,-0.04%,"14,101,728",/market-activity/stocks/rcg
RCI,"Rogers Communication, Inc. Common Stock",$46.52,0.39,0.845%,"23,489,125,793",/market-activity/stocks/rci
RCII,Rent-A-Center Inc. Common Stock,$24.05,-0.04,-0.166%,"1,338,864,654",/market-activity/stocks/rcii
RCKT,"Rocket Pharmaceuticals, Inc. Common Stock",$18.655,-0.225,-1.192%,"1,411,892,911",/market-activity/stocks/rckt
RCKY,"Rocky Brands, Inc. Common Stock",$28.64,0.36,1.273%,"209,828,411",/market-activity/stocks/rcky
RCL,D/B/A Royal Caribbean Cruises Ltd. Common Stock,$61.01,1.08,1.802%,"15,568,654,735",/market-activity/stocks/rcl
RCLF,Rosecliff Acquisition Corp I Class A Common Stock,$10.01,-0.01,-0.10%,"316,566,250",/market-activity/stocks/rclf
RCLFU,Rosecliff Acquisition Corp I Unit,$10.0001,UNCH,--,NA,/market-activity/stocks/rclfu
RCLFW,Rosecliff Acquisition Corp I Warrants,$0.05,UNCH,--,NA,/market-activity/stocks/rclfw
RCM,R1 RCM Inc. Common Stock,$9.17,0.12,1.326%,"3,819,404,568",/market-activity/stocks/rcm
RCMT,"RCM Technologies, Inc. Common Stock",$15.38,0.10,0.654%,"151,366,330",/market-activity/stocks/rcmt
RCON,"Recon Technology, Ltd. Class A Ordinary Shares",$0.90,-0.0143,-1.564%,"6,482,549",/market-activity/stocks/rcon
RCRT,"Recruiter.com Group, Inc. Common Stock",$0.5201,-0.0286,-5.212%,"8,466,065",/market-activity/stocks/rcrt
RCRTW,"Recruiter.com Group, Inc. Warrant",$0.094,0.033,54.098%,NA,/market-activity/stocks/rcrtw
RCS,"PIMCO Strategic Income Fund, Inc.",$5.35,0.15,2.885%,"240,097,300",/market-activity/stocks/rcs
RCUS,"Arcus Biosciences, Inc. Common Stock",$35.12,-0.05,-0.142%,"2,542,958,635",/market-activity/stocks/rcus
RDCM,Radcom Ltd. Ordinary Shares,$10.12,-0.38,-3.619%,"146,596,195",/market-activity/stocks/rdcm
RDFN,Redfin Corporation Common Stock,$5.3299,-0.0301,-0.562%,"579,619,792",/market-activity/stocks/rdfn
RDHL,Redhill Biopharma Ltd. American Depositary Shares,$0.36,UNCH,--,"22,976,445",/market-activity/stocks/rdhl
RDI,Reading International Inc Class A Common Stock,$3.22,UNCH,--,"70,981,113",/market-activity/stocks/rdi
RDIB,Reading International Inc Class B Common Stock,$20.10,-0.90,-4.286%,"443,080,862",/market-activity/stocks/rdib
RDN,Radian Group Inc. Common Stock,$19.41,-0.16,-0.818%,"3,047,863,616",/market-activity/stocks/rdn
RDNT,"RadNet, Inc. Common Stock",$20.065,0.295,1.492%,"1,150,945,455",/market-activity/stocks/rdnt
RDVT,"Red Violet, Inc. Common Stock ",$23.40,0.60,2.632%,"325,114,990",/market-activity/stocks/rdvt
RDW,Redwire Corporation Common Stock,$2.07,-0.05,-2.358%,"132,175,068",/market-activity/stocks/rdw
RDWR,Radware Ltd. Ordinary Shares,$20.87,0.24,1.163%,"935,826,849",/market-activity/stocks/rdwr
RDY,Dr. Reddy's Laboratories Ltd Common Stock,$56.345,0.035,0.062%,"9,355,064,137",/market-activity/stocks/rdy
RE,"Everest Re Group, Ltd. Common Stock",$332.42,-5.52,-1.633%,"13,019,240,602",/market-activity/stocks/re
REAL,"The RealReal, Inc. Common Stock",$1.6027,0.1127,7.564%,"157,170,026",/market-activity/stocks/real
REAX,"The Real Brokerage, Inc. Common Shares",$1.281,0.031,2.48%,"228,658,500",/market-activity/stocks/reax
REBN,"Reborn Coffee, Inc. Common Stock",$0.9497,0.0277,3.004%,"12,459,611",/market-activity/stocks/rebn
REE,REE Automotive Ltd. Class A Ordinary Shares,$0.56,0.0039,0.701%,"136,500,326",/market-activity/stocks/ree
REED,"Reeds, Inc. Common Stock",$0.106,-0.022,-17.188%,"12,533,944",/market-activity/stocks/reed
REFI,"Chicago Atlantic Real Estate Finance, Inc. Common Stock",$16.12,-0.08,-0.494%,"284,645,558",/market-activity/stocks/refi
REFR,Research Frontiers Incorporated Common Stock,$2.418,0.068,2.894%,"80,157,658",/market-activity/stocks/refr
REG,Regency Centers Corporation Common Stock,$66.31,-0.12,-0.181%,"11,347,147,563",/market-activity/stocks/reg
REGN,"Regeneron Pharmaceuticals, Inc. Common Stock",$755.41,3.71,0.494%,"82,265,610,718",/market-activity/stocks/regn
REI,"Ring Energy, Inc. Common Stock",$2.735,0.035,1.296%,"477,014,996",/market-activity/stocks/rei
