symbol,name,lastsale,netchange,pctchange,marketCap,url
DBX,"Dropbox, Inc. Class A Common Stock",$23.805,0.245,1.04%,"8,634,939,478",/market-activity/stocks/dbx
DC,Dakota Gold Corp. Common Stock,$3.60,0.22,6.509%,"263,441,704",/market-activity/stocks/dc
DCBO,Docebo Inc. Common Shares,$32.44,0.54,1.693%,"1,067,485,692",/market-activity/stocks/dcbo
DCF,"BNY Mellon Alcentra Global Credit Income 2024 Target Term Fund, Inc. Common Stock",$7.43,-0.02,-0.268%,"111,455,402",/market-activity/stocks/dcf
DCFC,Tritium DCFC Limited Ordinary Shares,$1.53,-0.07,-4.375%,"234,480,742",/market-activity/stocks/dcfc
DCFCW,Tritium DCFC Limited Warrant,$0.4345,0.0145,3.452%,NA,/market-activity/stocks/dcfcw
DCGO,DocGo Inc. Common Stock,$7.45,0.10,1.361%,"766,058,699",/market-activity/stocks/dcgo
DCI,"Donaldson Company, Inc. Common Stock",$60.73,-0.19,-0.312%,"7,437,061,692",/market-activity/stocks/dci
DCO,Ducommun Incorporated Common Stock,$50.21,-0.10,-0.199%,"607,659,897",/market-activity/stocks/dco
DCOM,"Dime Community Bancshares, Inc. Common Stock",$35.65,-0.02,-0.056%,"1,375,151,229",/market-activity/stocks/dcom
DCOMP,"Dime Community Bancshares, Inc. Fixed-Rate Non-Cumulative Perpetual Preferred Stock, Series A",$20.76,-0.08,-0.384%,NA,/market-activity/stocks/dcomp
DCP,"DCP Midstream,  LP Common Units ",$39.43,0.09,0.229%,"8,217,076,282",/market-activity/stocks/dcp
DCP^B,DCP Midstream LP 7.875% Series B Fixed-to-Floating Rate Cumulative Redeemable Perpetual Preferred Units,$24.95,UNCH,--,NA,/market-activity/stocks/dcp^b
DCP^C,DCP Midstream LP 7.95% Series C Fixed-to-Floating Rate Cumulative Redeemable Perpetual Preferred Units,$25.30,-0.15,-0.589%,NA,/market-activity/stocks/dcp^c
DCPH,"Deciphera Pharmaceuticals, Inc. Common Stock",$16.16,0.25,1.571%,"1,092,028,984",/market-activity/stocks/dcph
DCRD,Decarbonization Plus Acquisition Corporation IV Class A Ordinary Share,$10.15,0.01,0.099%,"401,242,188",/market-activity/stocks/dcrd
DCRDW,Decarbonization Plus Acquisition Corporation IV Warrant,$0.6004,-0.0001,-0.017%,NA,/market-activity/stocks/dcrdw
DCT,"Duck Creek Technologies, Inc. Common Stock",$11.38,0.19,1.698%,"1,510,581,405",/market-activity/stocks/dct
DCTH,"Delcath Systems, Inc. Common Stock",$2.85,UNCH,--,"24,503,394",/market-activity/stocks/dcth
DD,"DuPont de Nemours, Inc. Common Stock",$70.38,-0.13,-0.184%,"34,964,006,160",/market-activity/stocks/dd
DDD,3D Systems Corporation Common Stock,$10.30,0.16,1.578%,"1,350,966,180",/market-activity/stocks/ddd
DDF,"Delaware Investments Dividend & Income Fund, Inc. Common Stock",$8.51,-0.02,-0.234%,"64,770,955",/market-activity/stocks/ddf
DDI,"DoubleDown Interactive Co., Ltd. American Depository Shares",$8.91,UNCH,--,"441,521,150",/market-activity/stocks/ddi
DDL,Dingdong (Cayman) Limited American Depositary Shares (each two representing three Ordinary Shares),$4.39,0.02,0.458%,"919,120,204",/market-activity/stocks/ddl
DDOG,"Datadog, Inc. Class A Common Stock",$76.14,0.36,0.475%,"24,179,006,065",/market-activity/stocks/ddog
DDS,"Dillard's, Inc. Common Stock",$356.00,-3.70,-1.029%,"6,087,600,000",/market-activity/stocks/dds
DDT,Dillard's Capital Trust I,$25.5474,0.1474,0.58%,NA,/market-activity/stocks/ddt
DE,Deere & Company Common Stock,$443.01,2.01,0.456%,"133,709,114,286",/market-activity/stocks/de
DEA,"Easterly Government Properties, Inc. Common Stock",$15.90,0.06,0.379%,"1,443,942,934",/market-activity/stocks/dea
DECA,Denali Capital Acquisition Corp. Class A Ordinary Shares,$10.22,0.03,0.294%,"110,605,950",/market-activity/stocks/deca
DECAU,Denali Capital Acquisition Corp. Unit,$10.22,0.01,0.098%,NA,/market-activity/stocks/decau
DECK,Deckers Outdoor Corporation Common Stock,$391.44,-7.44,-1.865%,"10,360,162,626",/market-activity/stocks/deck
DEI,"Douglas Emmett, Inc. Common Stock",$17.49,0.17,0.982%,"3,074,547,948",/market-activity/stocks/dei
DELL,"Dell Technologies Inc. Class C Common Stock ",$44.74,-0.05,-0.112%,"32,792,629,639",/market-activity/stocks/dell
DEN,Denbury Inc. Common Stock,$89.465,-0.295,-0.329%,"4,455,367,110",/market-activity/stocks/den
DENN,Denny's Corporation Common Stock,$12.705,0.165,1.316%,"727,148,746",/market-activity/stocks/denn
DEO,Diageo plc Common Stock,$191.54,4.99,2.675%,"108,882,172,184",/market-activity/stocks/deo
DERM,Journey Medical Corporation Common Stock,$1.80,UNCH,--,"31,867,785",/market-activity/stocks/derm
DESP,"Despegar.com, Corp. Ordinary Shares",$5.49,0.09,1.667%,"363,644,935",/market-activity/stocks/desp
DEX,Delaware Enhanced Global Dividend Common Shares of Beneficial Interest,$7.7986,0.0686,0.887%,"83,116,738",/market-activity/stocks/dex
DFFN,Diffusion Pharmaceuticals Inc. Common Stock,$6.30,-0.1999,-3.075%,"12,848,485",/market-activity/stocks/dffn
DFH,"Dream Finders Homes, Inc. Class A Common Stock",$9.68,-0.16,-1.626%,"897,916,926",/market-activity/stocks/dfh
DFIN,"Donnelley Financial Solutions, Inc. Common Stock ",$38.745,0.565,1.48%,"1,127,630,528",/market-activity/stocks/dfin
DFLI,Dragonfly Energy Holdings Corp. Common Stock,$8.50,0.08,0.95%,"367,818,188",/market-activity/stocks/dfli
DFLIW,Dragonfly Energy Holdings Corp. Warrant,$0.23,-0.0005,-0.217%,NA,/market-activity/stocks/dfliw
DFP,Flaherty & Crumrine Dynamic Preferred and Income Fund Inc. Common Stock,$19.855,0.195,0.992%,"407,222,794",/market-activity/stocks/dfp
DFS,Discover Financial Services Common Stock,$106.734,-1.626,-1.501%,"29,162,478,802",/market-activity/stocks/dfs
DG,Dollar General Corporation Common Stock,$231.43,-24.25,-9.485%,"52,204,065,242",/market-activity/stocks/dg
DGHI,Digihost Technology Inc. Common Subordinate Voting Shares,$0.605,0.0148,2.508%,"16,832,802",/market-activity/stocks/dghi
DGICA,"Donegal Group, Inc. Class A Common Stock",$14.77,-0.10,-0.672%,"479,553,483",/market-activity/stocks/dgica
DGICB,"Donegal Group, Inc. Class B Common Stock",$14.81,UNCH,--,"480,852,206",/market-activity/stocks/dgicb
DGII,Digi International Inc. Common Stock,$41.74,-0.73,-1.719%,"1,484,121,339",/market-activity/stocks/dgii
DGLY,"Digital Ally, Inc. Common Stock",$0.3188,0.0012,0.378%,"17,184,406",/market-activity/stocks/dgly
DGNU,Dragoneer Growth Opportunities Corp. III Class A Ordinary Shares,$9.85,UNCH,--,"530,269,904",/market-activity/stocks/dgnu
DGX,Quest Diagnostics Incorporated Common Stock,$153.17,1.34,0.883%,"17,444,143,167",/market-activity/stocks/dgx
DH,Definitive Healthcare Corp. Class A Common Stock,$11.60,0.23,2.023%,"1,218,928,719",/market-activity/stocks/dh
DHAC,Digital Health Acquisition Corp. Common Stock,$10.52,-0.01,-0.095%,"43,406,814",/market-activity/stocks/dhac
DHACU,Digital Health Acquisition Corp. Unit,$10.59,0.18,1.729%,NA,/market-activity/stocks/dhacu
DHACW,Digital Health Acquisition Corp. Warrant,$0.085,-0.0067,-7.306%,NA,/market-activity/stocks/dhacw
DHBC,DHB Capital Corp. Class A common stock,$10.07,UNCH,--,"361,890,625",/market-activity/stocks/dhbc
DHC,Diversified Healthcare Trust Common Shares of Beneficial Interest,$1.01,0.02,2.02%,"242,100,697",/market-activity/stocks/dhc
DHCA,DHC Acquisition Corp. Class A ordinary share,$10.02,UNCH,--,"387,587,027",/market-activity/stocks/dhca
DHCAW,DHC Acquisition Corp. Warrant,$0.0101,UNCH,--,NA,/market-activity/stocks/dhcaw
DHCNI,Diversified Healthcare Trust 5.625% Senior Notes due 2042,$12.03,UNCH,--,NA,/market-activity/stocks/dhcni
DHCNL,Diversified Healthcare Trust 6.25% Senior Notes Due 2046,$12.76,0.18,1.431%,NA,/market-activity/stocks/dhcnl
DHF,BNY Mellon High Yield Strategies Fund Common Stock,$2.395,0.035,1.483%,"174,203,999",/market-activity/stocks/dhf
DHHC,DiamondHead Holdings Corp. Class A Common Stock,$10.03,0.015,0.15%,"432,543,750",/market-activity/stocks/dhhc
DHHCU,DiamondHead Holdings Corp. Unit,$10.02,0.02,0.20%,NA,/market-activity/stocks/dhhcu
DHI,"D.R. Horton, Inc. Common Stock",$88.30,2.30,2.674%,"30,405,330,344",/market-activity/stocks/dhi
DHIL,"Diamond Hill Investment Group, Inc. Class A Common Stock",$175.81,-2.15,-1.208%,"530,217,468",/market-activity/stocks/dhil
DHR,Danaher Corporation Common Stock,$273.02,-0.39,-0.143%,"198,748,376,900",/market-activity/stocks/dhr
DHR^B,"Danaher Corporation 5.00% Mandatory Convertible Preferred Stock, Series B","$1,401.35",UNCH,--,NA,/market-activity/stocks/dhr^b
DHT,"DHT Holdings, Inc.",$9.995,-0.135,-1.333%,"1,625,720,123",/market-activity/stocks/dht
DHX,"DHI Group, Inc. Common Stock",$5.74,0.12,2.135%,"274,260,690",/market-activity/stocks/dhx
DHY,Credit Suisse High Yield Bond Fund Common Stock,$1.995,0.015,0.758%,"206,509,901",/market-activity/stocks/dhy
DIAX,Nuveen Dow 30SM Dynamic Overwrite Fund Common Shares of Beneficial Interest,$16.14,0.06,0.373%,"586,961,976",/market-activity/stocks/diax
DIBS,"1stdibs.com, Inc. Common Stock",$6.15,0.13,2.159%,"239,424,229",/market-activity/stocks/dibs
DICE,"DICE Therapeutics, Inc. Common Stock",$34.76,-0.05,-0.144%,"1,656,761,709",/market-activity/stocks/dice
DILA,DILA Capital Acquisition Corp. Class A Common Stock,$10.00,UNCH,--,"75,794,750",/market-activity/stocks/dila
DILAW,DILA Capital Acquisition Corp. Warrant,$0.0298,0.0038,14.615%,NA,/market-activity/stocks/dilaw
DIN,"Dine Brands Global, Inc. Common Stock",$74.37,-0.22,-0.295%,"1,166,008,632",/market-activity/stocks/din
DINO,HF Sinclair Corporation Common Stock,$61.775,-0.565,-0.906%,"12,400,128,861",/market-activity/stocks/dino
DIOD,Diodes Incorporated Common Stock,$91.61,-0.62,-0.672%,"4,165,480,408",/market-activity/stocks/diod
DIS,Walt Disney Company (The) Common Stock,$97.40,-0.47,-0.48%,"173,469,400,000",/market-activity/stocks/dis
DISA,Disruptive Acquisition Corporation I Class A Ordinary Shares,$10.02,UNCH,--,"344,437,500",/market-activity/stocks/disa
DISAU,Disruptive Acquisition Corporation I Unit,$10.02,0.01,0.10%,NA,/market-activity/stocks/disau
DISH,DISH Network Corporation Class A Common Stock,$15.71,-0.34,-2.118%,"8,337,394,355",/market-activity/stocks/dish
DIT,AMCON Distributing Company Common Stock,$163.25,3.25,2.031%,"99,754,239",/market-activity/stocks/dit
DJCO,Daily Journal Corp. (S.C.) Common Stock,$275.00,UNCH,--,"378,682,150",/market-activity/stocks/djco
DK,"Delek US Holdings, Inc. Common Stock",$31.24,0.26,0.839%,"2,177,187,952",/market-activity/stocks/dk
DKDCA,Data Knights Acquisition Corp. Class A Common Stock,$10.49,0.05,0.479%,"156,932,236",/market-activity/stocks/dkdca
DKDCW,Data Knights Acquisition Corp. Warrant,$0.045,-0.02,-30.769%,NA,/market-activity/stocks/dkdcw
DKL,"Delek Logistics Partners, L.P. Common Units representing Limited Partner Interests",$50.9299,-0.2701,-0.528%,"2,215,052,327",/market-activity/stocks/dkl
DKNG,DraftKings Inc. Class A Common Stock,$15.025,-0.295,-1.926%,"6,743,944,731",/market-activity/stocks/dkng
DKS,Dick's Sporting Goods Inc Common Stock,$115.87,-3.71,-3.103%,"9,664,890,042",/market-activity/stocks/dks
DLA,"Delta Apparel, Inc. Common Stock",$13.115,-0.085,-0.644%,"90,698,920",/market-activity/stocks/dla
DLB,Dolby Laboratories Common Stock,$75.625,0.755,1.008%,"7,256,790,626",/market-activity/stocks/dlb
DLCA,Deep Lake Capital Acquisition Corp. Class A Ordinary Shares,$10.06,UNCH,--,"260,302,500",/market-activity/stocks/dlca
DLCAU,Deep Lake Capital Acquisition Corp. Unit,$10.06,0.01,0.10%,NA,/market-activity/stocks/dlcau
DLCAW,Deep Lake Capital Acquisition Corp. Warrant,$0.0094,0.0002,2.174%,NA,/market-activity/stocks/dlcaw
DLHC,DLH Holdings Corp.,$13.74,-0.26,-1.857%,"178,087,836",/market-activity/stocks/dlhc
DLNG,Dynagas LNG Partners LP Common Units,$2.96,0.04,1.37%,"108,934,651",/market-activity/stocks/dlng
DLNG^A,Dynagas LNG Partners LP 9.00% Series A Cumulative Redeemable Preferred Units,$24.10,0.0288,0.12%,NA,/market-activity/stocks/dlng^a
DLNG^B,"Dynagas LNG Partners LP 8.75% Series B Fixed to Floating Rate Cumulative Redeemable Perpetual Preferred Units, liquidation preference $25.00 per Uni",$23.91,UNCH,--,NA,/market-activity/stocks/dlng^b
DLO,DLocal Limited Class A Common Shares,$13.87,-0.73,-5.00%,"4,105,313,212",/market-activity/stocks/dlo
DLPN,"Dolphin Entertainment, Inc. Common Stock",$2.51,UNCH,--,"25,637,271",/market-activity/stocks/dlpn
DLR,"Digital Realty Trust, Inc. Common Stock",$114.53,2.07,1.841%,"32,929,926,156",/market-activity/stocks/dlr
DLR^J,"Digital Realty Trust, Inc. 5.250% Series J Cumulative Redeemable Preferred Stock",$21.70,UNCH,--,NA,/market-activity/stocks/dlr^j
DLR^K,"Digital Realty Trust, Inc. 5.850% Series K Cumulative Redeemable Preferred Stock, par value $0.01 per share",$23.305,0.095,0.409%,NA,/market-activity/stocks/dlr^k
DLR^L,"Digital Realty Trust, Inc. 5.200% Series L Cumulative Redeemable Preferred Stock",$21.43,-0.02,-0.093%,NA,/market-activity/stocks/dlr^l
DLTH,Duluth Holdings Inc. Class B Common Stock,$7.185,-1.575,-17.979%,"239,819,773",/market-activity/stocks/dlth
DLTR,Dollar Tree Inc. Common Stock,$147.05,-3.24,-2.156%,"32,525,177,637",/market-activity/stocks/dltr
DLX,Deluxe Corporation Common Stock,$19.64,0.30,1.551%,"847,193,181",/market-activity/stocks/dlx
DLY,DoubleLine Yield Opportunities Fund Common Shares of Beneficial Interest,$14.19,0.13,0.925%,"680,350,604",/market-activity/stocks/dly
DM,"Desktop Metal, Inc. Class A Common Stock",$2.085,0.035,1.707%,"662,148,264",/market-activity/stocks/dm
DMA,Destra Multi-Alternative Fund Common Stock,$6.859,0.019,0.278%,"61,478,856",/market-activity/stocks/dma
DMAC,DiaMedica Therapeutics Inc. Common Stock,$1.1986,0.0086,0.723%,"31,694,660",/market-activity/stocks/dmac
DMAQ,Deep Medicine Acquisition Corp. Class A Common Stock,$10.21,UNCH,--,"167,782,972",/market-activity/stocks/dmaq
DMB,"BNY Mellon Municipal Bond Infrastructure Fund, Inc. Common Stock",$11.35,0.08,0.71%,"208,867,342",/market-activity/stocks/dmb
DMF,BNY Mellon Municipal Income Inc. Common Stock,$6.67,0.06,0.908%,"138,450,971",/market-activity/stocks/dmf
DMLP,"Dorchester Minerals, L.P. Common Units Representing Limited Partnership Interests",$30.3675,0.1175,0.388%,"1,165,246,314",/market-activity/stocks/dmlp
DMO,Western Asset Mortgage Opportunity Fund Inc. Common Stock,$11.10,0.02,0.181%,"126,882,935",/market-activity/stocks/dmo
DMRC,Digimarc Corporation Common Stock,$22.225,-0.055,-0.247%,"445,299,100",/market-activity/stocks/dmrc
DMS,"Digital Media Solutions, Inc. Class A Ordinary Shares",$1.69,-0.02,-1.17%,"67,475,488",/market-activity/stocks/dms
DMTK,"DermTech, Inc. Common Stock",$2.64,0.09,3.529%,"79,766,821",/market-activity/stocks/dmtk
DMYS,"dMY Technology Group, Inc. VI Class A Common Stock",$9.93,-0.02,-0.201%,"299,761,875",/market-activity/stocks/dmys
DNA,"Ginkgo Bioworks Holdings, Inc. Class A Common Stock",$1.98,-0.01,-0.503%,"3,841,160,133",/market-activity/stocks/dna
DNAB,Social Capital Suvretta Holdings Corp. II Class A Ordinary Shares,$9.98,UNCH,--,"318,262,200",/market-activity/stocks/dnab
DNAD,Social Capital Suvretta Holdings Corp. IV Class A Ordinary Shares,$9.97,UNCH,--,"317,943,300",/market-activity/stocks/dnad
DNAY,"Codex DNA, Inc. Common Stock",$1.44,-0.01,-0.69%,"42,511,330",/market-activity/stocks/dnay
DNB,"Dun & Bradstreet Holdings, Inc. Common Stock",$13.595,0.135,1.003%,"5,923,768,098",/market-activity/stocks/dnb
DNLI,Denali Therapeutics Inc. Common Stock,$30.98,-0.93,-2.914%,"4,207,507,435",/market-activity/stocks/dnli
DNMR,"Danimer Scientific, Inc. Common Stock",$2.57,-0.09,-3.383%,"260,568,890",/market-activity/stocks/dnmr
DNN,Denison Mines Corp Ordinary Shares (Canada),$1.225,0.005,0.41%,"1,007,212,978",/market-activity/stocks/dnn
DNOW,NOW Inc. Common Stock,$12.485,0.005,0.04%,"1,378,840,291",/market-activity/stocks/dnow
DNP,"DNP Select Income Fund, Inc. Common Stock",$11.41,0.07,0.617%,"3,978,210,874",/market-activity/stocks/dnp
DNUT,"Krispy Kreme, Inc. Common Stock",$15.26,-0.16,-1.038%,"2,555,090,497",/market-activity/stocks/dnut
DNZ,D and Z Media Acquisition Corp. Class A Common Stock,$10.03,-0.005,-0.05%,"360,453,125",/market-activity/stocks/dnz
DO,"Diamond Offshore Drilling, Inc. Common Stock",$9.765,0.195,2.038%,"989,986,402",/market-activity/stocks/do
DOC,Physicians Realty Trust Common Shares of Beneficial Interest,$15.26,0.33,2.21%,"3,483,260,724",/market-activity/stocks/doc
DOCN,"DigitalOcean Holdings, Inc. Common Stock",$29.92,0.09,0.302%,"2,881,209,172",/market-activity/stocks/docn
DOCS,"Doximity, Inc. Class A Common Stock",$35.04,1.05,3.089%,"6,744,787,474",/market-activity/stocks/docs
DOCU,"DocuSign, Inc. Common Stock",$47.79,0.72,1.53%,"9,595,240,310",/market-activity/stocks/docu
DOGZ,Dogness (International) Corporation Class A Common Stock,$0.88,-0.0251,-2.773%,"34,561,348",/market-activity/stocks/dogz
DOLE,Dole plc Ordinary Shares,$10.37,0.07,0.68%,"984,102,630",/market-activity/stocks/dole
DOMA,"Doma Holdings, Inc. Common Stock",$0.395,UNCH,--,"129,755,897",/market-activity/stocks/doma
DOMO,"Domo, Inc. Class B Common Stock",$14.575,0.275,1.923%,"499,425,420",/market-activity/stocks/domo
DOOO,BRP Inc. (Recreational Products) Common Subordinate Voting Shares,$76.78,1.95,2.606%,"6,044,881,108",/market-activity/stocks/dooo
DOOR,Masonite International Corporation Ordinary Shares (Canada),$76.46,1.19,1.581%,"1,703,226,095",/market-activity/stocks/door
DORM,"Dorman Products, Inc. Common Stock",$89.70,0.06,0.067%,"2,818,246,178",/market-activity/stocks/dorm
DOUG,Douglas Elliman Inc. Common Stock,$4.13,0.01,0.243%,"335,554,913",/market-activity/stocks/doug
DOV,Dover Corporation Common Stock,$142.71,0.76,0.535%,"20,029,912,205",/market-activity/stocks/dov
DOW,"Dow Inc. Common Stock ",$51.455,0.485,0.952%,"36,211,933,186",/market-activity/stocks/dow
DOX,Amdocs Limited Ordinary Shares,$89.41,0.55,0.619%,"10,904,533,010",/market-activity/stocks/dox
DOYU,DouYu International Holdings Limited ADS,$1.29,-0.02,-1.527%,"409,554,154",/market-activity/stocks/doyu
DPCS,DP Cap Acquisition Corp I Class A Ordinary Shares,$10.20,-0.01,-0.098%,"293,250,000",/market-activity/stocks/dpcs
DPCSU,DP Cap Acquisition Corp I Unit,$10.20,UNCH,--,NA,/market-activity/stocks/dpcsu
DPCSW,DP Cap Acquisition Corp I Warrants,$0.0403,-0.0009,-2.184%,NA,/market-activity/stocks/dpcsw
DPG,Duff & Phelps Utility and Infrastructure Fund Inc.,$13.70,0.10,0.735%,"521,286,891",/market-activity/stocks/dpg
DPRO,Draganfly Inc. Common Shares,$0.9135,0.0024,0.263%,"30,877,699",/market-activity/stocks/dpro
DPSI,"DecisionPoint Systems, Inc. Common Stock",$8.7025,0.2125,2.503%,"64,376,692",/market-activity/stocks/dpsi
DPZ,Domino's Pizza Inc Common Stock,$388.96,0.23,0.059%,"13,768,942,456",/market-activity/stocks/dpz
DQ,"DAQO New Energy Corp. American Depositary Shares, each representing five ordinary shares",$54.51,-2.40,-4.217%,"4,087,145,845",/market-activity/stocks/dq
DRAY,Macondray Capital Acquisition Corp. I Class A Ordinary Shares,$10.12,0.005,0.049%,"363,687,500",/market-activity/stocks/dray
DRAYW,Macondray Capital Acquisition Corp. I Warrant,$0.01,-0.01,-50.00%,NA,/market-activity/stocks/drayw
DRCT,"Direct Digital Holdings, Inc. Class A Common Stock",$2.73,UNCH,--,"38,705,940",/market-activity/stocks/drct
DRD,DRDGOLD Limited American Depositary Shares,$6.83,0.33,5.077%,"585,997,909",/market-activity/stocks/drd
DRH,Diamondrock Hospitality Company Common Stock,$9.50,0.09,0.956%,"1,989,060,885",/market-activity/stocks/drh
DRH^A,Diamondrock Hospitality Company 8.250% Series A Cumulative Redeemable Preferred Stock,$24.70,-0.04,-0.162%,NA,/market-activity/stocks/drh^a
DRI,"Darden Restaurants, Inc. Common Stock",$147.14,0.15,0.102%,"18,008,031,861",/market-activity/stocks/dri
DRIO,DarioHealth Corp. Common Stock,$5.08,0.12,2.419%,"118,347,510",/market-activity/stocks/drio
DRMA,"Dermata Therapeutics, Inc. Common Stock",$0.6516,0.0067,1.039%,"7,885,803",/market-activity/stocks/drma
DRMAW,"Dermata Therapeutics, Inc. Warrant",$0.0492,UNCH,--,NA,/market-activity/stocks/drmaw
DRQ,"Dril-Quip, Inc. Common Stock",$24.08,0.54,2.294%,"816,787,002",/market-activity/stocks/drq
DRRX,DURECT Corporation Common Stock,$0.4076,-0.0123,-2.929%,"92,875,670",/market-activity/stocks/drrx
DRS,"Leonardo DRS, Inc. Common Stock",$9.40,-0.71,-7.023%,"1,363,000,000",/market-activity/stocks/drs
DRTS,Alpha Tau Medical Ltd. Ordinary Shares,$4.0421,0.0521,1.306%,"278,951,586",/market-activity/stocks/drts
DRTSW,Alpha Tau Medical Ltd. Warrant,$0.295,0.017,6.115%,NA,/market-activity/stocks/drtsw
DRTT,DIRTT Environmental Solutions Ltd. Common Shares,$0.2813,-0.0135,-4.579%,"24,955,513",/market-activity/stocks/drtt
DRUG,Bright Minds Biosciences Inc. Common Stock,$1.1211,0.0311,2.853%,"17,051,775",/market-activity/stocks/drug
DRVN,Driven Brands Holdings Inc. Common Stock,$29.79,-0.62,-2.039%,"4,986,966,560",/market-activity/stocks/drvn
DS,Drive Shack Inc.,$0.45,0.019,4.408%,"41,573,259",/market-activity/stocks/ds
DS^B,Drive Shack Inc. Preferred Series B,$11.80,1.2005,11.326%,NA,/market-activity/stocks/ds^b
DS^C,Drive Shack Inc. Preferred Series C,$10.9733,0.5333,5.108%,NA,/market-activity/stocks/ds^c
DS^D,Drive Shack Inc. Pfd Ser D,$10.4868,0.4869,4.869%,NA,/market-activity/stocks/ds^d
DSAQ,Direct Selling Acquisition Corp. Class A Common Stock,$10.18,UNCH,--,"292,675,000",/market-activity/stocks/dsaq
DSEY,"Diversey Holdings, Ltd. Ordinary Shares",$5.16,0.02,0.389%,"1,673,470,369",/market-activity/stocks/dsey
DSGN,"Design Therapeutics, Inc. Common Stock",$13.52,-0.48,-3.429%,"755,904,160",/market-activity/stocks/dsgn
DSGR,"Distribution Solutions Group, Inc. Common Stock",$36.735,1.285,3.625%,"724,125,353",/market-activity/stocks/dsgr
DSGX,Descartes Systems Group Inc. (The) Common Stock,$71.00,1.55,2.232%,"6,020,202,677",/market-activity/stocks/dsgx
DSKE,"Daseke, Inc. Common Stock",$6.055,0.225,3.859%,"271,718,676",/market-activity/stocks/dske
DSL,DoubleLine Income Solutions Fund Common Shares of Beneficial Interests,$12.07,0.17,1.429%,"1,231,101,714",/market-activity/stocks/dsl
DSM,"BNY Mellon Strategic Municipal Bond Fund, Inc. Common Stock",$5.94,0.02,0.338%,"293,606,425",/market-activity/stocks/dsm
DSP,Viant Technology Inc. Class A Common Stock,$3.82,UNCH,--,"55,237,521",/market-activity/stocks/dsp
DSS,"DSS, Inc. Common Stock",$0.2258,-0.0042,-1.826%,"31,390,077",/market-activity/stocks/dss
DSU,"Blackrock Debt Strategies Fund, Inc. Common Stock",$9.84,0.07,0.716%,"458,645,470",/market-activity/stocks/dsu
DSWL,"Deswell Industries, Inc. Common Shares",$3.18,UNCH,--,"50,674,060",/market-activity/stocks/dswl
DSX,Diana Shipping inc. common stock,$3.615,0.045,1.261%,"311,612,418",/market-activity/stocks/dsx
DSX^B,Diana Shipping Inc. Perpetual Preferred Shares Series B (Marshall Islands),$25.00,UNCH,--,NA,/market-activity/stocks/dsx^b
DT,"Dynatrace, Inc. Common Stock",$39.97,1.22,3.148%,"11,505,484,130",/market-activity/stocks/dt
DTB,DTE Energy Company 2020 Series G 4.375% Junior Subordinated Debentures due 2080,$18.56,0.13,0.705%,NA,/market-activity/stocks/dtb
DTC,"Solo Brands, Inc. Class A Common Stock",$4.39,0.04,0.92%,"279,166,540",/market-activity/stocks/dtc
DTE,DTE Energy Company Common Stock,$117.86,1.85,1.595%,"22,834,431,059",/market-activity/stocks/dte
DTEA,DAVIDsTEA Inc. Common Stock,$0.7563,-0.0116,-1.511%,"20,088,647",/market-activity/stocks/dtea
DTF,DTF Tax-Free Income 2028 Term Fund Inc. Common Stock,$11.29,0.08,0.714%,"79,363,811",/market-activity/stocks/dtf
DTG,DTE Energy Company 2021 Series E 4.375% Junior Subordinated Debentures,$19.0706,0.1506,0.796%,NA,/market-activity/stocks/dtg
DTIL,"Precision BioSciences, Inc. Common Stock",$1.37,UNCH,--,"152,013,768",/market-activity/stocks/dtil
DTLA^,Brookfield DTLA Inc. 7.625% Series A Cumulative Redeemable Preferred Stock,$5.79,-0.06,-1.026%,NA,/market-activity/stocks/dtla^
DTM,"DT Midstream, Inc. Common Stock ",$60.74,0.41,0.68%,"5,876,654,707",/market-activity/stocks/dtm
DTOC,Digital Transformation Opportunities Corp. Class A Common Stock,$9.94,UNCH,--,"414,373,750",/market-activity/stocks/dtoc
DTOCU,Digital Transformation Opportunities Corp. Units,$9.96,0.03,0.302%,NA,/market-activity/stocks/dtocu
DTOCW,Digital Transformation Opportunities Corp. Warrant,$0.09,-0.01,-10.00%,NA,/market-activity/stocks/dtocw
DTRT,DTRT Health Acquisition Corp. Class A Common Stock,$10.225,UNCH,--,"293,968,750",/market-activity/stocks/dtrt
DTRTW,DTRT Health Acquisition Corp. Warrant,$0.25,0.01,4.167%,NA,/market-activity/stocks/dtrtw
DTSS,Datasea Inc. Common Stock,$1.38,UNCH,--,"33,567,994",/market-activity/stocks/dtss
DTST,Data Storage Corporation Common Stock,$1.86,0.03,1.639%,"12,689,156",/market-activity/stocks/dtst
DTSTW,Data Storage Corporation Warrant,$0.2299,0.1049,83.92%,NA,/market-activity/stocks/dtstw
DTW,DTE Energy Company 2017 Series E 5.25% Junior Subordinated Debentures due 2077,$22.65,-0.11,-0.483%,NA,/market-activity/stocks/dtw
DUET,DUET Acquisition Corp. Class A Common Stock,$10.04,UNCH,--,"113,025,300",/market-activity/stocks/duet
DUK,Duke Energy Corporation (Holding Company) Common Stock,$101.63,1.70,1.701%,"78,261,479,518",/market-activity/stocks/duk
DUK^A,"Duke Energy Corporation Depositary Shares, each representing a 1/1,000th interest in a share of 5.75% Series A Cumulative Redeemable Perpetual Preferred Stock",$24.53,UNCH,--,NA,/market-activity/stocks/duk^a
DUKB,Duke Energy Corporation 5.625% Junior Subordinated Debentures due 2078,$24.50,0.12,0.492%,NA,/market-activity/stocks/dukb
DUNE,Dune Acquisition Corporation Class A Common Stock,$9.75,UNCH,--,"53,571,902",/market-activity/stocks/dune
DUNEU,Dune Acquisition Corporation Unit,$9.79,0.07,0.72%,NA,/market-activity/stocks/duneu
DUNEW,Dune Acquisition Corporation Warrant,$0.03,UNCH,--,NA,/market-activity/stocks/dunew
DUO,Fangdd Network Group Ltd. American Depositary Shares,$1.1401,-0.0399,-3.381%,"6,299,292",/market-activity/stocks/duo
DUOL,"Duolingo, Inc. Class A Common Stock",$69.39,-0.28,-0.402%,"2,787,378,050",/market-activity/stocks/duol
DUOT,"Duos Technologies Group, Inc. Common Stock",$2.55,UNCH,--,"18,208,380",/market-activity/stocks/duot
DV,"DoubleVerify Holdings, Inc. Common Stock",$26.40,0.20,0.763%,"4,352,702,297",/market-activity/stocks/dv
DVA,DaVita Inc. Common Stock,$75.01,1.28,1.736%,"6,758,401,000",/market-activity/stocks/dva
